-- This file and its contents are licensed under the Timescale License.
-- Please see the included NOTICE for copyright information and
-- LICENSE-TIMESCALE for a copy of the license.
--
-- Setup
--
\c :TEST_DBNAME :ROLE_SUPERUSER
CREATE OR REPLACE FUNCTION ts_bgw_db_scheduler_test_run_and_wait_for_scheduler_finish(timeout INT = -1) RETURNS VOID
AS :MODULE_PATHNAME LANGUAGE C VOLATILE;
CREATE OR REPLACE FUNCTION ts_bgw_db_scheduler_test_run(timeout INT = -1, mock_start_time INT = 0) RETURNS VOID
AS :MODULE_PATHNAME LANGUAGE C VOLATILE;
CREATE OR REPLACE FUNCTION ts_bgw_db_scheduler_test_wait_for_scheduler_finish() RETURNS VOID
AS :MODULE_PATHNAME LANGUAGE C VOLATILE;
CREATE OR REPLACE FUNCTION ts_bgw_params_create() RETURNS VOID
AS :MODULE_PATHNAME LANGUAGE C VOLATILE;
CREATE OR REPLACE FUNCTION ts_bgw_params_destroy() RETURNS VOID
AS :MODULE_PATHNAME LANGUAGE C VOLATILE;
CREATE OR REPLACE FUNCTION ts_bgw_params_reset_time(set_time BIGINT = 0, wait BOOLEAN = false) RETURNS VOID
AS :MODULE_PATHNAME LANGUAGE C VOLATILE;
\set WAIT_ON_JOB 0
\set IMMEDIATELY_SET_UNTIL 1
\set WAIT_FOR_OTHER_TO_ADVANCE 2
-- Remove any default jobs, e.g., telemetry
SELECT _timescaledb_internal.stop_background_workers();
 stop_background_workers 
-------------------------
 t
(1 row)

DELETE FROM _timescaledb_config.bgw_job WHERE TRUE;
TRUNCATE _timescaledb_internal.bgw_job_stat;
\c :TEST_DBNAME :ROLE_DEFAULT_PERM_USER
CREATE TABLE public.bgw_log(
    msg_no INT,
    mock_time BIGINT,
    application_name TEXT,
    msg TEXT
);
CREATE VIEW sorted_bgw_log AS
    SELECT * FROM bgw_log ORDER BY mock_time, application_name COLLATE "C", msg_no;
CREATE TABLE public.bgw_dsm_handle_store(
    handle BIGINT
);
INSERT INTO public.bgw_dsm_handle_store VALUES (0);
SELECT ts_bgw_params_create();
 ts_bgw_params_create 
----------------------
 
(1 row)

SELECT * FROM _timescaledb_config.bgw_job;
 id | application_name | job_type | schedule_interval | max_runtime | max_retries | retry_period 
----+------------------+----------+-------------------+-------------+-------------+--------------
(0 rows)

SELECT * FROM timescaledb_information.drop_chunks_policies;
 hypertable | older_than | cascade | job_id | schedule_interval | max_runtime | max_retries | retry_period | cascade_to_materializations 
------------+------------+---------+--------+-------------------+-------------+-------------+--------------+-----------------------------
(0 rows)

SELECT * FROM timescaledb_information.reorder_policies;
 hypertable | hypertable_index_name | job_id | schedule_interval | max_runtime | max_retries | retry_period 
------------+-----------------------+--------+-------------------+-------------+-------------+--------------
(0 rows)

SELECT * FROM timescaledb_information.policy_stats;
 hypertable | job_id | job_type | last_run_success | last_finish | last_successful_finish | last_start | next_start | total_runs | total_failures 
------------+--------+----------+------------------+-------------+------------------------+------------+------------+------------+----------------
(0 rows)

\c :TEST_DBNAME :ROLE_DEFAULT_PERM_USER
------------------------------
-- test reorder policy runs --
------------------------------
CREATE TABLE test_reorder_table(time int, chunk_id int);
SELECT create_hypertable('test_reorder_table', 'time', chunk_time_interval => 1);
NOTICE:  adding not-null constraint to column "time"
        create_hypertable        
---------------------------------
 (1,public,test_reorder_table,t)
(1 row)

-- These inserts should create 5 different chunks
INSERT INTO test_reorder_table VALUES (1, 1);
INSERT INTO test_reorder_table VALUES (2, 2);
INSERT INTO test_reorder_table VALUES (3, 3);
INSERT INTO test_reorder_table VALUES (4, 4);
INSERT INTO test_reorder_table VALUES (5, 5);
SELECT COUNT(*) FROM _timescaledb_catalog.chunk as c, _timescaledb_catalog.hypertable as ht where c.hypertable_id = ht.id and ht.table_name='test_reorder_table';
 count 
-------
     5
(1 row)

SELECT json_object_field(get_telemetry_report(always_display_report := true)::json,'num_reorder_policies');
 json_object_field 
-------------------
 "0"
(1 row)

select add_reorder_policy('test_reorder_table', 'test_reorder_table_time_idx') as reorder_job_id \gset
WARNING:  Timescale License expired
SELECT json_object_field(get_telemetry_report(always_display_report := true)::json,'num_reorder_policies');
 json_object_field 
-------------------
 "1"
(1 row)

-- policy was created
select * from _timescaledb_config.bgw_policy_reorder where job_id=:reorder_job_id;
 job_id | hypertable_id |    hypertable_index_name    
--------+---------------+-----------------------------
   1000 |             1 | test_reorder_table_time_idx
(1 row)

-- job was created
SELECT * FROM _timescaledb_config.bgw_job where id=:reorder_job_id;
  id  |    application_name    | job_type | schedule_interval | max_runtime | max_retries | retry_period 
------+------------------------+----------+-------------------+-------------+-------------+--------------
 1000 | Reorder Background Job | reorder  | @ 4 days          | @ 0         |          -1 | @ 5 mins
(1 row)

-- no stats
SELECT job_id, next_start, last_finish as until_next, last_run_success, total_runs, total_successes, total_failures, total_crashes
    FROM _timescaledb_internal.bgw_job_stat
    ORDER BY job_id;
 job_id | next_start | until_next | last_run_success | total_runs | total_successes | total_failures | total_crashes 
--------+------------+------------+------------------+------------+-----------------+----------------+---------------
(0 rows)

-- nothing clustered
SELECT indexrelid::regclass, indisclustered
    FROM pg_index
    WHERE indisclustered = true ORDER BY 1;
 indexrelid | indisclustered 
------------+----------------
(0 rows)

-- run first time
SELECT ts_bgw_db_scheduler_test_run_and_wait_for_scheduler_finish(25);
 ts_bgw_db_scheduler_test_run_and_wait_for_scheduler_finish 
------------------------------------------------------------
 
(1 row)

SELECT * FROM sorted_bgw_log;
 msg_no | mock_time | application_name |                    msg                     
--------+-----------+------------------+--------------------------------------------
      0 |         0 | DB Scheduler     | [TESTING] Registered new background worker
      1 |         0 | DB Scheduler     | [TESTING] Wait until 25000, started at 0
(2 rows)

SELECT * FROM _timescaledb_config.bgw_job where id=:reorder_job_id;
  id  |    application_name    | job_type | schedule_interval | max_runtime | max_retries | retry_period 
------+------------------------+----------+-------------------+-------------+-------------+--------------
 1000 | Reorder Background Job | reorder  | @ 4 days          | @ 0         |          -1 | @ 5 mins
(1 row)

-- job ran once, successfully
SELECT job_id, next_start, last_finish as until_next, last_run_success, total_runs, total_successes, total_failures, total_crashes
    FROM _timescaledb_internal.bgw_job_stat
    where job_id=:reorder_job_id;
 job_id |          next_start          |          until_next          | last_run_success | total_runs | total_successes | total_failures | total_crashes 
--------+------------------------------+------------------------------+------------------+------------+-----------------+----------------+---------------
   1000 | Fri Dec 31 16:00:00 1999 PST | Fri Dec 31 16:00:00 1999 PST | t                |          1 |               1 |              0 |             0
(1 row)

-- first chunk reordered
SELECT indexrelid::regclass, indisclustered
    FROM pg_index
    WHERE indisclustered = true ORDER BY 1;
                             indexrelid                             | indisclustered 
--------------------------------------------------------------------+----------------
 _timescaledb_internal._hyper_1_1_chunk_test_reorder_table_time_idx | t
(1 row)

-- second call to scheduler should immediately run reorder again, due to catchup
SELECT ts_bgw_db_scheduler_test_run_and_wait_for_scheduler_finish(25);
 ts_bgw_db_scheduler_test_run_and_wait_for_scheduler_finish 
------------------------------------------------------------
 
(1 row)

SELECT * FROM sorted_bgw_log;
 msg_no | mock_time | application_name |                     msg                      
--------+-----------+------------------+----------------------------------------------
      0 |         0 | DB Scheduler     | [TESTING] Registered new background worker
      1 |         0 | DB Scheduler     | [TESTING] Wait until 25000, started at 0
      0 |     25000 | DB Scheduler     | [TESTING] Registered new background worker
      1 |     25000 | DB Scheduler     | [TESTING] Wait until 50000, started at 25000
(4 rows)

SELECT * FROM _timescaledb_config.bgw_job where id=:reorder_job_id;
  id  |    application_name    | job_type | schedule_interval | max_runtime | max_retries | retry_period 
------+------------------------+----------+-------------------+-------------+-------------+--------------
 1000 | Reorder Background Job | reorder  | @ 4 days          | @ 0         |          -1 | @ 5 mins
(1 row)

-- two runs
SELECT job_id, next_start, last_finish as until_next, last_run_success, total_runs, total_successes, total_failures, total_crashes
    FROM _timescaledb_internal.bgw_job_stat
    where job_id=:reorder_job_id;
 job_id |            next_start            |            until_next            | last_run_success | total_runs | total_successes | total_failures | total_crashes 
--------+----------------------------------+----------------------------------+------------------+------------+-----------------+----------------+---------------
   1000 | Fri Dec 31 16:00:00.025 1999 PST | Fri Dec 31 16:00:00.025 1999 PST | t                |          2 |               2 |              0 |             0
(1 row)

-- two chunks clustered
SELECT indexrelid::regclass, indisclustered
    FROM pg_index
    WHERE indisclustered = true ORDER BY 1;
                             indexrelid                             | indisclustered 
--------------------------------------------------------------------+----------------
 _timescaledb_internal._hyper_1_1_chunk_test_reorder_table_time_idx | t
 _timescaledb_internal._hyper_1_2_chunk_test_reorder_table_time_idx | t
(2 rows)

-- third call to scheduler should immediately run reorder again, due to catchup
SELECT ts_bgw_db_scheduler_test_run_and_wait_for_scheduler_finish(50);
 ts_bgw_db_scheduler_test_run_and_wait_for_scheduler_finish 
------------------------------------------------------------
 
(1 row)

-- job info is gone
SELECT * FROM sorted_bgw_log;
 msg_no | mock_time | application_name |                      msg                      
--------+-----------+------------------+-----------------------------------------------
      0 |         0 | DB Scheduler     | [TESTING] Registered new background worker
      1 |         0 | DB Scheduler     | [TESTING] Wait until 25000, started at 0
      0 |     25000 | DB Scheduler     | [TESTING] Registered new background worker
      1 |     25000 | DB Scheduler     | [TESTING] Wait until 50000, started at 25000
      0 |     50000 | DB Scheduler     | [TESTING] Registered new background worker
      1 |     50000 | DB Scheduler     | [TESTING] Wait until 100000, started at 50000
(6 rows)

SELECT * FROM _timescaledb_config.bgw_job where id=:reorder_job_id;
  id  |    application_name    | job_type | schedule_interval | max_runtime | max_retries | retry_period 
------+------------------------+----------+-------------------+-------------+-------------+--------------
 1000 | Reorder Background Job | reorder  | @ 4 days          | @ 0         |          -1 | @ 5 mins
(1 row)

SELECT *
    FROM _timescaledb_internal.bgw_job_stat
    where job_id=:reorder_job_id;
 job_id |           last_start            |           last_finish           |           next_start            |     last_successful_finish      | last_run_success | total_runs | total_duration | total_successes | total_failures | total_crashes | consecutive_failures | consecutive_crashes 
--------+---------------------------------+---------------------------------+---------------------------------+---------------------------------+------------------+------------+----------------+-----------------+----------------+---------------+----------------------+---------------------
   1000 | Fri Dec 31 16:00:00.05 1999 PST | Fri Dec 31 16:00:00.05 1999 PST | Tue Jan 04 16:00:00.05 2000 PST | Fri Dec 31 16:00:00.05 1999 PST | t                |          3 | @ 0            |               3 |              0 |             0 |                    0 |                   0
(1 row)

-- three chunks clustered
SELECT indexrelid::regclass, indisclustered
    FROM pg_index
    WHERE indisclustered = true ORDER BY 1;
                             indexrelid                             | indisclustered 
--------------------------------------------------------------------+----------------
 _timescaledb_internal._hyper_1_1_chunk_test_reorder_table_time_idx | t
 _timescaledb_internal._hyper_1_2_chunk_test_reorder_table_time_idx | t
 _timescaledb_internal._hyper_1_3_chunk_test_reorder_table_time_idx | t
(3 rows)

-- running is a nop
SELECT ts_bgw_db_scheduler_test_run_and_wait_for_scheduler_finish(100);
 ts_bgw_db_scheduler_test_run_and_wait_for_scheduler_finish 
------------------------------------------------------------
 
(1 row)

SELECT * FROM sorted_bgw_log;
 msg_no | mock_time | application_name |                      msg                       
--------+-----------+------------------+------------------------------------------------
      0 |         0 | DB Scheduler     | [TESTING] Registered new background worker
      1 |         0 | DB Scheduler     | [TESTING] Wait until 25000, started at 0
      0 |     25000 | DB Scheduler     | [TESTING] Registered new background worker
      1 |     25000 | DB Scheduler     | [TESTING] Wait until 50000, started at 25000
      0 |     50000 | DB Scheduler     | [TESTING] Registered new background worker
      1 |     50000 | DB Scheduler     | [TESTING] Wait until 100000, started at 50000
      0 |    100000 | DB Scheduler     | [TESTING] Wait until 200000, started at 100000
(7 rows)

SELECT * FROM _timescaledb_config.bgw_job where id=:reorder_job_id;
  id  |    application_name    | job_type | schedule_interval | max_runtime | max_retries | retry_period 
------+------------------------+----------+-------------------+-------------+-------------+--------------
 1000 | Reorder Background Job | reorder  | @ 4 days          | @ 0         |          -1 | @ 5 mins
(1 row)

SELECT *
    FROM _timescaledb_internal.bgw_job_stat
    where job_id=:reorder_job_id;
 job_id |           last_start            |           last_finish           |           next_start            |     last_successful_finish      | last_run_success | total_runs | total_duration | total_successes | total_failures | total_crashes | consecutive_failures | consecutive_crashes 
--------+---------------------------------+---------------------------------+---------------------------------+---------------------------------+------------------+------------+----------------+-----------------+----------------+---------------+----------------------+---------------------
   1000 | Fri Dec 31 16:00:00.05 1999 PST | Fri Dec 31 16:00:00.05 1999 PST | Tue Jan 04 16:00:00.05 2000 PST | Fri Dec 31 16:00:00.05 1999 PST | t                |          3 | @ 0            |               3 |              0 |             0 |                    0 |                   0
(1 row)

-- still have 3 chunks clustered
SELECT indexrelid::regclass, indisclustered
    FROM pg_index
    WHERE indisclustered = true ORDER BY 1;
                             indexrelid                             | indisclustered 
--------------------------------------------------------------------+----------------
 _timescaledb_internal._hyper_1_1_chunk_test_reorder_table_time_idx | t
 _timescaledb_internal._hyper_1_2_chunk_test_reorder_table_time_idx | t
 _timescaledb_internal._hyper_1_3_chunk_test_reorder_table_time_idx | t
(3 rows)

--check that views work correctly
SELECT * FROM timescaledb_information.reorder_policies;
     hypertable     |    hypertable_index_name    | job_id | schedule_interval | max_runtime | max_retries | retry_period 
--------------------+-----------------------------+--------+-------------------+-------------+-------------+--------------
 test_reorder_table | test_reorder_table_time_idx |   1000 | @ 4 days          | @ 0         |          -1 | @ 5 mins
(1 row)

SELECT * FROM timescaledb_information.policy_stats;
     hypertable     | job_id | job_type | last_run_success |           last_finish           |     last_successful_finish      |           last_start            |           next_start            | total_runs | total_failures 
--------------------+--------+----------+------------------+---------------------------------+---------------------------------+---------------------------------+---------------------------------+------------+----------------
 test_reorder_table |   1000 | reorder  | t                | Fri Dec 31 16:00:00.05 1999 PST | Fri Dec 31 16:00:00.05 1999 PST | Fri Dec 31 16:00:00.05 1999 PST | Tue Jan 04 16:00:00.05 2000 PST |          3 |              0
(1 row)

-- test deleting the policy
SELECT remove_reorder_policy('test_reorder_table');
 remove_reorder_policy 
-----------------------
 
(1 row)

select * from _timescaledb_config.bgw_policy_reorder where job_id=:reorder_job_id;
 job_id | hypertable_id | hypertable_index_name 
--------+---------------+-----------------------
(0 rows)

SELECT * FROM _timescaledb_config.bgw_job where id=:reorder_job_id;
 id | application_name | job_type | schedule_interval | max_runtime | max_retries | retry_period 
----+------------------+----------+-------------------+-------------+-------------+--------------
(0 rows)

SELECT job_id, next_start, last_finish as until_next, last_run_success, total_runs, total_successes, total_failures, total_crashes
    FROM _timescaledb_internal.bgw_job_stat
    where job_id=:reorder_job_id;
 job_id | next_start | until_next | last_run_success | total_runs | total_successes | total_failures | total_crashes 
--------+------------+------------+------------------+------------+-----------------+----------------+---------------
(0 rows)

SELECT ts_bgw_db_scheduler_test_run_and_wait_for_scheduler_finish(125);
 ts_bgw_db_scheduler_test_run_and_wait_for_scheduler_finish 
------------------------------------------------------------
 
(1 row)

SELECT * FROM sorted_bgw_log;
 msg_no | mock_time | application_name |                      msg                       
--------+-----------+------------------+------------------------------------------------
      0 |         0 | DB Scheduler     | [TESTING] Registered new background worker
      1 |         0 | DB Scheduler     | [TESTING] Wait until 25000, started at 0
      0 |     25000 | DB Scheduler     | [TESTING] Registered new background worker
      1 |     25000 | DB Scheduler     | [TESTING] Wait until 50000, started at 25000
      0 |     50000 | DB Scheduler     | [TESTING] Registered new background worker
      1 |     50000 | DB Scheduler     | [TESTING] Wait until 100000, started at 50000
      0 |    100000 | DB Scheduler     | [TESTING] Wait until 200000, started at 100000
      0 |    200000 | DB Scheduler     | [TESTING] Wait until 325000, started at 200000
(8 rows)

SELECT * FROM _timescaledb_config.bgw_job where id=:reorder_job_id;
 id | application_name | job_type | schedule_interval | max_runtime | max_retries | retry_period 
----+------------------+----------+-------------------+-------------+-------------+--------------
(0 rows)

-- still only 3 chunks clustered
SELECT indexrelid::regclass, indisclustered
    FROM pg_index
    WHERE indisclustered = true ORDER BY 1;
                             indexrelid                             | indisclustered 
--------------------------------------------------------------------+----------------
 _timescaledb_internal._hyper_1_1_chunk_test_reorder_table_time_idx | t
 _timescaledb_internal._hyper_1_2_chunk_test_reorder_table_time_idx | t
 _timescaledb_internal._hyper_1_3_chunk_test_reorder_table_time_idx | t
(3 rows)

\c :TEST_DBNAME :ROLE_SUPERUSER
TRUNCATE bgw_log;
TRUNCATE _timescaledb_internal.bgw_job_stat;
DELETE FROM _timescaledb_config.bgw_job;
SELECT ts_bgw_params_reset_time();
 ts_bgw_params_reset_time 
--------------------------
 
(1 row)

\c :TEST_DBNAME :ROLE_DEFAULT_PERM_USER
-----------------------------------
-- test drop chunnks policy runs --
-----------------------------------
CREATE TABLE test_drop_chunks_table(time timestamptz, drop_order int);
SELECT create_hypertable('test_drop_chunks_table', 'time', chunk_time_interval => INTERVAL '1 week');
NOTICE:  adding not-null constraint to column "time"
          create_hypertable          
-------------------------------------
 (2,public,test_drop_chunks_table,t)
(1 row)

-- These inserts should create 5 different chunks
INSERT INTO test_drop_chunks_table VALUES (now() - INTERVAL '2 month',  4);
INSERT INTO test_drop_chunks_table VALUES (now(),                       5);
INSERT INTO test_drop_chunks_table VALUES (now() - INTERVAL '6 months', 2);
INSERT INTO test_drop_chunks_table VALUES (now() - INTERVAL '4 months', 3);
INSERT INTO test_drop_chunks_table VALUES (now() - INTERVAL '8 months', 1);
SELECT show_chunks('test_drop_chunks_table');
               show_chunks               
-----------------------------------------
 _timescaledb_internal._hyper_2_6_chunk
 _timescaledb_internal._hyper_2_7_chunk
 _timescaledb_internal._hyper_2_8_chunk
 _timescaledb_internal._hyper_2_9_chunk
 _timescaledb_internal._hyper_2_10_chunk
(5 rows)

SELECT COUNT(*) FROM _timescaledb_catalog.chunk as c, _timescaledb_catalog.hypertable as ht where c.hypertable_id = ht.id and ht.table_name='test_drop_chunks_table';
 count 
-------
     5
(1 row)

SELECT json_object_field(get_telemetry_report(always_display_report := true)::json,'num_drop_chunks_policies');
 json_object_field 
-------------------
 "0"
(1 row)

SELECT add_drop_chunks_policy('test_drop_chunks_table', INTERVAL '4 months') as drop_chunks_job_id \gset
WARNING:  Timescale License expired
SELECT json_object_field(get_telemetry_report(always_display_report := true)::json,'num_drop_chunks_policies');
 json_object_field 
-------------------
 "1"
(1 row)

SELECT alter_job_schedule(:drop_chunks_job_id, schedule_interval => INTERVAL '1 second');
                 alter_job_schedule                  
-----------------------------------------------------
 (1001,"@ 1 sec","@ 5 mins",-1,"@ 5 mins",-infinity)
(1 row)

select * from _timescaledb_config.bgw_policy_drop_chunks where job_id=:drop_chunks_job_id;
 job_id | hypertable_id |   older_than    | cascade | cascade_to_materializations 
--------+---------------+-----------------+---------+-----------------------------
   1001 |             2 | (t,"@ 4 mons",) | f       | f
(1 row)

SELECT * FROM _timescaledb_config.bgw_job where id=:drop_chunks_job_id;
  id  |      application_name      |  job_type   | schedule_interval | max_runtime | max_retries | retry_period 
------+----------------------------+-------------+-------------------+-------------+-------------+--------------
 1001 | Drop Chunks Background Job | drop_chunks | @ 1 sec           | @ 5 mins    |          -1 | @ 5 mins
(1 row)

-- no stats
SELECT job_id, next_start, last_finish as until_next, last_run_success, total_runs, total_successes, total_failures, total_crashes
    FROM _timescaledb_internal.bgw_job_stat
    WHERE job_id=:drop_chunks_job_id;
 job_id | next_start | until_next | last_run_success | total_runs | total_successes | total_failures | total_crashes 
--------+------------+------------+------------------+------------+-----------------+----------------+---------------
(0 rows)

-- all chunks are there
SELECT show_chunks('test_drop_chunks_table');
               show_chunks               
-----------------------------------------
 _timescaledb_internal._hyper_2_6_chunk
 _timescaledb_internal._hyper_2_7_chunk
 _timescaledb_internal._hyper_2_8_chunk
 _timescaledb_internal._hyper_2_9_chunk
 _timescaledb_internal._hyper_2_10_chunk
(5 rows)

-- run first time
SELECT ts_bgw_db_scheduler_test_run_and_wait_for_scheduler_finish(25);
 ts_bgw_db_scheduler_test_run_and_wait_for_scheduler_finish 
------------------------------------------------------------
 
(1 row)

SELECT * FROM sorted_bgw_log;
 msg_no | mock_time | application_name |                    msg                     
--------+-----------+------------------+--------------------------------------------
      0 |         0 | DB Scheduler     | [TESTING] Registered new background worker
      1 |         0 | DB Scheduler     | [TESTING] Wait until 25000, started at 0
(2 rows)

SELECT * FROM _timescaledb_config.bgw_job where id=:drop_chunks_job_id;
  id  |      application_name      |  job_type   | schedule_interval | max_runtime | max_retries | retry_period 
------+----------------------------+-------------+-------------------+-------------+-------------+--------------
 1001 | Drop Chunks Background Job | drop_chunks | @ 1 sec           | @ 5 mins    |          -1 | @ 5 mins
(1 row)

-- job ran once, successfully
SELECT job_id, time_bucket('1m',next_start) AS next_start, time_bucket('1m',last_finish) as until_next, last_run_success, total_runs, total_successes, total_failures, total_crashes
    FROM _timescaledb_internal.bgw_job_stat
    where job_id=:drop_chunks_job_id;
 job_id |          next_start          |          until_next          | last_run_success | total_runs | total_successes | total_failures | total_crashes 
--------+------------------------------+------------------------------+------------------+------------+-----------------+----------------+---------------
   1001 | Fri Dec 31 16:00:00 1999 PST | Fri Dec 31 16:00:00 1999 PST | t                |          1 |               1 |              0 |             0
(1 row)

-- chunks 8 and 10 dropped
SELECT show_chunks('test_drop_chunks_table');
              show_chunks               
----------------------------------------
 _timescaledb_internal._hyper_2_6_chunk
 _timescaledb_internal._hyper_2_7_chunk
 _timescaledb_internal._hyper_2_9_chunk
(3 rows)

-- job doesn't run again immediately
SELECT ts_bgw_db_scheduler_test_run_and_wait_for_scheduler_finish(25);
 ts_bgw_db_scheduler_test_run_and_wait_for_scheduler_finish 
------------------------------------------------------------
 
(1 row)

SELECT * FROM sorted_bgw_log;
 msg_no | mock_time | application_name |                     msg                      
--------+-----------+------------------+----------------------------------------------
      0 |         0 | DB Scheduler     | [TESTING] Registered new background worker
      1 |         0 | DB Scheduler     | [TESTING] Wait until 25000, started at 0
      0 |     25000 | DB Scheduler     | [TESTING] Wait until 50000, started at 25000
(3 rows)

SELECT * FROM _timescaledb_config.bgw_job where id=:drop_chunks_job_id;
  id  |      application_name      |  job_type   | schedule_interval | max_runtime | max_retries | retry_period 
------+----------------------------+-------------+-------------------+-------------+-------------+--------------
 1001 | Drop Chunks Background Job | drop_chunks | @ 1 sec           | @ 5 mins    |          -1 | @ 5 mins
(1 row)

-- still only 1 run
SELECT job_id, time_bucket('1m',next_start) AS next_start, time_bucket('1m',last_finish) as until_next, last_run_success, total_runs, total_successes, total_failures, total_crashes
    FROM _timescaledb_internal.bgw_job_stat
    where job_id=:drop_chunks_job_id;
 job_id |          next_start          |          until_next          | last_run_success | total_runs | total_successes | total_failures | total_crashes 
--------+------------------------------+------------------------------+------------------+------------+-----------------+----------------+---------------
   1001 | Fri Dec 31 16:00:00 1999 PST | Fri Dec 31 16:00:00 1999 PST | t                |          1 |               1 |              0 |             0
(1 row)

-- same chunks
SELECT show_chunks('test_drop_chunks_table');
              show_chunks               
----------------------------------------
 _timescaledb_internal._hyper_2_6_chunk
 _timescaledb_internal._hyper_2_7_chunk
 _timescaledb_internal._hyper_2_9_chunk
(3 rows)

-- a new chunk older than the drop date will be dropped
INSERT INTO test_drop_chunks_table VALUES (now() - INTERVAL '12 months', 0);
SELECT show_chunks('test_drop_chunks_table');
               show_chunks               
-----------------------------------------
 _timescaledb_internal._hyper_2_6_chunk
 _timescaledb_internal._hyper_2_7_chunk
 _timescaledb_internal._hyper_2_9_chunk
 _timescaledb_internal._hyper_2_11_chunk
(4 rows)

SELECT ts_bgw_db_scheduler_test_run_and_wait_for_scheduler_finish(10000);
 ts_bgw_db_scheduler_test_run_and_wait_for_scheduler_finish 
------------------------------------------------------------
 
(1 row)

SELECT * FROM sorted_bgw_log;
 msg_no | mock_time | application_name |                        msg                        
--------+-----------+------------------+---------------------------------------------------
      0 |         0 | DB Scheduler     | [TESTING] Registered new background worker
      1 |         0 | DB Scheduler     | [TESTING] Wait until 25000, started at 0
      0 |     25000 | DB Scheduler     | [TESTING] Wait until 50000, started at 25000
      0 |     50000 | DB Scheduler     | [TESTING] Wait until 1000000, started at 50000
      1 |   1000000 | DB Scheduler     | [TESTING] Registered new background worker
      2 |   1000000 | DB Scheduler     | [TESTING] Wait until 10050000, started at 1000000
(6 rows)

SELECT * FROM _timescaledb_config.bgw_job where id=:drop_chunks_job_id;
  id  |      application_name      |  job_type   | schedule_interval | max_runtime | max_retries | retry_period 
------+----------------------------+-------------+-------------------+-------------+-------------+--------------
 1001 | Drop Chunks Background Job | drop_chunks | @ 1 sec           | @ 5 mins    |          -1 | @ 5 mins
(1 row)

-- 2 runs
SELECT job_id, time_bucket('1m',next_start) AS next_start, time_bucket('1m',last_finish) as until_next, last_run_success, total_runs, total_successes, total_failures, total_crashes
    FROM _timescaledb_internal.bgw_job_stat
    where job_id=:drop_chunks_job_id;
 job_id |          next_start          |          until_next          | last_run_success | total_runs | total_successes | total_failures | total_crashes 
--------+------------------------------+------------------------------+------------------+------------+-----------------+----------------+---------------
   1001 | Fri Dec 31 16:00:00 1999 PST | Fri Dec 31 16:00:00 1999 PST | t                |          2 |               2 |              0 |             0
(1 row)

SELECT show_chunks('test_drop_chunks_table');
              show_chunks               
----------------------------------------
 _timescaledb_internal._hyper_2_6_chunk
 _timescaledb_internal._hyper_2_7_chunk
 _timescaledb_internal._hyper_2_9_chunk
(3 rows)

--test that views work
SELECT * FROM timescaledb_information.drop_chunks_policies;
       hypertable       |   older_than    | cascade | job_id | schedule_interval | max_runtime | max_retries | retry_period | cascade_to_materializations 
------------------------+-----------------+---------+--------+-------------------+-------------+-------------+--------------+-----------------------------
 test_drop_chunks_table | (t,"@ 4 mons",) | f       |   1001 | @ 1 sec           | @ 5 mins    |          -1 | @ 5 mins     | f
(1 row)

SELECT * FROM timescaledb_information.policy_stats;
       hypertable       | job_id |  job_type   | last_run_success |         last_finish          |    last_successful_finish    |          last_start          |          next_start          | total_runs | total_failures 
------------------------+--------+-------------+------------------+------------------------------+------------------------------+------------------------------+------------------------------+------------+----------------
 test_drop_chunks_table |   1001 | drop_chunks | t                | Fri Dec 31 16:00:01 1999 PST | Fri Dec 31 16:00:01 1999 PST | Fri Dec 31 16:00:01 1999 PST | Fri Dec 31 16:00:02 1999 PST |          2 |              0
(1 row)

-- continuous aggregate blocks drop_chunks
INSERT INTO test_drop_chunks_table VALUES (now() - INTERVAL '12 months', 0);
CREATE VIEW tdc_view
  WITH (timescaledb.continuous)
  AS SELECT time_bucket('1 hour', time), count(drop_order)
     FROM test_drop_chunks_table
     GROUP BY 1;
SELECT show_chunks('test_drop_chunks_table');
               show_chunks               
-----------------------------------------
 _timescaledb_internal._hyper_2_6_chunk
 _timescaledb_internal._hyper_2_7_chunk
 _timescaledb_internal._hyper_2_9_chunk
 _timescaledb_internal._hyper_2_12_chunk
(4 rows)

SELECT ts_bgw_db_scheduler_test_run_and_wait_for_scheduler_finish(10000);
 ts_bgw_db_scheduler_test_run_and_wait_for_scheduler_finish 
------------------------------------------------------------
 
(1 row)

SELECT * FROM sorted_bgw_log;
 msg_no | mock_time | application_name |                        msg                         
--------+-----------+------------------+----------------------------------------------------
      0 |         0 | DB Scheduler     | [TESTING] Registered new background worker
      1 |         0 | DB Scheduler     | [TESTING] Wait until 25000, started at 0
      0 |     25000 | DB Scheduler     | [TESTING] Wait until 50000, started at 25000
      0 |     50000 | DB Scheduler     | [TESTING] Wait until 1000000, started at 50000
      1 |   1000000 | DB Scheduler     | [TESTING] Registered new background worker
      2 |   1000000 | DB Scheduler     | [TESTING] Wait until 10050000, started at 1000000
      0 |  10050000 | DB Scheduler     | [TESTING] Registered new background worker
      1 |  10050000 | DB Scheduler     | [TESTING] Registered new background worker
      2 |  10050000 | DB Scheduler     | [TESTING] Wait until 20050000, started at 10050000
(9 rows)

SELECT * FROM _timescaledb_config.bgw_job where id=:drop_chunks_job_id;
  id  |      application_name      |  job_type   | schedule_interval | max_runtime | max_retries | retry_period 
------+----------------------------+-------------+-------------------+-------------+-------------+--------------
 1001 | Drop Chunks Background Job | drop_chunks | @ 1 sec           | @ 5 mins    |          -1 | @ 5 mins
(1 row)

-- should now have a failure
SELECT job_id, time_bucket('1m',next_start) AS next_start, time_bucket('1m',last_finish) as until_next, last_run_success, total_runs, total_successes, total_failures, total_crashes
    FROM _timescaledb_internal.bgw_job_stat
    where job_id=:drop_chunks_job_id;
 job_id |          next_start          |          until_next          | last_run_success | total_runs | total_successes | total_failures | total_crashes 
--------+------------------------------+------------------------------+------------------+------------+-----------------+----------------+---------------
   1001 | Fri Dec 31 16:00:00 1999 PST | Fri Dec 31 16:00:00 1999 PST | f                |          3 |               2 |              1 |             0
(1 row)

SELECT show_chunks('test_drop_chunks_table');
               show_chunks               
-----------------------------------------
 _timescaledb_internal._hyper_2_6_chunk
 _timescaledb_internal._hyper_2_7_chunk
 _timescaledb_internal._hyper_2_9_chunk
 _timescaledb_internal._hyper_2_12_chunk
(4 rows)

--drop the view to allow drop chunks to work
DROP VIEW tdc_view CASCADE;
NOTICE:  drop cascades to table _timescaledb_internal._hyper_3_13_chunk
--turn on compression and compress all chunks
ALTER TABLE test_drop_chunks_table set (timescaledb.compress, timescaledb.compress_orderby = 'time DESC');
SELECT count(compress_chunk(chunk.schema_name|| '.' || chunk.table_name)) as count_compressed
FROM _timescaledb_catalog.chunk chunk
INNER JOIN _timescaledb_catalog.hypertable hypertable ON (chunk.hypertable_id = hypertable.id)
WHERE hypertable.table_name like 'test_drop_chunks_table' and chunk.compressed_chunk_id IS NULL;
 count_compressed 
------------------
                4
(1 row)

--make sure same # of compressed and uncompressed chunks before policy
SELECT count(*) as count_chunks_uncompressed
FROM _timescaledb_catalog.chunk chunk
INNER JOIN _timescaledb_catalog.hypertable hypertable ON (chunk.hypertable_id = hypertable.id)
WHERE hypertable.table_name like 'test_drop_chunks_table';
 count_chunks_uncompressed 
---------------------------
                         4
(1 row)

SELECT count(*) as count_chunks_compressed
FROM _timescaledb_catalog.chunk chunk
INNER JOIN _timescaledb_catalog.hypertable comp_hyper ON (chunk.hypertable_id = comp_hyper.id)
INNER JOIN _timescaledb_catalog.hypertable uncomp_hyper ON (comp_hyper.id = uncomp_hyper.compressed_hypertable_id)
WHERE uncomp_hyper.table_name like 'test_drop_chunks_table';
 count_chunks_compressed 
-------------------------
                       4
(1 row)

SELECT ts_bgw_db_scheduler_test_run_and_wait_for_scheduler_finish(1000000);
 ts_bgw_db_scheduler_test_run_and_wait_for_scheduler_finish 
------------------------------------------------------------
 
(1 row)

--make sure same # of compressed and uncompressed chunks after policy, reduced by 1
SELECT count(*) as count_chunks_uncompressed
FROM _timescaledb_catalog.chunk chunk
INNER JOIN _timescaledb_catalog.hypertable hypertable ON (chunk.hypertable_id = hypertable.id)
WHERE hypertable.table_name like 'test_drop_chunks_table';
 count_chunks_uncompressed 
---------------------------
                         3
(1 row)

SELECT count(*) as count_chunks_compressed
FROM _timescaledb_catalog.chunk chunk
INNER JOIN _timescaledb_catalog.hypertable comp_hyper ON (chunk.hypertable_id = comp_hyper.id)
INNER JOIN _timescaledb_catalog.hypertable uncomp_hyper ON (comp_hyper.id = uncomp_hyper.compressed_hypertable_id)
WHERE uncomp_hyper.table_name like 'test_drop_chunks_table';
 count_chunks_compressed 
-------------------------
                       3
(1 row)

