-- This file and its contents are licensed under the Timescale License.
-- Please see the included NOTICE for copyright information and
-- LICENSE-TIMESCALE for a copy of the license.
\set IS_DISTRIBUTED FALSE
\set IS_TIME_DIMENSION FALSE
\ir include/cagg_migrate_common.sql
-- This file and its contents are licensed under the Timescale License.
-- Please see the included NOTICE for copyright information and
-- LICENSE-TIMESCALE for a copy of the license.
\c :TEST_DBNAME :ROLE_CLUSTER_SUPERUSER
\if :IS_DISTRIBUTED
\echo 'Running distributed hypertable tests'
\else
\echo 'Running local hypertable tests'
Running local hypertable tests
\endif
\if :IS_TIME_DIMENSION
    \set TIME_DATATYPE TIMESTAMPTZ
\else
    \set TIME_DATATYPE INTEGER
\endif
CREATE TABLE conditions (
    "time" :TIME_DATATYPE NOT NULL,
    temperature NUMERIC
);
\if :IS_DISTRIBUTED
    \if :IS_TIME_DIMENSION
        SELECT table_name FROM create_distributed_hypertable('conditions', 'time', replication_factor => 2);
    \else
        SELECT table_name FROM create_distributed_hypertable('conditions', 'time', chunk_time_interval => 10, replication_factor => 2);
    \endif
\else
    \if :IS_TIME_DIMENSION
        SELECT table_name FROM create_hypertable('conditions', 'time');
    \else
        SELECT table_name FROM create_hypertable('conditions', 'time', chunk_time_interval => 10);
 table_name 
------------
 conditions
(1 row)

    \endif
\endif
\if :IS_TIME_DIMENSION
    INSERT INTO conditions ("time", temperature)
    SELECT
        generate_series('2022-01-01 00:00:00-00'::timestamptz, '2022-12-31 23:59:59-00'::timestamptz, '1 hour'),
        0.25;
\else
    CREATE OR REPLACE FUNCTION integer_now()
    RETURNS integer LANGUAGE SQL STABLE AS
    $$
        SELECT coalesce(max(time), 0)
        FROM conditions
    $$;
    \if :IS_DISTRIBUTED
        CALL distributed_exec (
            $DIST$
            CREATE OR REPLACE FUNCTION integer_now() RETURNS integer LANGUAGE SQL STABLE AS $$ SELECT coalesce(max(time), 0) FROM conditions $$;
            $DIST$
        );
    \endif
    SELECT set_integer_now_func('conditions', 'integer_now');
 set_integer_now_func 
----------------------
 
(1 row)

    INSERT INTO conditions ("time", temperature)
    SELECT
        generate_series(1, 1000, 1),
        0.25;
\endif
\set ON_ERROR_STOP 0
-- should fail relation does not exist
CALL cagg_migrate('conditions_summary_daily');
psql:include/cagg_migrate_common.sql:70: ERROR:  relation "conditions_summary_daily" does not exist at character 19
CREATE TABLE conditions_summary_daily();
-- should fail continuous agg does not exist
CALL cagg_migrate('conditions_summary_daily');
psql:include/cagg_migrate_common.sql:73: ERROR:  continuous aggregate "public.conditions_summary_daily" does not exist
\set ON_ERROR_STOP 1
DROP TABLE conditions_summary_daily;
CREATE MATERIALIZED VIEW conditions_summary_daily_new
WITH (timescaledb.continuous) AS
SELECT
\if :IS_TIME_DIMENSION
    time_bucket(INTERVAL '1 day', "time") AS bucket,
\else
    time_bucket(INTEGER '24', "time") AS bucket,
\endif
    MIN(temperature),
    MAX(temperature),
    AVG(temperature),
    SUM(temperature)
FROM
    conditions
GROUP BY
    bucket
WITH NO DATA;
\set ON_ERROR_STOP 0
-- should fail because we don't need to migrate finalized caggs
CALL cagg_migrate('conditions_summary_daily_new');
psql:include/cagg_migrate_common.sql:98: ERROR:  continuous aggregate "public.conditions_summary_daily_new" does not require any migration
\set ON_ERROR_STOP 1
-- older continuous aggregate to be migrated
CREATE MATERIALIZED VIEW conditions_summary_daily
WITH (timescaledb.continuous, timescaledb.finalized=false) AS
SELECT
\if :IS_TIME_DIMENSION
    time_bucket(INTERVAL '1 day', "time") AS bucket,
\else
    time_bucket(INTEGER '24', "time") AS bucket,
\endif
    MIN(temperature),
    MAX(temperature),
    AVG(temperature),
    SUM(temperature)
FROM
    conditions
GROUP BY
    bucket;
psql:include/cagg_migrate_common.sql:117: NOTICE:  refreshing continuous aggregate "conditions_summary_daily"
SELECT
    ca.raw_hypertable_id AS "RAW_HYPERTABLE_ID",
    h.schema_name AS "MAT_SCHEMA_NAME",
    h.table_name AS "MAT_TABLE_NAME",
    partial_view_name AS "PART_VIEW_NAME",
    partial_view_schema AS "PART_VIEW_SCHEMA",
    direct_view_name AS "DIR_VIEW_NAME",
    direct_view_schema AS "DIR_VIEW_SCHEMA"
FROM
    _timescaledb_catalog.continuous_agg ca
    JOIN _timescaledb_catalog.hypertable h ON (h.id = ca.mat_hypertable_id)
WHERE
    user_view_name = 'conditions_summary_daily'
\gset
\set ON_ERROR_STOP 0
-- should fail because the new cagg with suffix '_new' already exists
CALL cagg_migrate('conditions_summary_daily');
psql:include/cagg_migrate_common.sql:136: ERROR:  continuous aggregate "public.conditions_summary_daily_new" already exists
\set ON_ERROR_STOP 1
-- remove the new cagg to execute the migration
DROP MATERIALIZED VIEW conditions_summary_daily_new;
-- get and set all the cagg data
SELECT
    _timescaledb_internal.cagg_migrate_pre_validation(
        'public',
        'conditions_summary_daily',
        'conditions_summary_daily_new'
    ) AS "CAGG_DATA"
\gset
CALL _timescaledb_internal.cagg_migrate_create_plan(:'CAGG_DATA', 'conditions_summary_daily_new');
SELECT mat_hypertable_id FROM _timescaledb_catalog.continuous_agg_migrate_plan;
 mat_hypertable_id 
-------------------
                 3
(1 row)

\set ON_ERROR_STOP 0
-- should error because plan already exists
CALL _timescaledb_internal.cagg_migrate_create_plan(:'CAGG_DATA', 'conditions_summary_daily_new');
psql:include/cagg_migrate_common.sql:156: ERROR:  plan already exists for materialized hypertable 3
\set ON_ERROR_STOP 1
DELETE FROM _timescaledb_catalog.continuous_agg_migrate_plan;
ALTER SEQUENCE _timescaledb_catalog.continuous_agg_migrate_plan_step_step_id_seq RESTART;
CALL _timescaledb_internal.cagg_migrate_create_plan(:'CAGG_DATA', 'conditions_summary_daily_new');
SELECT mat_hypertable_id, step_id, status, type, config FROM _timescaledb_catalog.continuous_agg_migrate_plan_step ORDER BY step_id;
 mat_hypertable_id | step_id |   status    |       type       |                                                                         config                                                                          
-------------------+---------+-------------+------------------+---------------------------------------------------------------------------------------------------------------------------------------------------------
                 3 |       1 | FINISHED    | SAVE WATERMARK   | {"watermark": "1008"}
                 3 |       2 | NOT STARTED | CREATE NEW CAGG  | {"cagg_name_new": "conditions_summary_daily_new"}
                 3 |       3 | NOT STARTED | DISABLE POLICIES | {"policies": null}
                 3 |       4 | NOT STARTED | REFRESH NEW CAGG | {"window_start": "1008", "cagg_name_new": "conditions_summary_daily_new", "window_start_type": "integer"}
                 3 |       5 | NOT STARTED | COPY DATA        | {"end_ts": "100", "start_ts": "0", "cagg_name_new": "conditions_summary_daily_new", "bucket_column_name": "bucket", "bucket_column_type": "integer"}
                 3 |       6 | NOT STARTED | COPY DATA        | {"end_ts": "200", "start_ts": "100", "cagg_name_new": "conditions_summary_daily_new", "bucket_column_name": "bucket", "bucket_column_type": "integer"}
                 3 |       7 | NOT STARTED | COPY DATA        | {"end_ts": "300", "start_ts": "200", "cagg_name_new": "conditions_summary_daily_new", "bucket_column_name": "bucket", "bucket_column_type": "integer"}
                 3 |       8 | NOT STARTED | COPY DATA        | {"end_ts": "400", "start_ts": "300", "cagg_name_new": "conditions_summary_daily_new", "bucket_column_name": "bucket", "bucket_column_type": "integer"}
                 3 |       9 | NOT STARTED | COPY DATA        | {"end_ts": "500", "start_ts": "400", "cagg_name_new": "conditions_summary_daily_new", "bucket_column_name": "bucket", "bucket_column_type": "integer"}
                 3 |      10 | NOT STARTED | COPY DATA        | {"end_ts": "600", "start_ts": "500", "cagg_name_new": "conditions_summary_daily_new", "bucket_column_name": "bucket", "bucket_column_type": "integer"}
                 3 |      11 | NOT STARTED | COPY DATA        | {"end_ts": "700", "start_ts": "600", "cagg_name_new": "conditions_summary_daily_new", "bucket_column_name": "bucket", "bucket_column_type": "integer"}
                 3 |      12 | NOT STARTED | COPY DATA        | {"end_ts": "800", "start_ts": "700", "cagg_name_new": "conditions_summary_daily_new", "bucket_column_name": "bucket", "bucket_column_type": "integer"}
                 3 |      13 | NOT STARTED | COPY DATA        | {"end_ts": "900", "start_ts": "800", "cagg_name_new": "conditions_summary_daily_new", "bucket_column_name": "bucket", "bucket_column_type": "integer"}
                 3 |      14 | NOT STARTED | COPY DATA        | {"end_ts": "1000", "start_ts": "900", "cagg_name_new": "conditions_summary_daily_new", "bucket_column_name": "bucket", "bucket_column_type": "integer"}
                 3 |      15 | NOT STARTED | OVERRIDE CAGG    | {"drop_old": false, "override": false, "cagg_name_new": "conditions_summary_daily_new"}
                 3 |      16 | NOT STARTED | DROP OLD CAGG    | {"drop_old": false, "override": false, "cagg_name_new": "conditions_summary_daily_new"}
                 3 |      17 | NOT STARTED | COPY POLICIES    | {"policies": null, "cagg_name_new": "conditions_summary_daily_new"}
                 3 |      18 | NOT STARTED | ENABLE POLICIES  | 
(18 rows)

-- policy for test
\if :IS_TIME_DIMENSION
SELECT add_retention_policy('conditions_summary_daily', '30 days'::interval);
\else
SELECT add_retention_policy('conditions_summary_daily', '30'::integer);
 add_retention_policy 
----------------------
                 1000
(1 row)

\endif
SELECT job_id, application_name, proc_schema, proc_name, scheduled, hypertable_schema, hypertable_name, config
FROM timescaledb_information.jobs
WHERE hypertable_schema = :'MAT_SCHEMA_NAME'
AND hypertable_name = :'MAT_TABLE_NAME'
AND job_id >= 1000;
 job_id |    application_name     |      proc_schema      |    proc_name     | scheduled |   hypertable_schema   |      hypertable_name       |                 config                 
--------+-------------------------+-----------------------+------------------+-----------+-----------------------+----------------------------+----------------------------------------
   1000 | Retention Policy [1000] | _timescaledb_internal | policy_retention | t         | _timescaledb_internal | _materialized_hypertable_3 | {"drop_after": 30, "hypertable_id": 3}
(1 row)

-- execute the migration
DELETE FROM _timescaledb_catalog.continuous_agg_migrate_plan;
ALTER SEQUENCE _timescaledb_catalog.continuous_agg_migrate_plan_step_step_id_seq RESTART;
CALL cagg_migrate('conditions_summary_daily');
psql:include/cagg_migrate_common.sql:181: NOTICE:  continuous aggregate "conditions_summary_daily_new" is already up-to-date
SELECT
    ca.raw_hypertable_id AS "NEW_RAW_HYPERTABLE_ID",
    h.schema_name AS "NEW_MAT_SCHEMA_NAME",
    h.table_name AS "NEW_MAT_TABLE_NAME",
    partial_view_name AS "NEW_PART_VIEW_NAME",
    partial_view_schema AS "NEW_PART_VIEW_SCHEMA",
    direct_view_name AS "NEW_DIR_VIEW_NAME",
    direct_view_schema AS "NEW_DIR_VIEW_SCHEMA"
FROM
    _timescaledb_catalog.continuous_agg ca
    JOIN _timescaledb_catalog.hypertable h ON (h.id = ca.mat_hypertable_id)
WHERE
    user_view_name = 'conditions_summary_daily_new'
\gset
\d+ conditions_summary_daily_new
                View "public.conditions_summary_daily_new"
 Column |  Type   | Collation | Nullable | Default | Storage | Description 
--------+---------+-----------+----------+---------+---------+-------------
 bucket | integer |           |          |         | plain   | 
 min    | numeric |           |          |         | main    | 
 max    | numeric |           |          |         | main    | 
 avg    | numeric |           |          |         | main    | 
 sum    | numeric |           |          |         | main    | 
View definition:
 SELECT _materialized_hypertable_4.bucket,
    _materialized_hypertable_4.min,
    _materialized_hypertable_4.max,
    _materialized_hypertable_4.avg,
    _materialized_hypertable_4.sum
   FROM _timescaledb_internal._materialized_hypertable_4
  WHERE _materialized_hypertable_4.bucket < COALESCE(_timescaledb_internal.cagg_watermark(4)::integer, '-2147483648'::integer)
UNION ALL
 SELECT time_bucket(24, conditions."time") AS bucket,
    min(conditions.temperature) AS min,
    max(conditions.temperature) AS max,
    avg(conditions.temperature) AS avg,
    sum(conditions.temperature) AS sum
   FROM conditions
  WHERE conditions."time" >= COALESCE(_timescaledb_internal.cagg_watermark(4)::integer, '-2147483648'::integer)
  GROUP BY (time_bucket(24, conditions."time"));

SELECT job_id, application_name, proc_schema, proc_name, scheduled, hypertable_schema, hypertable_name, config
FROM timescaledb_information.jobs
WHERE hypertable_schema = :'NEW_MAT_SCHEMA_NAME'
AND hypertable_name = :'NEW_MAT_TABLE_NAME'
AND job_id >= 1000;
 job_id |    application_name     |      proc_schema      |    proc_name     | scheduled |   hypertable_schema   |      hypertable_name       |                 config                 
--------+-------------------------+-----------------------+------------------+-----------+-----------------------+----------------------------+----------------------------------------
   1001 | Retention Policy [1000] | _timescaledb_internal | policy_retention | t         | _timescaledb_internal | _materialized_hypertable_4 | {"drop_after": 30, "hypertable_id": 3}
(1 row)

SELECT mat_hypertable_id, step_id, status, type, config FROM _timescaledb_catalog.continuous_agg_migrate_plan_step ORDER BY step_id;
 mat_hypertable_id | step_id |  status  |       type       |                                                                         config                                                                          
-------------------+---------+----------+------------------+---------------------------------------------------------------------------------------------------------------------------------------------------------
                 3 |       1 | FINISHED | SAVE WATERMARK   | {"watermark": "1008"}
                 3 |       2 | FINISHED | CREATE NEW CAGG  | {"cagg_name_new": "conditions_summary_daily_new"}
                 3 |       3 | FINISHED | DISABLE POLICIES | {"policies": [1000]}
                 3 |       4 | FINISHED | REFRESH NEW CAGG | {"window_start": "1008", "cagg_name_new": "conditions_summary_daily_new", "window_start_type": "integer"}
                 3 |       5 | FINISHED | COPY DATA        | {"end_ts": "100", "start_ts": "0", "cagg_name_new": "conditions_summary_daily_new", "bucket_column_name": "bucket", "bucket_column_type": "integer"}
                 3 |       6 | FINISHED | COPY DATA        | {"end_ts": "200", "start_ts": "100", "cagg_name_new": "conditions_summary_daily_new", "bucket_column_name": "bucket", "bucket_column_type": "integer"}
                 3 |       7 | FINISHED | COPY DATA        | {"end_ts": "300", "start_ts": "200", "cagg_name_new": "conditions_summary_daily_new", "bucket_column_name": "bucket", "bucket_column_type": "integer"}
                 3 |       8 | FINISHED | COPY DATA        | {"end_ts": "400", "start_ts": "300", "cagg_name_new": "conditions_summary_daily_new", "bucket_column_name": "bucket", "bucket_column_type": "integer"}
                 3 |       9 | FINISHED | COPY DATA        | {"end_ts": "500", "start_ts": "400", "cagg_name_new": "conditions_summary_daily_new", "bucket_column_name": "bucket", "bucket_column_type": "integer"}
                 3 |      10 | FINISHED | COPY DATA        | {"end_ts": "600", "start_ts": "500", "cagg_name_new": "conditions_summary_daily_new", "bucket_column_name": "bucket", "bucket_column_type": "integer"}
                 3 |      11 | FINISHED | COPY DATA        | {"end_ts": "700", "start_ts": "600", "cagg_name_new": "conditions_summary_daily_new", "bucket_column_name": "bucket", "bucket_column_type": "integer"}
                 3 |      12 | FINISHED | COPY DATA        | {"end_ts": "800", "start_ts": "700", "cagg_name_new": "conditions_summary_daily_new", "bucket_column_name": "bucket", "bucket_column_type": "integer"}
                 3 |      13 | FINISHED | COPY DATA        | {"end_ts": "900", "start_ts": "800", "cagg_name_new": "conditions_summary_daily_new", "bucket_column_name": "bucket", "bucket_column_type": "integer"}
                 3 |      14 | FINISHED | COPY DATA        | {"end_ts": "1000", "start_ts": "900", "cagg_name_new": "conditions_summary_daily_new", "bucket_column_name": "bucket", "bucket_column_type": "integer"}
                 3 |      15 | FINISHED | OVERRIDE CAGG    | {"drop_old": false, "override": false, "cagg_name_new": "conditions_summary_daily_new"}
                 3 |      16 | FINISHED | DROP OLD CAGG    | {"drop_old": false, "override": false, "cagg_name_new": "conditions_summary_daily_new"}
                 3 |      17 | FINISHED | COPY POLICIES    | {"policies": [1000], "cagg_name_new": "conditions_summary_daily_new"}
                 3 |      18 | FINISHED | ENABLE POLICIES  | {"policies": [1001]}
(18 rows)

-- check migrated data. should return 0 (zero) rows
SELECT * FROM conditions_summary_daily
EXCEPT
SELECT * FROM conditions_summary_daily_new;
 bucket | min | max | avg | sum 
--------+-----+-----+-----+-----
(0 rows)

-- test migration overriding the new cagg and keeping the old
DROP MATERIALIZED VIEW conditions_summary_daily_new;
psql:include/cagg_migrate_common.sql:214: NOTICE:  drop cascades to 10 other objects
DELETE FROM _timescaledb_catalog.continuous_agg_migrate_plan;
ALTER SEQUENCE _timescaledb_catalog.continuous_agg_migrate_plan_step_step_id_seq RESTART;
CALL cagg_migrate('conditions_summary_daily', override => TRUE);
psql:include/cagg_migrate_common.sql:217: NOTICE:  continuous aggregate "conditions_summary_daily_new" is already up-to-date
-- cagg with the new format because it was overriden
\d+ conditions_summary_daily
                  View "public.conditions_summary_daily"
 Column |  Type   | Collation | Nullable | Default | Storage | Description 
--------+---------+-----------+----------+---------+---------+-------------
 bucket | integer |           |          |         | plain   | 
 min    | numeric |           |          |         | main    | 
 max    | numeric |           |          |         | main    | 
 avg    | numeric |           |          |         | main    | 
 sum    | numeric |           |          |         | main    | 
View definition:
 SELECT _materialized_hypertable_5.bucket,
    _materialized_hypertable_5.min,
    _materialized_hypertable_5.max,
    _materialized_hypertable_5.avg,
    _materialized_hypertable_5.sum
   FROM _timescaledb_internal._materialized_hypertable_5
  WHERE _materialized_hypertable_5.bucket < COALESCE(_timescaledb_internal.cagg_watermark(5)::integer, '-2147483648'::integer)
UNION ALL
 SELECT time_bucket(24, conditions."time") AS bucket,
    min(conditions.temperature) AS min,
    max(conditions.temperature) AS max,
    avg(conditions.temperature) AS avg,
    sum(conditions.temperature) AS sum
   FROM conditions
  WHERE conditions."time" >= COALESCE(_timescaledb_internal.cagg_watermark(5)::integer, '-2147483648'::integer)
  GROUP BY (time_bucket(24, conditions."time"));

-- cagg with the old format because it was overriden
\d+ conditions_summary_daily_old
                View "public.conditions_summary_daily_old"
 Column |  Type   | Collation | Nullable | Default | Storage | Description 
--------+---------+-----------+----------+---------+---------+-------------
 bucket | integer |           |          |         | plain   | 
 min    | numeric |           |          |         | main    | 
 max    | numeric |           |          |         | main    | 
 avg    | numeric |           |          |         | main    | 
 sum    | numeric |           |          |         | main    | 
View definition:
 SELECT _materialized_hypertable_3.bucket,
    _timescaledb_internal.finalize_agg('pg_catalog.min(numeric)'::text, NULL::name, NULL::name, '{{pg_catalog,numeric}}'::name[], _materialized_hypertable_3.agg_2_2, NULL::numeric) AS min,
    _timescaledb_internal.finalize_agg('pg_catalog.max(numeric)'::text, NULL::name, NULL::name, '{{pg_catalog,numeric}}'::name[], _materialized_hypertable_3.agg_3_3, NULL::numeric) AS max,
    _timescaledb_internal.finalize_agg('pg_catalog.avg(numeric)'::text, NULL::name, NULL::name, '{{pg_catalog,numeric}}'::name[], _materialized_hypertable_3.agg_4_4, NULL::numeric) AS avg,
    _timescaledb_internal.finalize_agg('pg_catalog.sum(numeric)'::text, NULL::name, NULL::name, '{{pg_catalog,numeric}}'::name[], _materialized_hypertable_3.agg_5_5, NULL::numeric) AS sum
   FROM _timescaledb_internal._materialized_hypertable_3
  WHERE _materialized_hypertable_3.bucket < COALESCE(_timescaledb_internal.cagg_watermark(3)::integer, '-2147483648'::integer)
  GROUP BY _materialized_hypertable_3.bucket
UNION ALL
 SELECT time_bucket(24, conditions."time") AS bucket,
    min(conditions.temperature) AS min,
    max(conditions.temperature) AS max,
    avg(conditions.temperature) AS avg,
    sum(conditions.temperature) AS sum
   FROM conditions
  WHERE conditions."time" >= COALESCE(_timescaledb_internal.cagg_watermark(3)::integer, '-2147483648'::integer)
  GROUP BY (time_bucket(24, conditions."time"));

\set ON_ERROR_STOP 0
-- should fail because the cagg was overriden
SELECT * FROM conditions_summary_daily_new;
psql:include/cagg_migrate_common.sql:224: ERROR:  relation "conditions_summary_daily_new" does not exist at character 15
\set ON_ERROR_STOP 1
-- test migration overriding the new cagg and removing the old
DELETE FROM _timescaledb_catalog.continuous_agg_migrate_plan;
ALTER SEQUENCE _timescaledb_catalog.continuous_agg_migrate_plan_step_step_id_seq RESTART;
DROP MATERIALIZED VIEW conditions_summary_daily;
psql:include/cagg_migrate_common.sql:230: NOTICE:  drop cascades to 10 other objects
ALTER MATERIALIZED VIEW conditions_summary_daily_old RENAME TO conditions_summary_daily;
CALL cagg_migrate('conditions_summary_daily', override => TRUE, drop_old => TRUE);
psql:include/cagg_migrate_common.sql:232: NOTICE:  continuous aggregate "conditions_summary_daily_new" is already up-to-date
psql:include/cagg_migrate_common.sql:232: NOTICE:  drop cascades to 10 other objects
-- cagg with the new format because it was overriden
\d+ conditions_summary_daily
                  View "public.conditions_summary_daily"
 Column |  Type   | Collation | Nullable | Default | Storage | Description 
--------+---------+-----------+----------+---------+---------+-------------
 bucket | integer |           |          |         | plain   | 
 min    | numeric |           |          |         | main    | 
 max    | numeric |           |          |         | main    | 
 avg    | numeric |           |          |         | main    | 
 sum    | numeric |           |          |         | main    | 
View definition:
 SELECT _materialized_hypertable_6.bucket,
    _materialized_hypertable_6.min,
    _materialized_hypertable_6.max,
    _materialized_hypertable_6.avg,
    _materialized_hypertable_6.sum
   FROM _timescaledb_internal._materialized_hypertable_6
  WHERE _materialized_hypertable_6.bucket < COALESCE(_timescaledb_internal.cagg_watermark(6)::integer, '-2147483648'::integer)
UNION ALL
 SELECT time_bucket(24, conditions."time") AS bucket,
    min(conditions.temperature) AS min,
    max(conditions.temperature) AS max,
    avg(conditions.temperature) AS avg,
    sum(conditions.temperature) AS sum
   FROM conditions
  WHERE conditions."time" >= COALESCE(_timescaledb_internal.cagg_watermark(6)::integer, '-2147483648'::integer)
  GROUP BY (time_bucket(24, conditions."time"));

\set ON_ERROR_STOP 0
-- should fail because the cagg was overriden
SELECT * FROM conditions_summary_daily_new;
psql:include/cagg_migrate_common.sql:237: ERROR:  relation "conditions_summary_daily_new" does not exist at character 15
-- should fail because the old cagg was removed
SELECT * FROM conditions_summary_daily_old;
psql:include/cagg_migrate_common.sql:239: ERROR:  relation "conditions_summary_daily_old" does not exist at character 15
\set ON_ERROR_STOP 1
-- permissions test
DELETE FROM _timescaledb_catalog.continuous_agg_migrate_plan;
ALTER SEQUENCE _timescaledb_catalog.continuous_agg_migrate_plan_step_step_id_seq RESTART;
DROP MATERIALIZED VIEW conditions_summary_daily;
psql:include/cagg_migrate_common.sql:245: NOTICE:  drop cascades to 10 other objects
GRANT ALL ON TABLE conditions TO :ROLE_DEFAULT_PERM_USER;
SET ROLE :ROLE_DEFAULT_PERM_USER;
CREATE MATERIALIZED VIEW conditions_summary_daily
WITH (timescaledb.continuous, timescaledb.finalized=false) AS
SELECT
\if :IS_TIME_DIMENSION
    time_bucket(INTERVAL '1 day', "time") AS bucket,
\else
    time_bucket(INTEGER '24', "time") AS bucket,
\endif
    MIN(temperature),
    MAX(temperature),
    AVG(temperature),
    SUM(temperature)
FROM
    conditions
GROUP BY
    bucket;
psql:include/cagg_migrate_common.sql:264: NOTICE:  refreshing continuous aggregate "conditions_summary_daily"
\set ON_ERROR_STOP 0
-- should fail because the lack of permissions on 'continuous_agg_migrate_plan' catalog table
CALL cagg_migrate('conditions_summary_daily');
psql:include/cagg_migrate_common.sql:268: ERROR:  permission denied for table continuous_agg_migrate_plan
\set ON_ERROR_STOP 1
RESET ROLE;
GRANT SELECT, INSERT, UPDATE ON TABLE _timescaledb_catalog.continuous_agg_migrate_plan TO :ROLE_DEFAULT_PERM_USER;
SET ROLE :ROLE_DEFAULT_PERM_USER;
\set ON_ERROR_STOP 0
-- should fail because the lack of permissions on 'continuous_agg_migrate_plan_step' catalog table
CALL cagg_migrate('conditions_summary_daily');
psql:include/cagg_migrate_common.sql:278: ERROR:  permission denied for table continuous_agg_migrate_plan_step
\set ON_ERROR_STOP 1
RESET ROLE;
GRANT SELECT, INSERT, UPDATE ON TABLE _timescaledb_catalog.continuous_agg_migrate_plan_step TO :ROLE_DEFAULT_PERM_USER;
SET ROLE :ROLE_DEFAULT_PERM_USER;
\set ON_ERROR_STOP 0
-- should fail because the lack of permissions on 'continuous_agg_migrate_plan_step_step_id_seq' catalog sequence
CALL cagg_migrate('conditions_summary_daily');
psql:include/cagg_migrate_common.sql:288: ERROR:  permission denied for sequence continuous_agg_migrate_plan_step_step_id_seq
\set ON_ERROR_STOP 1
RESET ROLE;
GRANT USAGE ON SEQUENCE _timescaledb_catalog.continuous_agg_migrate_plan_step_step_id_seq TO :ROLE_DEFAULT_PERM_USER;
SET ROLE :ROLE_DEFAULT_PERM_USER;
-- all necessary permissions granted
CALL cagg_migrate('conditions_summary_daily');
psql:include/cagg_migrate_common.sql:297: NOTICE:  continuous aggregate "conditions_summary_daily_new" is already up-to-date
-- check migrated data. should return 0 (zero) rows
SELECT * FROM conditions_summary_daily
EXCEPT
SELECT * FROM conditions_summary_daily_new;
 bucket | min | max | avg | sum 
--------+-----+-----+-----+-----
(0 rows)

SELECT mat_hypertable_id, step_id, status, type, config FROM _timescaledb_catalog.continuous_agg_migrate_plan_step ORDER BY step_id;
 mat_hypertable_id | step_id |  status  |       type       |                                                                         config                                                                          
-------------------+---------+----------+------------------+---------------------------------------------------------------------------------------------------------------------------------------------------------
                 7 |       1 | FINISHED | SAVE WATERMARK   | {"watermark": "1008"}
                 7 |       2 | FINISHED | CREATE NEW CAGG  | {"cagg_name_new": "conditions_summary_daily_new"}
                 7 |       3 | FINISHED | DISABLE POLICIES | {"policies": null}
                 7 |       4 | FINISHED | REFRESH NEW CAGG | {"window_start": "1008", "cagg_name_new": "conditions_summary_daily_new", "window_start_type": "integer"}
                 7 |       5 | FINISHED | COPY DATA        | {"end_ts": "100", "start_ts": "0", "cagg_name_new": "conditions_summary_daily_new", "bucket_column_name": "bucket", "bucket_column_type": "integer"}
                 7 |       6 | FINISHED | COPY DATA        | {"end_ts": "200", "start_ts": "100", "cagg_name_new": "conditions_summary_daily_new", "bucket_column_name": "bucket", "bucket_column_type": "integer"}
                 7 |       7 | FINISHED | COPY DATA        | {"end_ts": "300", "start_ts": "200", "cagg_name_new": "conditions_summary_daily_new", "bucket_column_name": "bucket", "bucket_column_type": "integer"}
                 7 |       8 | FINISHED | COPY DATA        | {"end_ts": "400", "start_ts": "300", "cagg_name_new": "conditions_summary_daily_new", "bucket_column_name": "bucket", "bucket_column_type": "integer"}
                 7 |       9 | FINISHED | COPY DATA        | {"end_ts": "500", "start_ts": "400", "cagg_name_new": "conditions_summary_daily_new", "bucket_column_name": "bucket", "bucket_column_type": "integer"}
                 7 |      10 | FINISHED | COPY DATA        | {"end_ts": "600", "start_ts": "500", "cagg_name_new": "conditions_summary_daily_new", "bucket_column_name": "bucket", "bucket_column_type": "integer"}
                 7 |      11 | FINISHED | COPY DATA        | {"end_ts": "700", "start_ts": "600", "cagg_name_new": "conditions_summary_daily_new", "bucket_column_name": "bucket", "bucket_column_type": "integer"}
                 7 |      12 | FINISHED | COPY DATA        | {"end_ts": "800", "start_ts": "700", "cagg_name_new": "conditions_summary_daily_new", "bucket_column_name": "bucket", "bucket_column_type": "integer"}
                 7 |      13 | FINISHED | COPY DATA        | {"end_ts": "900", "start_ts": "800", "cagg_name_new": "conditions_summary_daily_new", "bucket_column_name": "bucket", "bucket_column_type": "integer"}
                 7 |      14 | FINISHED | COPY DATA        | {"end_ts": "1000", "start_ts": "900", "cagg_name_new": "conditions_summary_daily_new", "bucket_column_name": "bucket", "bucket_column_type": "integer"}
                 7 |      15 | FINISHED | OVERRIDE CAGG    | {"drop_old": false, "override": false, "cagg_name_new": "conditions_summary_daily_new"}
                 7 |      16 | FINISHED | DROP OLD CAGG    | {"drop_old": false, "override": false, "cagg_name_new": "conditions_summary_daily_new"}
                 7 |      17 | FINISHED | COPY POLICIES    | {"policies": null, "cagg_name_new": "conditions_summary_daily_new"}
                 7 |      18 | FINISHED | ENABLE POLICIES  | 
(18 rows)

