-- This file and its contents are licensed under the Timescale License.
-- Please see the included NOTICE for copyright information and
-- LICENSE-TIMESCALE for a copy of the license.
--  These tests work for PG14 or greater
-- Remember to corordinate any changes to freeze_chunk functionality with the Cloud
-- Storage team.
\c :TEST_DBNAME :ROLE_SUPERUSER
CREATE SCHEMA test1;
GRANT CREATE ON SCHEMA test1 TO :ROLE_DEFAULT_PERM_USER;
GRANT USAGE ON SCHEMA test1 TO :ROLE_DEFAULT_PERM_USER;
SET ROLE :ROLE_DEFAULT_PERM_USER;
CREATE TABLE test1.hyper1 (time bigint, temp float);
SELECT create_hypertable('test1.hyper1', 'time', chunk_time_interval => 10);
NOTICE:  adding not-null constraint to column "time"
 create_hypertable  
--------------------
 (1,test1,hyper1,t)
(1 row)

INSERT INTO test1.hyper1 VALUES (10, 0.5);
INSERT INTO test1.hyper1 VALUES (30, 0.5);
SELECT chunk_schema as "CHSCHEMA",  chunk_name as "CHNAME", 
       range_start_integer, range_end_integer
FROM timescaledb_information.chunks
WHERE hypertable_name = 'hyper1' and hypertable_schema = 'test1'
ORDER BY chunk_name ;
       CHSCHEMA        |      CHNAME      | range_start_integer | range_end_integer 
-----------------------+------------------+---------------------+-------------------
 _timescaledb_internal | _hyper_1_1_chunk |                  10 |                20
 _timescaledb_internal | _hyper_1_2_chunk |                  30 |                40
(2 rows)

--TEST internal api that freezes a chunk
--freeze one of the chunks
SELECT chunk_schema || '.' ||  chunk_name as "CHNAME"
FROM timescaledb_information.chunks
WHERE hypertable_name = 'hyper1' and hypertable_schema = 'test1'
ORDER BY chunk_name LIMIT 1
\gset
SELECT  _timescaledb_internal.freeze_chunk( :'CHNAME');
 freeze_chunk 
--------------
 t
(1 row)

SELECT * from test1.hyper1 ORDER BY 1;
 time | temp 
------+------
   10 |  0.5
   30 |  0.5
(2 rows)

--updates and deletes on frozen chunk should fail
\set ON_ERROR_STOP 0
UPDATE test1.hyper1 SET temp = 40 WHERE time = 20;
UPDATE test1.hyper1 SET temp = 40 WHERE temp = 0.5;
ERROR:  Update not permitted on frozen chunk "_hyper_1_1_chunk" 
SELECT * from test1.hyper1 ORDER BY 1;
 time | temp 
------+------
   10 |  0.5
   30 |  0.5
(2 rows)

DELETE FROM test1.hyper1 WHERE time = 20;
DELETE FROM test1.hyper1 WHERE temp = 0.5;
ERROR:  Delete not permitted on frozen chunk "_hyper_1_1_chunk" 
SELECT * from test1.hyper1 ORDER BY 1;
 time | temp 
------+------
   10 |  0.5
   30 |  0.5
(2 rows)

--inserts into a frozen chunk fails
INSERT INTO test1.hyper1 VALUES ( 11, 11);
ERROR:  Insert not permitted on frozen chunk "_hyper_1_1_chunk" 
--insert into non-frozen chunk works
INSERT INTO test1.hyper1 VALUES ( 31, 31);
SELECT * from test1.hyper1 ORDER BY 1;
 time | temp 
------+------
   10 |  0.5
   30 |  0.5
   31 |   31
(3 rows)

\set ON_ERROR_STOP 1
SELECT  _timescaledb_internal.drop_chunk( :'CHNAME');
 drop_chunk 
------------
 t
(1 row)

-- TEST freeze_chunk api on a chunk that is compressed
CREATE TABLE public.table_to_compress (time date NOT NULL, acq_id bigint, value bigint);
CREATE INDEX idx_table_to_compress_acq_id ON public.table_to_compress(acq_id);
SELECT create_hypertable('public.table_to_compress', 'time', chunk_time_interval => interval '1 day');
       create_hypertable        
--------------------------------
 (2,public,table_to_compress,t)
(1 row)

ALTER TABLE public.table_to_compress SET (timescaledb.compress, timescaledb.compress_segmentby = 'acq_id');
INSERT INTO public.table_to_compress VALUES ('2020-01-01', 1234567, 777888);
INSERT INTO public.table_to_compress VALUES ('2020-02-01', 567567, 890890);
INSERT INTO public.table_to_compress VALUES ('2020-02-10', 1234, 5678);
SELECT show_chunks('public.table_to_compress');
              show_chunks               
----------------------------------------
 _timescaledb_internal._hyper_2_3_chunk
 _timescaledb_internal._hyper_2_4_chunk
 _timescaledb_internal._hyper_2_5_chunk
(3 rows)

SELECT chunk_schema || '.' ||  chunk_name as "CHNAME", chunk_name as "CHUNK_NAME"
FROM timescaledb_information.chunks
WHERE hypertable_name = 'table_to_compress' and hypertable_schema = 'public'
ORDER BY chunk_name LIMIT 1
\gset
SELECT  compress_chunk( :'CHNAME');
             compress_chunk             
----------------------------------------
 _timescaledb_internal._hyper_2_3_chunk
(1 row)

SELECT  _timescaledb_internal.freeze_chunk( :'CHNAME');
 freeze_chunk 
--------------
 t
(1 row)

SELECT table_name, status 
FROM _timescaledb_catalog.chunk WHERE table_name = :'CHUNK_NAME';
    table_name    | status 
------------------+--------
 _hyper_2_3_chunk |      5
(1 row)

--now chunk is frozen, cannot decompress
\set ON_ERROR_STOP 0
SELECT  decompress_chunk( :'CHNAME');
ERROR:  decompress_chunk not permitted on frozen chunk "_hyper_2_3_chunk" 
--insert into frozen chunk, should fail
INSERT INTO public.table_to_compress VALUES ('2020-01-01 10:00', 12, 77);
ERROR:  Insert not permitted on frozen chunk "_hyper_2_3_chunk" 
--touches all chunks
UPDATE public.table_to_compress SET value = 3; 
ERROR:  Update not permitted on frozen chunk "_hyper_2_3_chunk" 
--touches only frozen chunk 
DELETE FROM public.table_to_compress WHERE time < '2020-01-02'; 
ERROR:  Delete not permitted on frozen chunk "_hyper_2_3_chunk" 
--try to refreeze
SELECT  _timescaledb_internal.freeze_chunk( :'CHNAME');
 freeze_chunk 
--------------
 t
(1 row)

\set ON_ERROR_STOP 1
--touches non-frozen chunk 
SELECT * from public.table_to_compress ORDER BY 1, 3;
    time    | acq_id  | value  
------------+---------+--------
 01-01-2020 | 1234567 | 777888
 02-01-2020 |  567567 | 890890
 02-10-2020 |    1234 |   5678
(3 rows)

DELETE FROM public.table_to_compress WHERE time > '2020-01-02'; 
SELECT * from public.table_to_compress ORDER BY 1, 3;
    time    | acq_id  | value  
------------+---------+--------
 01-01-2020 | 1234567 | 777888
(1 row)

--TEST can drop frozen chunk
SELECT drop_chunks('table_to_compress', older_than=> '1 day'::interval);
              drop_chunks               
----------------------------------------
 _timescaledb_internal._hyper_2_3_chunk
 _timescaledb_internal._hyper_2_4_chunk
 _timescaledb_internal._hyper_2_5_chunk
(3 rows)

--add a new chunk
INSERT INTO public.table_to_compress VALUES ('2020-01-01', 1234567, 777888);
--TEST now feeeze and try to compress the chunk
SELECT chunk_schema || '.' ||  chunk_name as "CHNAME"
FROM timescaledb_information.chunks
WHERE hypertable_name = 'table_to_compress' and hypertable_schema = 'public'
ORDER BY chunk_name LIMIT 1
\gset
SELECT  _timescaledb_internal.freeze_chunk( :'CHNAME');
 freeze_chunk 
--------------
 t
(1 row)

\set ON_ERROR_STOP 0
SELECT  compress_chunk( :'CHNAME');
ERROR:  compress_chunk not permitted on frozen chunk "_hyper_2_7_chunk" 
\set ON_ERROR_STOP 1
--TEST dropping a frozen chunk
--DO NOT CHANGE this behavior ---
-- frozen chunks can be dropped.
SELECT _timescaledb_internal.drop_chunk(:'CHNAME');
 drop_chunk 
------------
 t
(1 row)

SELECT count(*) 
FROM timescaledb_information.chunks
WHERE hypertable_name = 'table_to_compress' and hypertable_schema = 'public';
 count 
-------
     0
(1 row)

--TEST error freeze a non-chunk
CREATE TABLE nochunk_tab( a timestamp, b integer);
\set ON_ERROR_STOP 0
SELECT _timescaledb_internal.freeze_chunk('nochunk_tab');
ERROR:  chunk not found
\set ON_ERROR_STOP 1
--TEST dropping frozen chunk in the presence of caggs
SELECT * FROM test1.hyper1 ORDER BY 1;
 time | temp 
------+------
   30 |  0.5
   31 |   31
(2 rows)

CREATE OR REPLACE FUNCTION hyper_dummy_now() RETURNS BIGINT
LANGUAGE SQL IMMUTABLE AS  'SELECT 100::BIGINT';
SELECT set_integer_now_func('test1.hyper1', 'hyper_dummy_now');
 set_integer_now_func 
----------------------
 
(1 row)

CREATE MATERIALIZED VIEW hyper1_cagg WITH (timescaledb.continuous)
AS SELECT time_bucket( 5, "time") as bucket, count(*)
FROM test1.hyper1 GROUP BY 1;
NOTICE:  refreshing continuous aggregate "hyper1_cagg"
SELECT * FROM hyper1_cagg ORDER BY 1;
 bucket | count 
--------+-------
     30 |     2
(1 row)

--now freeze chunk and drop it
--cagg data is unaffected  
SELECT chunk_schema || '.' ||  chunk_name as "CHNAME"
FROM timescaledb_information.chunks
WHERE hypertable_name = 'hyper1' and hypertable_schema = 'test1'
ORDER BY chunk_name LIMIT 1
\gset
SELECT  _timescaledb_internal.freeze_chunk( :'CHNAME');
 freeze_chunk 
--------------
 t
(1 row)

SELECT  _timescaledb_internal.drop_chunk( :'CHNAME');
 drop_chunk 
------------
 t
(1 row)

SELECT * from test1.hyper1 ORDER BY 1;
 time | temp 
------+------
(0 rows)

SELECT * FROM hyper1_cagg ORDER BY 1;
 bucket | count 
--------+-------
     30 |     2
(1 row)

