-- This file and its contents are licensed under the Timescale License.
-- Please see the included NOTICE for copyright information and
-- LICENSE-TIMESCALE for a copy of the license.
CREATE OR REPLACE VIEW compressed_chunk_info_view AS
SELECT
   h.schema_name AS hypertable_schema,
   h.table_name AS hypertable_name,
   c.schema_name as chunk_schema,
   c.table_name as chunk_name,
   c.status as chunk_status,
   comp.schema_name as compressed_chunk_schema,
   comp.table_name as compressed_chunk_name
FROM
   _timescaledb_catalog.hypertable h JOIN
  _timescaledb_catalog.chunk c ON h.id = c.hypertable_id
   LEFT JOIN _timescaledb_catalog.chunk comp
ON comp.id = c.compressed_chunk_id
;
CREATE TABLE sample_table (
       time TIMESTAMP WITH TIME ZONE NOT NULL,
       sensor_id INTEGER NOT NULL,
       cpu double precision null,
       temperature double precision null,
       name varchar(100) default 'this is a default string value'
);
SELECT * FROM create_hypertable('sample_table', 'time',
       chunk_time_interval => INTERVAL '2 months');
WARNING:  column type "character varying" used for "name" does not follow best practices
 hypertable_id | schema_name |  table_name  | created 
---------------+-------------+--------------+---------
             1 | public      | sample_table | t
(1 row)

\set start_date '2022-01-28 01:09:53.583252+05:30'
INSERT INTO sample_table
    SELECT
       	time + (INTERVAL '1 minute' * random()) AS time,
       		sensor_id,
       		random() AS cpu,
       		random()* 100 AS temperature
       	FROM
       		generate_series(:'start_date'::timestamptz - INTERVAL '1 months',
                            :'start_date'::timestamptz - INTERVAL '1 week',
                            INTERVAL '1 hour') AS g1(time),
       		generate_series(1, 8, 1 ) AS g2(sensor_id)
       	ORDER BY
       		time;
\set start_date '2023-03-17 17:51:11.322998+05:30'
-- insert into new chunks
INSERT INTO sample_table VALUES (:'start_date'::timestamptz, 12, 21.98, 33.123, 'new row1');
INSERT INTO sample_table VALUES (:'start_date'::timestamptz, 12, 17.66, 13.875, 'new row1');
INSERT INTO sample_table VALUES (:'start_date'::timestamptz, 13, 21.98, 33.123, 'new row2');
INSERT INTO sample_table VALUES (:'start_date'::timestamptz, 1, 21.98, 33.123, 'new row2');
INSERT INTO sample_table VALUES (:'start_date'::timestamptz, 4, 21.98, 33.123, 'new row2');
INSERT INTO sample_table VALUES (:'start_date'::timestamptz, 5, 0.988, 33.123, 'new row3');
INSERT INTO sample_table VALUES (:'start_date'::timestamptz, 6, 4.6554, 47, 'new row3');
-- enable compression
ALTER TABLE sample_table SET (
	timescaledb.compress,
	timescaledb.compress_segmentby = 'sensor_id'
);
-- compress all chunks
SELECT compress_chunk(show_chunks('sample_table'));
             compress_chunk             
----------------------------------------
 _timescaledb_internal._hyper_1_1_chunk
 _timescaledb_internal._hyper_1_2_chunk
(2 rows)

-- check chunk compression status
SELECT chunk_status,
       chunk_name as "CHUNK_NAME"
FROM compressed_chunk_info_view
WHERE hypertable_name = 'sample_table' ORDER BY chunk_name;
 chunk_status |    CHUNK_NAME    
--------------+------------------
            1 | _hyper_1_1_chunk
            1 | _hyper_1_2_chunk
(2 rows)

-- test rows visibility
BEGIN;
-- report 0 rows
SELECT count(*) FROM sample_table WHERE name = 'updated row';
 count 
-------
     0
(1 row)

-- update 4 rows
UPDATE sample_table SET name = 'updated row' WHERE cpu = 21.98 AND temperature = 33.123;
-- report 0 rows
SELECT count(*) FROM sample_table WHERE name = 'updated row';
 count 
-------
     4
(1 row)

ROLLBACK;
-- get count of affected rows
SELECT count(*) FROM sample_table WHERE cpu = 21.98 AND temperature = 33.123;
 count 
-------
     4
(1 row)

-- do update
UPDATE sample_table SET name = 'updated row' WHERE cpu = 21.98 AND temperature = 33.123;
-- get count of updated rows
SELECT count(*) FROM sample_table WHERE name = 'updated row';
 count 
-------
     4
(1 row)

-- check chunk compression status
SELECT chunk_status,
       chunk_name as "CHUNK_NAME"
FROM compressed_chunk_info_view
WHERE hypertable_name = 'sample_table' ORDER BY chunk_name;
 chunk_status |    CHUNK_NAME    
--------------+------------------
            9 | _hyper_1_1_chunk
            9 | _hyper_1_2_chunk
(2 rows)

-- recompress the partial chunks
CALL recompress_chunk('_timescaledb_internal._hyper_1_1_chunk');
CALL recompress_chunk('_timescaledb_internal._hyper_1_2_chunk');
-- check chunk compression status
SELECT chunk_status,
       chunk_name as "CHUNK_NAME"
FROM compressed_chunk_info_view
WHERE hypertable_name = 'sample_table' ORDER BY chunk_name;
 chunk_status |    CHUNK_NAME    
--------------+------------------
            1 | _hyper_1_1_chunk
            1 | _hyper_1_2_chunk
(2 rows)

-- get count of affected rows
SELECT count(*) FROM sample_table WHERE name = 'updated row';
 count 
-------
     4
(1 row)

-- do delete
DELETE FROM sample_table WHERE name = 'updated row';
-- get count of updated rows
SELECT count(*) FROM sample_table WHERE name = 'updated row';
 count 
-------
     0
(1 row)

-- check chunk compression status
SELECT chunk_status,
       chunk_name as "CHUNK_NAME"
FROM compressed_chunk_info_view
WHERE hypertable_name = 'sample_table' ORDER BY chunk_name;
 chunk_status |    CHUNK_NAME    
--------------+------------------
            9 | _hyper_1_1_chunk
            9 | _hyper_1_2_chunk
(2 rows)

-- recompress the paritial chunks
CALL recompress_chunk('_timescaledb_internal._hyper_1_1_chunk');
CALL recompress_chunk('_timescaledb_internal._hyper_1_2_chunk');
-- test for IS NULL checks
-- should not UPDATE any rows
UPDATE sample_table SET temperature = 34.21 WHERE sensor_id IS NULL;
-- check chunk compression status
SELECT chunk_status,
       chunk_name as "CHUNK_NAME"
FROM compressed_chunk_info_view
WHERE hypertable_name = 'sample_table' ORDER BY chunk_name;
 chunk_status |    CHUNK_NAME    
--------------+------------------
            1 | _hyper_1_1_chunk
            1 | _hyper_1_2_chunk
(2 rows)

-- test for IS NOT NULL checks
-- should UPDATE all rows
UPDATE sample_table SET temperature = 34.21 WHERE sensor_id IS NOT NULL;
-- check chunk compression status
SELECT chunk_status,
       chunk_name as "CHUNK_NAME"
FROM compressed_chunk_info_view
WHERE hypertable_name = 'sample_table' ORDER BY chunk_name;
 chunk_status |    CHUNK_NAME    
--------------+------------------
            9 | _hyper_1_1_chunk
            9 | _hyper_1_2_chunk
(2 rows)

-- recompress the paritial chunks
CALL recompress_chunk('_timescaledb_internal._hyper_1_1_chunk');
CALL recompress_chunk('_timescaledb_internal._hyper_1_2_chunk');
-- check chunk compression status
SELECT chunk_status,
       chunk_name as "CHUNK_NAME"
FROM compressed_chunk_info_view
WHERE hypertable_name = 'sample_table' ORDER BY chunk_name;
 chunk_status |    CHUNK_NAME    
--------------+------------------
            1 | _hyper_1_1_chunk
            1 | _hyper_1_2_chunk
(2 rows)

-- report 0 rows
SELECT COUNT(*) FROM sample_table WHERE name = 'updated row based on < OR > comparison';
 count 
-------
     0
(1 row)

-- get total count of rows which satifies the condition
SELECT COUNT(*) as "total_affected_rows" FROM sample_table WHERE
  time > '2022-01-20 19:10:00.101514+05:30' and
  time < '2022-01-20 21:10:43.855297+05:30' \gset
-- perform UPDATE with < and > comparison on SEGMENTBY column
UPDATE sample_table SET name = 'updated row based on < OR > comparison' WHERE
  time > '2022-01-20 19:10:00.101514+05:30' and time < '2022-01-20 21:10:43.855297+05:30';
-- check chunk compression status after UPDATE
SELECT chunk_status,
       chunk_name as "CHUNK_NAME"
FROM compressed_chunk_info_view
WHERE hypertable_name = 'sample_table' ORDER BY chunk_name;
 chunk_status |    CHUNK_NAME    
--------------+------------------
            9 | _hyper_1_1_chunk
            1 | _hyper_1_2_chunk
(2 rows)

-- count should be same
SELECT COUNT(*) = (:total_affected_rows) FROM sample_table WHERE name = 'updated row based on < OR > comparison';
 ?column? 
----------
 t
(1 row)

DROP TABLE sample_table;
-- test to ensure that only required rows from compressed chunks
-- are extracted if SEGMENTBY column is used in WHERE condition
CREATE TABLE sample_table(
    time INT NOT NULL,
    device_id INT,
    val INT);
SELECT * FROM create_hypertable('sample_table', 'time', chunk_time_interval => 10);
 hypertable_id | schema_name |  table_name  | created 
---------------+-------------+--------------+---------
             3 | public      | sample_table | t
(1 row)

ALTER TABLE sample_table SET (
    timescaledb.compress,
    timescaledb.compress_orderby = 'time',
    timescaledb.compress_segmentby = 'device_id');
INSERT INTO sample_table VALUES (1, 1, 1), (2, 2, 1), (3, 3, 1), (10, 3, 2), (11, 4, 2), (11, 1, 2);
-- compress all chunks
SELECT compress_chunk(show_chunks('sample_table'));
             compress_chunk             
----------------------------------------
 _timescaledb_internal._hyper_3_5_chunk
 _timescaledb_internal._hyper_3_6_chunk
(2 rows)

-- get FIRST compressed chunk
SELECT ch1.schema_name|| '.' || ch1.table_name AS "COMPRESS_CHUNK_1"
FROM _timescaledb_catalog.chunk ch1, _timescaledb_catalog.hypertable ht
WHERE ch1.hypertable_id = ht.id AND ch1.table_name LIKE 'compress_%'
ORDER BY ch1.id LIMIT 1 \gset
-- get SECOND compressed chunk
SELECT ch1.schema_name|| '.' || ch1.table_name AS "COMPRESS_CHUNK_2"
FROM _timescaledb_catalog.chunk ch1, _timescaledb_catalog.hypertable ht
WHERE ch1.hypertable_id = ht.id AND ch1.table_name LIKE 'compress_%'
ORDER BY ch1.id DESC LIMIT 1 \gset
-- there should 2 rows matching the conditions coming from 2 chunks
SELECT * FROM sample_table WHERE  device_id = 3 ORDER BY time, device_id;
 time | device_id | val 
------+-----------+-----
    3 |         3 |   1
   10 |         3 |   2
(2 rows)

-- get total rowcount from compressed chunks
SELECT COUNT(*) FROM :COMPRESS_CHUNK_1;
 count 
-------
     3
(1 row)

SELECT COUNT(*) FROM :COMPRESS_CHUNK_2;
 count 
-------
     3
(1 row)

-- get rowcount from compressed chunks where device_id = 3
SELECT COUNT(*) FROM :COMPRESS_CHUNK_1 WHERE device_id = 3;
 count 
-------
     1
(1 row)

SELECT COUNT(*) FROM :COMPRESS_CHUNK_2 WHERE device_id = 3;
 count 
-------
     1
(1 row)

-- delete rows with device_id = 3
DELETE FROM sample_table WHERE device_id = 3;
-- get total rowcount from compressed chunks
SELECT COUNT(*) FROM :COMPRESS_CHUNK_1;
 count 
-------
     2
(1 row)

SELECT COUNT(*) FROM :COMPRESS_CHUNK_2;
 count 
-------
     2
(1 row)

-- get rowcount from compressed chunks where device_id = 3
SELECT COUNT(*) FROM :COMPRESS_CHUNK_1 WHERE device_id = 3;
 count 
-------
     0
(1 row)

SELECT COUNT(*) FROM :COMPRESS_CHUNK_2 WHERE device_id = 3;
 count 
-------
     0
(1 row)

-- there should be no rows
SELECT * FROM sample_table WHERE  device_id = 3 ORDER BY time, device_id;
 time | device_id | val 
------+-----------+-----
(0 rows)

-- there should 2 rows matching the conditions coming from 2 chunks
SELECT val FROM sample_table WHERE  1 = device_id ORDER BY time, device_id;
 val 
-----
   1
   2
(2 rows)

-- get total rowcount from compressed chunks
SELECT COUNT(*) FROM :COMPRESS_CHUNK_1;
 count 
-------
     2
(1 row)

SELECT COUNT(*) FROM :COMPRESS_CHUNK_2;
 count 
-------
     2
(1 row)

-- get rowcount from compressed chunks where device_id = 1
SELECT COUNT(*) FROM :COMPRESS_CHUNK_1 WHERE 1 = device_id;
 count 
-------
     1
(1 row)

SELECT COUNT(*) FROM :COMPRESS_CHUNK_2 WHERE 1 = device_id;
 count 
-------
     1
(1 row)

-- update rows with device_id = 1
UPDATE sample_table SET val = 200 WHERE 1 = device_id;
-- get total rowcount from compressed chunks
SELECT COUNT(*) FROM :COMPRESS_CHUNK_1;
 count 
-------
     1
(1 row)

SELECT COUNT(*) FROM :COMPRESS_CHUNK_2;
 count 
-------
     1
(1 row)

-- get rowcount from compressed chunks where device_id = 1
SELECT COUNT(*) FROM :COMPRESS_CHUNK_1 WHERE 1 = device_id;
 count 
-------
     0
(1 row)

SELECT COUNT(*) FROM :COMPRESS_CHUNK_2 WHERE 1 = device_id;
 count 
-------
     0
(1 row)

-- there should be 2 rows
SELECT val FROM sample_table WHERE  1 = device_id ORDER BY time, device_id;
 val 
-----
 200
 200
(2 rows)

DROP TABLE sample_table;
CREATE TABLE sample_table(
    time INT NOT NULL,
    device_id INT,
    val INT);
SELECT * FROM create_hypertable('sample_table', 'time', chunk_time_interval => 10);
 hypertable_id | schema_name |  table_name  | created 
---------------+-------------+--------------+---------
             5 | public      | sample_table | t
(1 row)

ALTER TABLE sample_table SET (
    timescaledb.compress,
    timescaledb.compress_segmentby = 'time, val');
INSERT INTO sample_table VALUES (1, 1, 1), (2, 2, 1), (3, 3, 1), (1, 3, 2), (11, 4, 2), (1, 1, 2);
-- compress all chunks
SELECT compress_chunk(show_chunks('sample_table'));
             compress_chunk              
-----------------------------------------
 _timescaledb_internal._hyper_5_9_chunk
 _timescaledb_internal._hyper_5_10_chunk
(2 rows)

-- get FIRST compressed chunk
SELECT ch1.schema_name|| '.' || ch1.table_name AS "COMPRESS_CHUNK_1"
FROM _timescaledb_catalog.chunk ch1, _timescaledb_catalog.hypertable ht
WHERE ch1.hypertable_id = ht.id AND ch1.table_name LIKE 'compress_%'
ORDER BY ch1.id LIMIT 1 \gset
-- get SECOND compressed chunk
SELECT ch1.schema_name|| '.' || ch1.table_name AS "COMPRESS_CHUNK_2"
FROM _timescaledb_catalog.chunk ch1, _timescaledb_catalog.hypertable ht
WHERE ch1.hypertable_id = ht.id AND ch1.table_name LIKE 'compress_%'
ORDER BY ch1.id DESC LIMIT 1 \gset
-- there should 2 rows matching the conditions coming from 2 chunks
SELECT * FROM sample_table WHERE time = 1 AND val = 2 ORDER BY time, device_id;
 time | device_id | val 
------+-----------+-----
    1 |         1 |   2
    1 |         3 |   2
(2 rows)

-- get total rowcount from compressed chunks
SELECT COUNT(*) FROM :COMPRESS_CHUNK_1;
 count 
-------
     4
(1 row)

SELECT COUNT(*) FROM :COMPRESS_CHUNK_2;
 count 
-------
     1
(1 row)

-- get rowcount from compressed chunks where time = 1 AND val = 2
SELECT COUNT(*) FROM :COMPRESS_CHUNK_1 WHERE time = 1 AND val = 2;
 count 
-------
     1
(1 row)

SELECT COUNT(*) FROM :COMPRESS_CHUNK_2 WHERE time = 1 AND val = 2;
 count 
-------
     0
(1 row)

-- delete rows with time = 1 AND val = 2
EXPLAIN (costs off, verbose) DELETE FROM sample_table WHERE time = 1 AND 2 = val;
                                    QUERY PLAN                                    
----------------------------------------------------------------------------------
 Custom Scan (HypertableModify)
   ->  Delete on public.sample_table
         Delete on _timescaledb_internal._hyper_5_9_chunk sample_table_1
         ->  Seq Scan on _timescaledb_internal._hyper_5_9_chunk sample_table_1
               Output: sample_table_1.tableoid, sample_table_1.ctid
               Filter: ((sample_table_1."time" = 1) AND (2 = sample_table_1.val))
(6 rows)

-- should delete rows from 1 of the compressed chunks
DELETE FROM sample_table WHERE time = 1 AND 2 = val;
-- get total rowcount from compressed chunks
SELECT COUNT(*) FROM :COMPRESS_CHUNK_1;
 count 
-------
     3
(1 row)

SELECT COUNT(*) FROM :COMPRESS_CHUNK_2;
 count 
-------
     1
(1 row)

-- get rowcount from compressed chunks wheretime = 1 AND val = 2
SELECT COUNT(*) FROM :COMPRESS_CHUNK_1 WHERE time = 1 AND val = 2;
 count 
-------
     0
(1 row)

SELECT COUNT(*) FROM :COMPRESS_CHUNK_2 WHERE time = 1 AND val = 2;
 count 
-------
     0
(1 row)

-- there should be no rows
SELECT * FROM sample_table WHERE time = 1 AND val = 2 ORDER BY time, device_id;
 time | device_id | val 
------+-----------+-----
(0 rows)

DROP TABLE sample_table;
-- Test chunk compile time startup exclusion
CREATE OR REPLACE FUNCTION now_s()
RETURNS timestamptz LANGUAGE PLPGSQL STABLE AS
$BODY$
BEGIN
    RETURN '2017-08-22T10:00:00'::timestamptz;
END;
$BODY$;
CREATE TABLE sample_table(time timestamptz NOT NULL, temp float, colorid integer, attr jsonb);
SELECT create_hypertable('sample_table', 'time', chunk_time_interval => 2628000000000);
     create_hypertable     
---------------------------
 (7,public,sample_table,t)
(1 row)

-- create three chunks
INSERT INTO sample_table VALUES ('2017-03-22T09:18:22', 23.5, 1, '{"a": 1, "b": 2}'),
                                ('2017-03-22T09:18:23', 21.5, 1, '{"a": 1, "b": 2}'),
                                ('2017-05-22T09:18:22', 36.2, 2, '{"c": 3, "b": 2}'),
                                ('2017-05-22T09:18:23', 15.2, 2, '{"c": 3}'),
                                ('2017-08-22T09:18:22', 34.1, 3, '{"c": 4}');
ALTER TABLE sample_table SET (timescaledb.compress,
                              timescaledb.compress_segmentby = 'time');
SELECT compress_chunk(show_chunks('sample_table'));
             compress_chunk              
-----------------------------------------
 _timescaledb_internal._hyper_7_13_chunk
 _timescaledb_internal._hyper_7_14_chunk
 _timescaledb_internal._hyper_7_15_chunk
(3 rows)

-- ensure all chunks are compressed
SELECT chunk_status,
       chunk_name as "CHUNK_NAME"
FROM compressed_chunk_info_view
WHERE hypertable_name = 'sample_table' ORDER BY chunk_name;
 chunk_status |    CHUNK_NAME     
--------------+-------------------
            1 | _hyper_7_13_chunk
            1 | _hyper_7_14_chunk
            1 | _hyper_7_15_chunk
(3 rows)

-- report 0 rows
SELECT * FROM sample_table WHERE time > now_s() + '-1 month' AND colorid = 4;
 time | temp | colorid | attr 
------+------+---------+------
(0 rows)

-- update 1 row
UPDATE sample_table SET colorid = 4 WHERE time > now_s() + '-1 month';
-- report 1 row
SELECT * FROM sample_table WHERE time > now_s() + '-1 month' AND colorid = 4;
             time             | temp | colorid |   attr   
------------------------------+------+---------+----------
 Tue Aug 22 09:18:22 2017 PDT | 34.1 |       4 | {"c": 4}
(1 row)

-- ensure that 1 chunk is partially compressed
SELECT chunk_status,
       chunk_name as "CHUNK_NAME"
FROM compressed_chunk_info_view
WHERE hypertable_name = 'sample_table' ORDER BY chunk_name;
 chunk_status |    CHUNK_NAME     
--------------+-------------------
            1 | _hyper_7_13_chunk
            1 | _hyper_7_14_chunk
            9 | _hyper_7_15_chunk
(3 rows)

DROP TABLE sample_table;
-- test for NULL values in SEGMENTBY column
CREATE TABLE sample_table(
    time INT,
    device_id INT,
    val INT);
SELECT * FROM create_hypertable('sample_table', 'time', chunk_time_interval => 10);
NOTICE:  adding not-null constraint to column "time"
 hypertable_id | schema_name |  table_name  | created 
---------------+-------------+--------------+---------
             9 | public      | sample_table | t
(1 row)

ALTER TABLE sample_table SET (
    timescaledb.compress,
    timescaledb.compress_orderby = 'time',
    timescaledb.compress_segmentby = 'device_id');
INSERT INTO sample_table VALUES (1, 1, 1), (2, NULL, 1), (3, NULL, 1), (10, NULL, 2), (11, NULL, 2), (11, 1, 2);
-- compress all chunks
SELECT compress_chunk(show_chunks('sample_table'));
             compress_chunk              
-----------------------------------------
 _timescaledb_internal._hyper_9_19_chunk
 _timescaledb_internal._hyper_9_20_chunk
(2 rows)

-- get FIRST compressed chunk
SELECT ch1.schema_name|| '.' || ch1.table_name AS "COMPRESS_CHUNK_1"
FROM _timescaledb_catalog.chunk ch1, _timescaledb_catalog.hypertable ht
WHERE ch1.hypertable_id = ht.id AND ch1.table_name LIKE 'compress_%'
ORDER BY ch1.id LIMIT 1 \gset
-- get SECOND compressed chunk
SELECT ch1.schema_name|| '.' || ch1.table_name AS "COMPRESS_CHUNK_2"
FROM _timescaledb_catalog.chunk ch1, _timescaledb_catalog.hypertable ht
WHERE ch1.hypertable_id = ht.id AND ch1.table_name LIKE 'compress_%'
ORDER BY ch1.id DESC LIMIT 1 \gset
-- get total rowcount from compressed chunks
SELECT COUNT(*) FROM :COMPRESS_CHUNK_1;
 count 
-------
     2
(1 row)

SELECT COUNT(*) FROM :COMPRESS_CHUNK_2;
 count 
-------
     2
(1 row)

-- get rowcount from compressed chunks where device_id IS NULL
SELECT COUNT(*) FROM :COMPRESS_CHUNK_1 WHERE device_id IS NULL;
 count 
-------
     1
(1 row)

SELECT COUNT(*) FROM :COMPRESS_CHUNK_2 WHERE device_id IS NULL;
 count 
-------
     1
(1 row)

-- get total count of SEGMENTBY column with NULL values
SELECT COUNT(*) FROM sample_table WHERE device_id IS NULL;
 count 
-------
     4
(1 row)

-- delete NULL values in SEGMENTBY column
DELETE FROM sample_table WHERE device_id IS NULL;
-- ensure that not all rows are moved to staging area
-- should have few compressed rows
SELECT COUNT(*) FROM :COMPRESS_CHUNK_1;
 count 
-------
     1
(1 row)

SELECT COUNT(*) FROM :COMPRESS_CHUNK_2;
 count 
-------
     1
(1 row)

-- get rowcount from compressed chunks where device_id IS NULL
-- should report 0 rows
SELECT COUNT(*) FROM :COMPRESS_CHUNK_1 WHERE device_id IS NULL;
 count 
-------
     0
(1 row)

SELECT COUNT(*) FROM :COMPRESS_CHUNK_2 WHERE device_id IS NULL;
 count 
-------
     0
(1 row)

-- check chunk compression status after DELETE
SELECT chunk_status,
       chunk_name as "CHUNK_NAME"
FROM compressed_chunk_info_view
WHERE hypertable_name = 'sample_table' ORDER BY chunk_name;
 chunk_status |    CHUNK_NAME     
--------------+-------------------
            9 | _hyper_9_19_chunk
            9 | _hyper_9_20_chunk
(2 rows)

DROP TABLE sample_table;
-- test for IS NOT NULL values in SEGMENTBY column
CREATE TABLE sample_table(
    time INT,
    device_id INT,
    val INT);
SELECT * FROM create_hypertable('sample_table', 'time', chunk_time_interval => 10);
NOTICE:  adding not-null constraint to column "time"
 hypertable_id | schema_name |  table_name  | created 
---------------+-------------+--------------+---------
            11 | public      | sample_table | t
(1 row)

ALTER TABLE sample_table SET (
    timescaledb.compress,
    timescaledb.compress_orderby = 'time',
    timescaledb.compress_segmentby = 'device_id');
INSERT INTO sample_table VALUES (1, NULL, 1), (2, NULL, 1), (3, NULL, 1), (10, 3, 2), (11, 2, 2), (11, 1, 2);
-- compress all chunks
SELECT compress_chunk(show_chunks('sample_table'));
              compress_chunk              
------------------------------------------
 _timescaledb_internal._hyper_11_23_chunk
 _timescaledb_internal._hyper_11_24_chunk
(2 rows)

-- get FIRST compressed chunk
SELECT ch1.schema_name|| '.' || ch1.table_name AS "COMPRESS_CHUNK_1"
FROM _timescaledb_catalog.chunk ch1, _timescaledb_catalog.hypertable ht
WHERE ch1.hypertable_id = ht.id AND ch1.table_name LIKE 'compress_%'
ORDER BY ch1.id LIMIT 1 \gset
-- get SECOND compressed chunk
SELECT ch1.schema_name|| '.' || ch1.table_name AS "COMPRESS_CHUNK_2"
FROM _timescaledb_catalog.chunk ch1, _timescaledb_catalog.hypertable ht
WHERE ch1.hypertable_id = ht.id AND ch1.table_name LIKE 'compress_%'
ORDER BY ch1.id DESC LIMIT 1 \gset
SELECT COUNT(*) FROM sample_table WHERE val = 1234;
 count 
-------
     0
(1 row)

-- UPDATE based on IS NOT NULL condition on SEGMENTBY column
UPDATE sample_table SET val = 1234 WHERE device_id IS NOT NULL;
-- get total count of SEGMENTBY column with NULL values
SELECT COUNT(*) FROM sample_table WHERE val = 1234;
 count 
-------
     3
(1 row)

-- check chunk compression status after DELETE
SELECT chunk_status,
       chunk_name as "CHUNK_NAME"
FROM compressed_chunk_info_view
WHERE hypertable_name = 'sample_table' ORDER BY chunk_name;
 chunk_status |     CHUNK_NAME     
--------------+--------------------
            1 | _hyper_11_23_chunk
            9 | _hyper_11_24_chunk
(2 rows)

DROP TABLE sample_table;
-- test to for <= AND >= on SEGMENTBY column
CREATE TABLE sample_table(
    time INT,
    device_id INT,
    val INT);
SELECT * FROM create_hypertable('sample_table', 'time', chunk_time_interval => 10);
NOTICE:  adding not-null constraint to column "time"
 hypertable_id | schema_name |  table_name  | created 
---------------+-------------+--------------+---------
            13 | public      | sample_table | t
(1 row)

ALTER TABLE sample_table SET (
    timescaledb.compress,
    timescaledb.compress_orderby = 'time',
    timescaledb.compress_segmentby = 'device_id, val');
INSERT INTO sample_table VALUES (1, 1, 1), (2, NULL, 1), (3, 4, 1), (10, NULL, 2), (11, NULL, 2), (11, 1, 2), (13, 5, 3);
INSERT INTO sample_table VALUES (4, 3, NULL), (6, NULL, NULL), (12, NULL, NULL), (13, 4, NULL);
-- compress all chunks
SELECT compress_chunk(show_chunks('sample_table'));
              compress_chunk              
------------------------------------------
 _timescaledb_internal._hyper_13_27_chunk
 _timescaledb_internal._hyper_13_28_chunk
(2 rows)

-- test will multiple NULL/NOT NULL columns
BEGIN;
-- report 0 row
SELECT * FROM sample_table WHERE device_id IS NULL AND val = 987;
 time | device_id | val 
------+-----------+-----
(0 rows)

-- these 3 rows will be affected by below UPDATE
SELECT * FROM sample_table WHERE device_id IS NULL AND val IS NOT NULL ORDER BY 1;
 time | device_id | val 
------+-----------+-----
    2 |           |   1
   10 |           |   2
   11 |           |   2
(3 rows)

-- update 3 rows
UPDATE sample_table SET val = 987 WHERE device_id IS NULL AND val IS NOT NULL;
-- report 3 row
SELECT * FROM sample_table WHERE device_id IS NULL AND val = 987;
 time | device_id | val 
------+-----------+-----
    2 |           | 987
   10 |           | 987
   11 |           | 987
(3 rows)

ROLLBACK;
-- test will multiple columns
BEGIN;
-- report 2 rows
SELECT * FROM sample_table WHERE device_id IS NULL AND val = 2;
 time | device_id | val 
------+-----------+-----
   10 |           |   2
   11 |           |   2
(2 rows)

-- delete 2 rows
DELETE from sample_table WHERE device_id IS NULL AND val = 2;
-- report 0 rows
SELECT * FROM sample_table WHERE device_id IS NULL AND val = 2;
 time | device_id | val 
------+-----------+-----
(0 rows)

ROLLBACK;
BEGIN;
-- report 1 row
SELECT * FROM sample_table WHERE device_id = 3 AND val IS NULL;
 time | device_id | val 
------+-----------+-----
    4 |         3 |    
(1 row)

-- delete 1 rows
DELETE from sample_table WHERE device_id = 3 AND val IS NULL;
-- report 0 rows
SELECT * FROM sample_table WHERE device_id = 3 AND val IS NULL;
 time | device_id | val 
------+-----------+-----
(0 rows)

ROLLBACK;
-- get FIRST compressed chunk
SELECT ch1.schema_name|| '.' || ch1.table_name AS "COMPRESS_CHUNK_1"
FROM _timescaledb_catalog.chunk ch1, _timescaledb_catalog.hypertable ht
WHERE ch1.hypertable_id = ht.id AND ch1.table_name LIKE 'compress_%'
ORDER BY ch1.id LIMIT 1 \gset
-- get SECOND compressed chunk
SELECT ch1.schema_name|| '.' || ch1.table_name AS "COMPRESS_CHUNK_2"
FROM _timescaledb_catalog.chunk ch1, _timescaledb_catalog.hypertable ht
WHERE ch1.hypertable_id = ht.id AND ch1.table_name LIKE 'compress_%'
ORDER BY ch1.id DESC LIMIT 1 \gset
-- get total rowcount from compressed chunks
SELECT COUNT(*) FROM :COMPRESS_CHUNK_1;
 count 
-------
     5
(1 row)

SELECT COUNT(*) FROM :COMPRESS_CHUNK_2;
 count 
-------
     5
(1 row)

-- get rowcount from compressed chunks where device_id >= 4 AND val <= 1
SELECT COUNT(*) FROM :COMPRESS_CHUNK_1 WHERE device_id >= 4 AND val <= 1;
 count 
-------
     1
(1 row)

SELECT COUNT(*) FROM :COMPRESS_CHUNK_2 WHERE device_id >= 4 AND val <= 1;
 count 
-------
     0
(1 row)

-- get total count of SEGMENTBY column with device_id >= 4 AND val <= 1
SELECT COUNT(*) FROM sample_table WHERE device_id >= 4 AND val <= 1;
 count 
-------
     1
(1 row)

-- delete NULL values in SEGMENTBY column
DELETE FROM sample_table WHERE device_id >= 4 AND val <= 1;
-- ensure that not all rows are moved to staging area
-- should have few compressed rows
SELECT COUNT(*) FROM :COMPRESS_CHUNK_1;
 count 
-------
     4
(1 row)

SELECT COUNT(*) FROM :COMPRESS_CHUNK_2;
 count 
-------
     5
(1 row)

-- get rowcount from compressed chunks where device_id IS NULL
-- should report 0 rows
SELECT COUNT(*) FROM :COMPRESS_CHUNK_1 WHERE device_id >= 4 AND val <= 1;
 count 
-------
     0
(1 row)

SELECT COUNT(*) FROM :COMPRESS_CHUNK_2 WHERE device_id >= 4 AND val <= 1;
 count 
-------
     0
(1 row)

-- check chunk compression status after DELETE
SELECT chunk_status,
       chunk_name as "CHUNK_NAME"
FROM compressed_chunk_info_view
WHERE hypertable_name = 'sample_table' ORDER BY chunk_name;
 chunk_status |     CHUNK_NAME     
--------------+--------------------
            9 | _hyper_13_27_chunk
            1 | _hyper_13_28_chunk
(2 rows)

-- added tests for code coverage
UPDATE sample_table SET time = 21 WHERE (device_id) in ( 30, 51, 72, 53);
UPDATE sample_table SET time = 21 WHERE device_id + 365 = 8765;
DROP TABLE sample_table;
-- test with different physical layout
CREATE TABLE sample_table(
    time INT,
    device_id INT,
    val INT default 8,
    a INT default 10,
    b INT default 11,
    c INT default 12,
    d INT,
    e INT default 13);
SELECT * FROM create_hypertable('sample_table', 'time', chunk_time_interval => 5);
NOTICE:  adding not-null constraint to column "time"
 hypertable_id | schema_name |  table_name  | created 
---------------+-------------+--------------+---------
            15 | public      | sample_table | t
(1 row)

INSERT INTO sample_table (time, device_id, d) VALUES (1, 1, 1), (2, NULL, 1), (3, 4, 1), (10, NULL, 2), (11, NULL, 2), (11, 1, 2), (13, 5, 3);
ALTER TABLE sample_table DROP COLUMN c;
ALTER TABLE sample_table SET (
    timescaledb.compress,
    timescaledb.compress_segmentby = 'device_id, d');
-- compress all chunks
SELECT compress_chunk(show_chunks('sample_table'));
              compress_chunk              
------------------------------------------
 _timescaledb_internal._hyper_15_31_chunk
 _timescaledb_internal._hyper_15_32_chunk
(2 rows)

ALTER TABLE sample_table ADD COLUMN c int default 23;
-- check chunk compression status
SELECT chunk_status,
       chunk_name as "CHUNK_NAME"
FROM compressed_chunk_info_view
WHERE hypertable_name = 'sample_table' ORDER BY chunk_name;
 chunk_status |     CHUNK_NAME     
--------------+--------------------
            1 | _hyper_15_31_chunk
            1 | _hyper_15_32_chunk
(2 rows)

-- get FIRST uncompressed chunk
SELECT ch1.schema_name|| '.' || ch1.table_name AS "UNCOMPRESS_CHUNK_1"
FROM _timescaledb_catalog.chunk ch1, _timescaledb_catalog.hypertable ht
WHERE ch1.hypertable_id = ht.id AND ch1.table_name LIKE '_hyper_%'
ORDER BY ch1.id LIMIT 1 \gset
-- get SECOND uncompressed chunk
SELECT ch1.schema_name|| '.' || ch1.table_name AS "UNCOMPRESS_CHUNK_2"
FROM _timescaledb_catalog.chunk ch1, _timescaledb_catalog.hypertable ht
WHERE ch1.hypertable_id = ht.id AND ch1.table_name LIKE '_hyper_%'
ORDER BY ch1.id DESC LIMIT 1 \gset
-- get FIRST compressed chunk
SELECT ch1.schema_name|| '.' || ch1.table_name AS "COMPRESS_CHUNK_1"
FROM _timescaledb_catalog.chunk ch1, _timescaledb_catalog.hypertable ht
WHERE ch1.hypertable_id = ht.id AND ch1.table_name LIKE 'compress_%'
ORDER BY ch1.id LIMIT 1 \gset
-- get SECOND compressed chunk
SELECT ch1.schema_name|| '.' || ch1.table_name AS "COMPRESS_CHUNK_2"
FROM _timescaledb_catalog.chunk ch1, _timescaledb_catalog.hypertable ht
WHERE ch1.hypertable_id = ht.id AND ch1.table_name LIKE 'compress_%'
ORDER BY ch1.id DESC LIMIT 1 \gset
-- ensure segment by column index position in compressed and uncompressed
-- chunk is different
SELECT attname, attnum
FROM pg_attribute
WHERE attrelid IN (:'COMPRESS_CHUNK_1'::regclass, :'UNCOMPRESS_CHUNK_1'::regclass) AND attname = 'd'
ORDER BY attnum;
 attname | attnum 
---------+--------
 d       |      6
 d       |      7
(2 rows)

SELECT attname, attnum
FROM pg_attribute
WHERE attrelid IN (:'COMPRESS_CHUNK_2'::regclass, :'UNCOMPRESS_CHUNK_2'::regclass) AND attname = 'd'
ORDER BY attnum;
 attname | attnum 
---------+--------
 d       |      6
 d       |      7
(2 rows)

-- get total rowcount from compressed chunks
SELECT COUNT(*) FROM :COMPRESS_CHUNK_1;
 count 
-------
     3
(1 row)

SELECT COUNT(*) FROM :COMPRESS_CHUNK_2;
 count 
-------
     3
(1 row)

-- get rowcount from compressed chunks where d = 3
SELECT COUNT(*) FROM :COMPRESS_CHUNK_1 WHERE d = 3;
 count 
-------
     0
(1 row)

SELECT COUNT(*) FROM :COMPRESS_CHUNK_2 WHERE d = 3;
 count 
-------
     1
(1 row)

-- get total count of SEGMENTBY column with d = 3
SELECT COUNT(*) FROM sample_table WHERE d = 3;
 count 
-------
     1
(1 row)

-- delete based on SEGMENTBY column
DELETE FROM sample_table WHERE d = 3;
-- ensure that not all rows are moved to staging area
-- should have few compressed rows
SELECT COUNT(*) FROM :COMPRESS_CHUNK_1;
 count 
-------
     3
(1 row)

SELECT COUNT(*) FROM :COMPRESS_CHUNK_2;
 count 
-------
     2
(1 row)

-- get rowcount from compressed chunks where d = 3
SELECT COUNT(*) FROM :COMPRESS_CHUNK_1 WHERE d = 3;
 count 
-------
     0
(1 row)

SELECT COUNT(*) FROM :COMPRESS_CHUNK_2 WHERE d = 3;
 count 
-------
     0
(1 row)

-- check chunk compression status after DELETE
SELECT chunk_status,
       chunk_name as "CHUNK_NAME"
FROM compressed_chunk_info_view
WHERE hypertable_name = 'sample_table' ORDER BY chunk_name;
 chunk_status |     CHUNK_NAME     
--------------+--------------------
            1 | _hyper_15_31_chunk
            9 | _hyper_15_32_chunk
(2 rows)

-- get rowcount from compressed chunks where device_id IS NULL
SELECT COUNT(*) FROM :COMPRESS_CHUNK_1 WHERE device_id IS NULL;
 count 
-------
     1
(1 row)

SELECT COUNT(*) FROM :COMPRESS_CHUNK_2 WHERE device_id IS NULL;
 count 
-------
     1
(1 row)

BEGIN;
-- report 0 row
SELECT * FROM sample_table WHERE a = 247;
 time | device_id | val | a | b | d | e | c 
------+-----------+-----+---+---+---+---+---
(0 rows)

-- delete 1 row
UPDATE sample_table SET a = 247 WHERE device_id IS NULL;
-- ensure rows are visible
SELECT * FROM sample_table WHERE a = 247;
 time | device_id | val |  a  | b  | d | e  | c  
------+-----------+-----+-----+----+---+----+----
    2 |           |   8 | 247 | 11 | 1 | 13 | 23
   11 |           |   8 | 247 | 11 | 2 | 13 | 23
   10 |           |   8 | 247 | 11 | 2 | 13 | 23
(3 rows)

ROLLBACK;
-- report 0 rows
SELECT COUNT(*) FROM sample_table WHERE a = 247;
 count 
-------
     0
(1 row)

-- UPDATE based on NULL values in SEGMENTBY column
UPDATE sample_table SET a = 247 WHERE device_id IS NULL;
-- report 3 rows
SELECT COUNT(*) FROM sample_table WHERE a = 247;
 count 
-------
     3
(1 row)

-- ensure that not all rows are moved to staging area
-- should have few compressed rows
SELECT COUNT(*) FROM :COMPRESS_CHUNK_1;
 count 
-------
     2
(1 row)

SELECT COUNT(*) FROM :COMPRESS_CHUNK_2;
 count 
-------
     1
(1 row)

-- get rowcount from compressed chunks where device_id IS NULL
-- should report 0 rows
SELECT COUNT(*) FROM :COMPRESS_CHUNK_1 WHERE device_id IS NULL;
 count 
-------
     0
(1 row)

SELECT COUNT(*) FROM :COMPRESS_CHUNK_2 WHERE device_id IS NULL;
 count 
-------
     0
(1 row)

DROP TABLE sample_table;
-- test with different physical layout
CREATE TABLE sample_table(time timestamptz, c1 text, c2 text, c3 text);
SELECT create_hypertable('sample_table','time');
NOTICE:  adding not-null constraint to column "time"
     create_hypertable      
----------------------------
 (17,public,sample_table,t)
(1 row)

INSERT INTO sample_table SELECT '2000-01-01';
ALTER TABLE sample_table DROP column c3;
ALTER TABLE sample_table ADD column c4 text;
INSERT INTO sample_table SELECT '2000-01-01', '1', '2', '3';
ALTER TABLE sample_table SET (timescaledb.compress,timescaledb.compress_segmentby='c4');
SELECT compress_chunk(show_chunks('sample_table'));
              compress_chunk              
------------------------------------------
 _timescaledb_internal._hyper_17_35_chunk
(1 row)

BEGIN;
-- report 1 row
SELECT * FROM sample_table WHERE c4 IS NULL;
             time             | c1 | c2 | c4 
------------------------------+----+----+----
 Sat Jan 01 00:00:00 2000 PST |    |    | 
(1 row)

-- delete 1 row
DELETE FROM sample_table WHERE c4 IS NULL;
-- report 0 rows
SELECT * FROM sample_table WHERE c4 IS NULL;
 time | c1 | c2 | c4 
------+----+----+----
(0 rows)

ROLLBACK;
-- get FIRST compressed chunk
SELECT ch1.schema_name|| '.' || ch1.table_name AS "COMPRESS_CHUNK_1"
FROM _timescaledb_catalog.chunk ch1, _timescaledb_catalog.hypertable ht
WHERE ch1.hypertable_id = ht.id AND ch1.table_name LIKE 'compress_%'
ORDER BY ch1.id \gset
-- report 2 rows
SELECT COUNT(*) FROM :COMPRESS_CHUNK_1;
 count 
-------
     2
(1 row)

-- report 1 row
SELECT COUNT(*) FROM :COMPRESS_CHUNK_1 WHERE c4 IS NULL;
 count 
-------
     1
(1 row)

-- report 1 row
SELECT * FROM sample_table WHERE c4 IS NULL;
             time             | c1 | c2 | c4 
------------------------------+----+----+----
 Sat Jan 01 00:00:00 2000 PST |    |    | 
(1 row)

-- delete 1 row
DELETE FROM sample_table WHERE c4 IS NULL;
-- report 0 row
SELECT * FROM sample_table WHERE c4 IS NULL;
 time | c1 | c2 | c4 
------+----+----+----
(0 rows)

-- report 1 row which ensure that only required row is moved and deleted
SELECT COUNT(*) FROM :COMPRESS_CHUNK_1;
 count 
-------
     1
(1 row)

-- report 0 row
SELECT COUNT(*) FROM :COMPRESS_CHUNK_1 WHERE c4 IS NULL;
 count 
-------
     0
(1 row)

DROP TABLE sample_table;
-- test filtering with ORDER BY columns
CREATE TABLE sample_table(time timestamptz, c1 int, c2 int, c3 int, c4 int);
SELECT create_hypertable('sample_table','time',chunk_time_interval=>'1 day'::interval);
NOTICE:  adding not-null constraint to column "time"
     create_hypertable      
----------------------------
 (19,public,sample_table,t)
(1 row)

ALTER TABLE sample_table SET (timescaledb.compress,timescaledb.compress_segmentby='c4', timescaledb.compress_orderby='c1,c2,time');
INSERT INTO sample_table
SELECT t, c1, c2, c3, c4
FROM generate_series(:'start_date'::timestamptz - INTERVAL '9 hours',
            :'start_date'::timestamptz,
            INTERVAL '1 hour') t,
    generate_series(0,9,1) c1,
    generate_series(0,9,1) c2,
    generate_series(0,9,1) c3,
    generate_series(0,9,1) c4;
SELECT compress_chunk(show_chunks('sample_table'));
              compress_chunk              
------------------------------------------
 _timescaledb_internal._hyper_19_37_chunk
(1 row)

-- get FIRST chunk
SELECT ch1.schema_name|| '.' || ch1.table_name AS "CHUNK_1"
FROM _timescaledb_catalog.chunk ch1, _timescaledb_catalog.hypertable ht
WHERE ch1.hypertable_id = ht.id AND ch1.table_name LIKE '_hyper_%'
ORDER BY ch1.id LIMIT 1 \gset
-- get FIRST compressed chunk
SELECT ch1.schema_name|| '.' || ch1.table_name AS "COMPRESS_CHUNK_1"
FROM _timescaledb_catalog.chunk ch1, _timescaledb_catalog.hypertable ht
WHERE ch1.hypertable_id = ht.id AND ch1.table_name LIKE 'compress_%'
ORDER BY ch1.id LIMIT 1 \gset
-- check that you uncompress and delete only for exact SEGMENTBY value
SET client_min_messages TO DEBUG1;
BEGIN;
LOG:  statement: BEGIN;
-- report 10 rows
SELECT COUNT(*) FROM :COMPRESS_CHUNK_1 where c4 = 5;
LOG:  statement: SELECT COUNT(*) FROM _timescaledb_internal.compress_hyper_20_38_chunk where c4 = 5;
 count 
-------
    10
(1 row)

-- report 10k rows
SELECT COUNT(*) FROM sample_table WHERE c4 = 5;
LOG:  statement: SELECT COUNT(*) FROM sample_table WHERE c4 = 5;
 count 
-------
 10000
(1 row)

-- fetch total and number of affected rows
SELECT COUNT(*) AS "total_rows" FROM sample_table \gset
LOG:  statement: SELECT COUNT(*) AS "total_rows" FROM sample_table 
SELECT COUNT(*) AS "total_affected_rows" FROM sample_table WHERE c4 = 5 \gset
LOG:  statement: SELECT COUNT(*) AS "total_affected_rows" FROM sample_table WHERE c4 = 5 
-- delete 10k rows
DELETE FROM sample_table WHERE c4 = 5;
LOG:  statement: DELETE FROM sample_table WHERE c4 = 5;
DEBUG:  Number of compressed rows fetched from index: 10. Number of compressed rows filtered by orderby columns: 0.
-- report 0 rows
SELECT count(*) FROM sample_table WHERE c4 = 5;
LOG:  statement: SELECT count(*) FROM sample_table WHERE c4 = 5;
 count 
-------
     0
(1 row)

-- report 0 rows in uncompressed chunk
SELECT COUNT(*) FROM ONLY :CHUNK_1;
LOG:  statement: SELECT COUNT(*) FROM ONLY _timescaledb_internal._hyper_19_37_chunk;
 count 
-------
     0
(1 row)

-- report 0 rows in compressed chunk
SELECT COUNT(*) FROM :COMPRESS_CHUNK_1 where c4 = 5;
LOG:  statement: SELECT COUNT(*) FROM _timescaledb_internal.compress_hyper_20_38_chunk where c4 = 5;
 count 
-------
     0
(1 row)

-- validate correct number of rows was deleted
-- report true
SELECT COUNT(*) = :total_rows - :total_affected_rows FROM sample_table;
LOG:  statement: SELECT COUNT(*) = 100000 - 10000 FROM sample_table;
 ?column? 
----------
 t
(1 row)

ROLLBACK;
LOG:  statement: ROLLBACK;
-- check that you uncompress and delete only for less than SEGMENTBY value
BEGIN;
LOG:  statement: BEGIN;
-- report 50 rows
SELECT COUNT(*) FROM :COMPRESS_CHUNK_1 where c4 < 5;
LOG:  statement: SELECT COUNT(*) FROM _timescaledb_internal.compress_hyper_20_38_chunk where c4 < 5;
 count 
-------
    50
(1 row)

-- report 50k rows
SELECT COUNT(*) FROM sample_table WHERE c4 < 5;
LOG:  statement: SELECT COUNT(*) FROM sample_table WHERE c4 < 5;
 count 
-------
 50000
(1 row)

-- fetch total and number of affected rows
SELECT COUNT(*) AS "total_rows" FROM sample_table \gset
LOG:  statement: SELECT COUNT(*) AS "total_rows" FROM sample_table 
SELECT COUNT(*) AS "total_affected_rows" FROM sample_table WHERE c4 < 5 \gset
LOG:  statement: SELECT COUNT(*) AS "total_affected_rows" FROM sample_table WHERE c4 < 5 
-- delete 50k rows
DELETE FROM sample_table WHERE c4 < 5;
LOG:  statement: DELETE FROM sample_table WHERE c4 < 5;
DEBUG:  Number of compressed rows fetched from index: 50. Number of compressed rows filtered by orderby columns: 0.
-- report 0 rows
SELECT count(*) FROM sample_table WHERE c4 < 5;
LOG:  statement: SELECT count(*) FROM sample_table WHERE c4 < 5;
 count 
-------
     0
(1 row)

-- report 0 rows in uncompressed chunk
SELECT COUNT(*) FROM ONLY :CHUNK_1;
LOG:  statement: SELECT COUNT(*) FROM ONLY _timescaledb_internal._hyper_19_37_chunk;
 count 
-------
     0
(1 row)

-- report 0 rows in compressed chunk
SELECT COUNT(*) FROM :COMPRESS_CHUNK_1 where c4 < 5;
LOG:  statement: SELECT COUNT(*) FROM _timescaledb_internal.compress_hyper_20_38_chunk where c4 < 5;
 count 
-------
     0
(1 row)

-- validate correct number of rows was deleted
-- report true
SELECT COUNT(*) = :total_rows - :total_affected_rows FROM sample_table;
LOG:  statement: SELECT COUNT(*) = 100000 - 50000 FROM sample_table;
 ?column? 
----------
 t
(1 row)

ROLLBACK;
LOG:  statement: ROLLBACK;
-- check that you uncompress and delete only for greater and equal than SEGMENTBY value
BEGIN;
LOG:  statement: BEGIN;
-- report 50 rows
SELECT COUNT(*) FROM :COMPRESS_CHUNK_1 where c4 >= 5;
LOG:  statement: SELECT COUNT(*) FROM _timescaledb_internal.compress_hyper_20_38_chunk where c4 >= 5;
 count 
-------
    50
(1 row)

-- report 50k rows
SELECT COUNT(*) FROM sample_table WHERE c4 >= 5;
LOG:  statement: SELECT COUNT(*) FROM sample_table WHERE c4 >= 5;
 count 
-------
 50000
(1 row)

-- fetch total and number of affected rows
SELECT COUNT(*) AS "total_rows" FROM sample_table \gset
LOG:  statement: SELECT COUNT(*) AS "total_rows" FROM sample_table 
SELECT COUNT(*) AS "total_affected_rows" FROM sample_table WHERE c4 >= 5 \gset
LOG:  statement: SELECT COUNT(*) AS "total_affected_rows" FROM sample_table WHERE c4 >= 5 
-- delete 50k rows
DELETE FROM sample_table WHERE c4 >= 5;
LOG:  statement: DELETE FROM sample_table WHERE c4 >= 5;
DEBUG:  Number of compressed rows fetched from index: 50. Number of compressed rows filtered by orderby columns: 0.
-- report 0 rows
SELECT count(*) FROM sample_table WHERE c4 >= 5;
LOG:  statement: SELECT count(*) FROM sample_table WHERE c4 >= 5;
 count 
-------
     0
(1 row)

-- report 0 rows in uncompressed chunk
SELECT COUNT(*) FROM ONLY :CHUNK_1;
LOG:  statement: SELECT COUNT(*) FROM ONLY _timescaledb_internal._hyper_19_37_chunk;
 count 
-------
     0
(1 row)

-- report 0 rows in compressed chunk
SELECT COUNT(*) FROM :COMPRESS_CHUNK_1 where c4 >= 5;
LOG:  statement: SELECT COUNT(*) FROM _timescaledb_internal.compress_hyper_20_38_chunk where c4 >= 5;
 count 
-------
     0
(1 row)

-- validate correct number of rows was deleted
-- report true
SELECT COUNT(*) = :total_rows - :total_affected_rows FROM sample_table;
LOG:  statement: SELECT COUNT(*) = 100000 - 50000 FROM sample_table;
 ?column? 
----------
 t
(1 row)

ROLLBACK;
LOG:  statement: ROLLBACK;
-- check that you uncompress and delete only for exact ORDERBY value
-- this will uncompress segments which have min <= value and max >= value
BEGIN;
LOG:  statement: BEGIN;
-- report 10k rows
SELECT COUNT(*) FROM sample_table WHERE c2 = 3;
LOG:  statement: SELECT COUNT(*) FROM sample_table WHERE c2 = 3;
 count 
-------
 10000
(1 row)

-- report 100 rows
SELECT COUNT(*) FROM :COMPRESS_CHUNK_1 WHERE _ts_meta_min_2 <= 3 and _ts_meta_max_2 >= 3;
LOG:  statement: SELECT COUNT(*) FROM _timescaledb_internal.compress_hyper_20_38_chunk WHERE _ts_meta_min_2 <= 3 and _ts_meta_max_2 >= 3;
 count 
-------
   100
(1 row)

-- fetch total and number of affected rows
SELECT COUNT(*) AS "total_rows" FROM sample_table \gset
LOG:  statement: SELECT COUNT(*) AS "total_rows" FROM sample_table 
SELECT COUNT(*) AS "total_affected_rows" FROM sample_table WHERE c2 = 3 \gset
LOG:  statement: SELECT COUNT(*) AS "total_affected_rows" FROM sample_table WHERE c2 = 3 
-- delete 10k rows
DELETE FROM sample_table WHERE c2 = 3;
LOG:  statement: DELETE FROM sample_table WHERE c2 = 3;
-- report 0 rows
SELECT count(*) FROM sample_table WHERE c2 = 3;
LOG:  statement: SELECT count(*) FROM sample_table WHERE c2 = 3;
 count 
-------
     0
(1 row)

-- report 90k rows in uncompressed chunk
SELECT COUNT(*) FROM ONLY :CHUNK_1;
LOG:  statement: SELECT COUNT(*) FROM ONLY _timescaledb_internal._hyper_19_37_chunk;
 count 
-------
 90000
(1 row)

-- report 0 rows
SELECT COUNT(*) FROM :COMPRESS_CHUNK_1 WHERE _ts_meta_min_2 <= 3 and _ts_meta_max_2 >= 3;
LOG:  statement: SELECT COUNT(*) FROM _timescaledb_internal.compress_hyper_20_38_chunk WHERE _ts_meta_min_2 <= 3 and _ts_meta_max_2 >= 3;
 count 
-------
     0
(1 row)

-- validate correct number of rows was deleted
-- report true
SELECT COUNT(*) = :total_rows - :total_affected_rows FROM sample_table;
LOG:  statement: SELECT COUNT(*) = 100000 - 10000 FROM sample_table;
 ?column? 
----------
 t
(1 row)

ROLLBACK;
LOG:  statement: ROLLBACK;
-- check that you uncompress and delete only for less then ORDERBY value
-- this will uncompress segments which have min < value
BEGIN;
LOG:  statement: BEGIN;
-- report 20k rows
SELECT COUNT(*) FROM sample_table WHERE c1 < 2;
LOG:  statement: SELECT COUNT(*) FROM sample_table WHERE c1 < 2;
 count 
-------
 20000
(1 row)

-- report 20 rows
SELECT COUNT(*) FROM :COMPRESS_CHUNK_1 WHERE _ts_meta_max_1 < 2;
LOG:  statement: SELECT COUNT(*) FROM _timescaledb_internal.compress_hyper_20_38_chunk WHERE _ts_meta_max_1 < 2;
 count 
-------
    20
(1 row)

-- fetch total and number of affected rows
SELECT COUNT(*) AS "total_rows" FROM sample_table \gset
LOG:  statement: SELECT COUNT(*) AS "total_rows" FROM sample_table 
SELECT COUNT(*) AS "total_affected_rows" FROM sample_table WHERE c1 < 2 \gset
LOG:  statement: SELECT COUNT(*) AS "total_affected_rows" FROM sample_table WHERE c1 < 2 
-- delete 20k rows
DELETE FROM sample_table WHERE c1 < 2;
LOG:  statement: DELETE FROM sample_table WHERE c1 < 2;
-- report 0 rows
SELECT count(*) FROM sample_table WHERE c1 < 2;
LOG:  statement: SELECT count(*) FROM sample_table WHERE c1 < 2;
 count 
-------
     0
(1 row)

-- report 0 rows in uncompressed chunk
SELECT COUNT(*) FROM ONLY :CHUNK_1;
LOG:  statement: SELECT COUNT(*) FROM ONLY _timescaledb_internal._hyper_19_37_chunk;
 count 
-------
     0
(1 row)

-- report 0 rows in compressed chunk
SELECT COUNT(*) FROM :COMPRESS_CHUNK_1 WHERE _ts_meta_max_1 < 2;
LOG:  statement: SELECT COUNT(*) FROM _timescaledb_internal.compress_hyper_20_38_chunk WHERE _ts_meta_max_1 < 2;
 count 
-------
     0
(1 row)

-- validate correct number of rows was deleted
-- report true
SELECT COUNT(*) = :total_rows - :total_affected_rows FROM sample_table;
LOG:  statement: SELECT COUNT(*) = 100000 - 20000 FROM sample_table;
 ?column? 
----------
 t
(1 row)

ROLLBACK;
LOG:  statement: ROLLBACK;
-- check that you uncompress and delete only for greater or equal then ORDERBY value
-- this will uncompress segments which have max >= value
BEGIN;
LOG:  statement: BEGIN;
-- report 30k rows
SELECT COUNT(*) FROM sample_table WHERE c1 >= 7;
LOG:  statement: SELECT COUNT(*) FROM sample_table WHERE c1 >= 7;
 count 
-------
 30000
(1 row)

-- report 30 rows
SELECT COUNT(*) FROM :COMPRESS_CHUNK_1 WHERE _ts_meta_min_1 >= 7;
LOG:  statement: SELECT COUNT(*) FROM _timescaledb_internal.compress_hyper_20_38_chunk WHERE _ts_meta_min_1 >= 7;
 count 
-------
    30
(1 row)

-- fetch total and number of affected rows
SELECT COUNT(*) AS "total_rows" FROM sample_table \gset
LOG:  statement: SELECT COUNT(*) AS "total_rows" FROM sample_table 
SELECT COUNT(*) AS "total_affected_rows" FROM sample_table WHERE c1 >= 7 \gset
LOG:  statement: SELECT COUNT(*) AS "total_affected_rows" FROM sample_table WHERE c1 >= 7 
-- delete 30k rows
DELETE FROM sample_table WHERE c1 >= 7;
LOG:  statement: DELETE FROM sample_table WHERE c1 >= 7;
-- report 0 rows
SELECT count(*) FROM sample_table WHERE c1 >= 7;
LOG:  statement: SELECT count(*) FROM sample_table WHERE c1 >= 7;
 count 
-------
     0
(1 row)

-- report 0 rows in uncompressed chunk
SELECT COUNT(*) FROM ONLY :CHUNK_1;
LOG:  statement: SELECT COUNT(*) FROM ONLY _timescaledb_internal._hyper_19_37_chunk;
 count 
-------
     0
(1 row)

-- report 0 rows in compressed chunks
SELECT COUNT(*) FROM :COMPRESS_CHUNK_1 WHERE _ts_meta_min_1 >= 7;
LOG:  statement: SELECT COUNT(*) FROM _timescaledb_internal.compress_hyper_20_38_chunk WHERE _ts_meta_min_1 >= 7;
 count 
-------
     0
(1 row)

-- validate correct number of rows was deleted
-- report true
SELECT COUNT(*) = :total_rows - :total_affected_rows FROM sample_table;
LOG:  statement: SELECT COUNT(*) = 100000 - 30000 FROM sample_table;
 ?column? 
----------
 t
(1 row)

ROLLBACK;
LOG:  statement: ROLLBACK;
-- check that you uncompress and delete only tuples which satisfy SEGMENTBY
-- and ORDERBY qualifiers, segments only contain one distinct value for
-- these qualifiers, everything should be deleted that was decompressed
BEGIN;
LOG:  statement: BEGIN;
-- report 1k rows
SELECT COUNT(*) FROM sample_table WHERE c4 = 5 and c1 = 5;
LOG:  statement: SELECT COUNT(*) FROM sample_table WHERE c4 = 5 and c1 = 5;
 count 
-------
  1000
(1 row)

-- report 1 row in compressed chunks
SELECT COUNT(*) FROM :COMPRESS_CHUNK_1 WHERE c4 = 5 AND _ts_meta_min_1 <= 5 and _ts_meta_max_1 >= 5;
LOG:  statement: SELECT COUNT(*) FROM _timescaledb_internal.compress_hyper_20_38_chunk WHERE c4 = 5 AND _ts_meta_min_1 <= 5 and _ts_meta_max_1 >= 5;
 count 
-------
     1
(1 row)

-- fetch total and number of affected rows
SELECT COUNT(*) AS "total_rows" FROM sample_table \gset
LOG:  statement: SELECT COUNT(*) AS "total_rows" FROM sample_table 
SELECT COUNT(*) AS "total_affected_rows" FROM sample_table WHERE c4 = 5 and c1 = 5 \gset
LOG:  statement: SELECT COUNT(*) AS "total_affected_rows" FROM sample_table WHERE c4 = 5 and c1 = 5 
-- delete 1k rows
DELETE FROM sample_table WHERE c4 = 5 and c1 = 5;
LOG:  statement: DELETE FROM sample_table WHERE c4 = 5 and c1 = 5;
DEBUG:  Number of compressed rows fetched from index: 10. Number of compressed rows filtered by orderby columns: 9.
-- report 0 rows
SELECT count(*) FROM sample_table WHERE c4 = 5 and c1 = 5;
LOG:  statement: SELECT count(*) FROM sample_table WHERE c4 = 5 and c1 = 5;
 count 
-------
     0
(1 row)

-- report 0 rows in uncompressed chunk
SELECT COUNT(*) FROM ONLY :CHUNK_1;
LOG:  statement: SELECT COUNT(*) FROM ONLY _timescaledb_internal._hyper_19_37_chunk;
 count 
-------
     0
(1 row)

-- report 0 rows in compressed chunks
SELECT COUNT(*) FROM :COMPRESS_CHUNK_1 WHERE c4 = 5 AND _ts_meta_min_1 <= 5 and _ts_meta_max_1 >= 5;
LOG:  statement: SELECT COUNT(*) FROM _timescaledb_internal.compress_hyper_20_38_chunk WHERE c4 = 5 AND _ts_meta_min_1 <= 5 and _ts_meta_max_1 >= 5;
 count 
-------
     0
(1 row)

-- validate correct number of rows was deleted
-- report true
SELECT COUNT(*) = :total_rows - :total_affected_rows FROM sample_table;
LOG:  statement: SELECT COUNT(*) = 100000 - 1000 FROM sample_table;
 ?column? 
----------
 t
(1 row)

ROLLBACK;
LOG:  statement: ROLLBACK;
-- check that you uncompress and delete only tuples which satisfy SEGMENTBY
-- and ORDERBY qualifiers, segments contain more than one distinct value for
-- these qualifiers, not everything should be deleted that was decompressed
BEGIN;
LOG:  statement: BEGIN;
-- report 4k rows
SELECT COUNT(*) FROM sample_table WHERE c4 > 5 and c2 = 5;
LOG:  statement: SELECT COUNT(*) FROM sample_table WHERE c4 > 5 and c2 = 5;
 count 
-------
  4000
(1 row)

-- report 40 rows in compressed chunks
SELECT COUNT(*) FROM :COMPRESS_CHUNK_1 WHERE c4 > 5 AND _ts_meta_min_2 <= 5 and _ts_meta_max_2 >= 5;
LOG:  statement: SELECT COUNT(*) FROM _timescaledb_internal.compress_hyper_20_38_chunk WHERE c4 > 5 AND _ts_meta_min_2 <= 5 and _ts_meta_max_2 >= 5;
 count 
-------
    40
(1 row)

-- fetch total and number of affected rows
SELECT COUNT(*) AS "total_rows" FROM sample_table \gset
LOG:  statement: SELECT COUNT(*) AS "total_rows" FROM sample_table 
SELECT COUNT(*) AS "total_affected_rows" FROM sample_table WHERE c4 > 5 and c2 = 5 \gset
LOG:  statement: SELECT COUNT(*) AS "total_affected_rows" FROM sample_table WHERE c4 > 5 and c2 = 5 
-- delete 4k rows
DELETE FROM sample_table WHERE c4 > 5 and c2 = 5;
LOG:  statement: DELETE FROM sample_table WHERE c4 > 5 and c2 = 5;
DEBUG:  Number of compressed rows fetched from index: 40. Number of compressed rows filtered by orderby columns: 0.
-- report 0 rows
SELECT count(*) FROM sample_table WHERE c4 > 5 and c2 = 5;
LOG:  statement: SELECT count(*) FROM sample_table WHERE c4 > 5 and c2 = 5;
 count 
-------
     0
(1 row)

-- report 36k rows in uncompressed chunk
SELECT COUNT(*) FROM ONLY :CHUNK_1;
LOG:  statement: SELECT COUNT(*) FROM ONLY _timescaledb_internal._hyper_19_37_chunk;
 count 
-------
 36000
(1 row)

-- report 0 rows in compressed chunks
SELECT COUNT(*) FROM :COMPRESS_CHUNK_1 WHERE c4 > 5 AND _ts_meta_min_2 <= 5 and _ts_meta_max_2 >= 5;
LOG:  statement: SELECT COUNT(*) FROM _timescaledb_internal.compress_hyper_20_38_chunk WHERE c4 > 5 AND _ts_meta_min_2 <= 5 and _ts_meta_max_2 >= 5;
 count 
-------
     0
(1 row)

-- validate correct number of rows was deleted
-- report true
SELECT COUNT(*) = :total_rows - :total_affected_rows FROM sample_table;
LOG:  statement: SELECT COUNT(*) = 100000 - 4000 FROM sample_table;
 ?column? 
----------
 t
(1 row)

ROLLBACK;
LOG:  statement: ROLLBACK;
-- check that you uncompress and delete only tuples which satisfy SEGMENTBY
-- and ORDERBY qualifiers.
-- no: of rows satisfying SEGMENTBY qualifiers is 10
-- no: of rows satisfying ORDERBY qualifiers is 3
-- Once both qualifiers are applied ensure that only 7 rows are present in
-- compressed chunk
BEGIN;
LOG:  statement: BEGIN;
-- report 0 rows in uncompressed chunk
SELECT COUNT(*) FROM ONLY :CHUNK_1;
LOG:  statement: SELECT COUNT(*) FROM ONLY _timescaledb_internal._hyper_19_37_chunk;
 count 
-------
     0
(1 row)

-- report 10 compressed rows for given condition c4 = 4
SELECT COUNT(*) FROM :COMPRESS_CHUNK_1 WHERE c4 = 4;
LOG:  statement: SELECT COUNT(*) FROM _timescaledb_internal.compress_hyper_20_38_chunk WHERE c4 = 4;
 count 
-------
    10
(1 row)

-- report 3 compressed rows for given condition c4 = 4 and c1 >= 7
SELECT COUNT(*) FROM :COMPRESS_CHUNK_1 WHERE c4 = 4 AND _ts_meta_max_1 >= 7;
LOG:  statement: SELECT COUNT(*) FROM _timescaledb_internal.compress_hyper_20_38_chunk WHERE c4 = 4 AND _ts_meta_max_1 >= 7;
 count 
-------
     3
(1 row)

SELECT COUNT(*) AS "total_rows" FROM :COMPRESS_CHUNK_1 WHERE c4 = 4 \gset
LOG:  statement: SELECT COUNT(*) AS "total_rows" FROM _timescaledb_internal.compress_hyper_20_38_chunk WHERE c4 = 4 
SELECT COUNT(*) AS "total_affected_rows" FROM :COMPRESS_CHUNK_1 WHERE c4 = 4 AND _ts_meta_max_1 >= 7 \gset
LOG:  statement: SELECT COUNT(*) AS "total_affected_rows" FROM _timescaledb_internal.compress_hyper_20_38_chunk WHERE c4 = 4 AND _ts_meta_max_1 >= 7 
UPDATE sample_table SET c3 = c3 + 0 WHERE c4 = 4 AND c1 >= 7;
LOG:  statement: UPDATE sample_table SET c3 = c3 + 0 WHERE c4 = 4 AND c1 >= 7;
DEBUG:  Number of compressed rows fetched from index: 10. Number of compressed rows filtered by orderby columns: 7.
-- report 7 rows
SELECT COUNT(*) FROM :COMPRESS_CHUNK_1 WHERE c4 = 4;
LOG:  statement: SELECT COUNT(*) FROM _timescaledb_internal.compress_hyper_20_38_chunk WHERE c4 = 4;
 count 
-------
     7
(1 row)

-- ensure correct number of rows are moved from compressed chunk
-- report true
SELECT COUNT(*) = :total_rows - :total_affected_rows FROM :COMPRESS_CHUNK_1 WHERE c4 = 4;
LOG:  statement: SELECT COUNT(*) = 10 - 3 FROM _timescaledb_internal.compress_hyper_20_38_chunk WHERE c4 = 4;
 ?column? 
----------
 t
(1 row)

ROLLBACK;
LOG:  statement: ROLLBACK;
RESET client_min_messages;
LOG:  statement: RESET client_min_messages;
--github issue: 5640
CREATE TABLE tab1(filler_1 int, filler_2 int, filler_3 int, time timestamptz NOT NULL, device_id int, v0 int, v1 int, v2 float, v3 float);
CREATE INDEX ON tab1(time);
CREATE INDEX ON tab1(device_id,time);
SELECT create_hypertable('tab1','time',create_default_indexes:=false);
 create_hypertable  
--------------------
 (21,public,tab1,t)
(1 row)

ALTER TABLE tab1 DROP COLUMN filler_1;
INSERT INTO tab1(time,device_id,v0,v1,v2,v3) SELECT time, device_id, device_id+1,  device_id + 2, device_id + 0.5, NULL FROM generate_series('2000-01-01 0:00:00+0'::timestamptz,'2000-01-05 23:55:00+0','57m') gtime(time), generate_series(1,1,1) gdevice(device_id);
ALTER TABLE tab1 DROP COLUMN filler_2;
INSERT INTO tab1(time,device_id,v0,v1,v2,v3) SELECT time, device_id, device_id-1, device_id + 2, device_id + 0.5, NULL FROM generate_series('2000-01-06 0:00:00+0'::timestamptz,'2000-01-12 23:55:00+0','58m') gtime(time), generate_series(1,1,1) gdevice(device_id);
ALTER TABLE tab1 DROP COLUMN filler_3;
INSERT INTO tab1(time,device_id,v0,v1,v2,v3) SELECT time, device_id, device_id, device_id + 2, device_id + 0.5, NULL FROM generate_series('2000-01-13 0:00:00+0'::timestamptz,'2000-01-19 23:55:00+0','59m') gtime(time), generate_series(1,1,1) gdevice(device_id);
ANALYZE tab1;
-- compress chunks
ALTER TABLE tab1 SET (timescaledb.compress, timescaledb.compress_orderby='time DESC', timescaledb.compress_segmentby='device_id');
SELECT compress_chunk(show_chunks('tab1'));
              compress_chunk              
------------------------------------------
 _timescaledb_internal._hyper_21_39_chunk
 _timescaledb_internal._hyper_21_40_chunk
 _timescaledb_internal._hyper_21_41_chunk
(3 rows)

-- ensure there is an index scan generated for below DELETE query
BEGIN;
SELECT count(*) FROM tab1 WHERE device_id = 1;
 count 
-------
   472
(1 row)

INSERT INTO tab1(time,device_id,v0,v1,v2,v3) SELECT time, device_id, device_id+1,  device_id + 2, device_id + 1000, NULL FROM generate_series('2000-01-01 0:00:00+0'::timestamptz,'2000-01-05 23:55:00+0','2m') gtime(time), generate_series(1,5,1) gdevice(device_id);
SELECT count(*) FROM tab1 WHERE device_id = 1;
 count 
-------
  4070
(1 row)

ANALYZE tab1;
EXPLAIN (costs off) DELETE FROM public.tab1 WHERE public.tab1.device_id = 1;
                                                 QUERY PLAN                                                 
------------------------------------------------------------------------------------------------------------
 Custom Scan (HypertableModify)
   ->  Delete on tab1
         Delete on _hyper_21_39_chunk tab1_1
         Delete on _hyper_21_40_chunk tab1_2
         Delete on _hyper_21_41_chunk tab1_3
         ->  Append
               ->  Index Scan using _hyper_21_39_chunk_tab1_device_id_time_idx on _hyper_21_39_chunk tab1_1
                     Index Cond: (device_id = 1)
               ->  Seq Scan on _hyper_21_40_chunk tab1_2
                     Filter: (device_id = 1)
               ->  Seq Scan on _hyper_21_41_chunk tab1_3
                     Filter: (device_id = 1)
(12 rows)

DELETE FROM tab1 WHERE tab1.device_id = 1;
SELECT count(*) FROM tab1 WHERE device_id = 1;
 count 
-------
     0
(1 row)

ROLLBACK;
-- github issue 5658
-- verify that bitmap heap scans work on all the correct data and
-- none of it left over after the dml command
BEGIN;
SELECT count(*) FROM tab1 WHERE device_id = 1;
 count 
-------
   472
(1 row)

INSERT INTO tab1(time,device_id,v0,v1,v2,v3) SELECT time, device_id, device_id+1,  device_id + 2, device_id + 1000, NULL FROM generate_series('2000-01-01 0:00:00+0'::timestamptz,'2000-01-05 23:55:00+0','2m') gtime(time), generate_series(1,5,1) gdevice(device_id);
SELECT count(*) FROM tab1 WHERE device_id = 1;
 count 
-------
  4070
(1 row)

ANALYZE tab1;
SET enable_seqscan = off;
SET enable_indexscan = off;
EXPLAIN (costs off) DELETE FROM tab1 WHERE tab1.device_id = 1;
                                       QUERY PLAN                                        
-----------------------------------------------------------------------------------------
 Custom Scan (HypertableModify)
   ->  Delete on tab1
         Delete on _hyper_21_39_chunk tab1_1
         Delete on _hyper_21_40_chunk tab1_2
         Delete on _hyper_21_41_chunk tab1_3
         ->  Append
               ->  Bitmap Heap Scan on _hyper_21_39_chunk tab1_1
                     Recheck Cond: (device_id = 1)
                     ->  Bitmap Index Scan on _hyper_21_39_chunk_tab1_device_id_time_idx
                           Index Cond: (device_id = 1)
               ->  Seq Scan on _hyper_21_40_chunk tab1_2
                     Filter: (device_id = 1)
               ->  Seq Scan on _hyper_21_41_chunk tab1_3
                     Filter: (device_id = 1)
(14 rows)

DELETE FROM tab1 WHERE tab1.device_id = 1;
SELECT count(*) FROM tab1 WHERE device_id = 1;
 count 
-------
     0
(1 row)

ROLLBACK;
-- create hypertable with space partitioning and compression
CREATE TABLE tab2(filler_1 int, filler_2 int, filler_3 int, time timestamptz NOT NULL, device_id int, v0 int, v1 int, v2 float, v3 float);
CREATE INDEX ON tab2(time);
CREATE INDEX ON tab2(device_id,time);
SELECT create_hypertable('tab2','time','device_id',3,create_default_indexes:=false);
 create_hypertable  
--------------------
 (23,public,tab2,t)
(1 row)

ALTER TABLE tab2 DROP COLUMN filler_1;
INSERT INTO tab2(time,device_id,v0,v1,v2,v3) SELECT time, device_id, device_id+1, device_id + 2, device_id + 0.5, NULL FROM generate_series('2000-01-01 0:00:00+0'::timestamptz,'2000-01-05 23:55:00+0','35m') gtime(time), generate_series(1,1,1) gdevice(device_id);
ALTER TABLE tab2 DROP COLUMN filler_2;
INSERT INTO tab2(time,device_id,v0,v1,v2,v3) SELECT time, device_id, device_id+1, device_id + 2, device_id + 0.5, NULL FROM generate_series('2000-01-06 0:00:00+0'::timestamptz,'2000-01-12 23:55:00+0','45m') gtime(time), generate_series(1,1,1) gdevice(device_id);
ALTER TABLE tab2 DROP COLUMN filler_3;
INSERT INTO tab2(time,device_id,v0,v1,v2,v3) SELECT time, device_id, device_id+1, device_id + 2, device_id + 0.5, NULL FROM generate_series('2000-01-13 0:00:00+0'::timestamptz,'2000-01-19 23:55:00+0','55m') gtime(time), generate_series(1,1,1) gdevice(device_id);
ANALYZE tab2;
-- compress chunks
ALTER TABLE tab2 SET (timescaledb.compress, timescaledb.compress_orderby='time DESC', timescaledb.compress_segmentby='device_id');
SELECT compress_chunk(show_chunks('tab2'));
              compress_chunk              
------------------------------------------
 _timescaledb_internal._hyper_23_45_chunk
 _timescaledb_internal._hyper_23_46_chunk
 _timescaledb_internal._hyper_23_47_chunk
(3 rows)

-- below test will cause chunks of tab2 to get decompressed
-- without fix for issue #5460
SET timescaledb.enable_optimizations = OFF;
BEGIN;
DELETE FROM tab1 t1 USING tab2 t2 WHERE t1.device_id = t2.device_id AND t2.time > '2000-01-01';
ROLLBACK;
--cleanup
RESET timescaledb.enable_optimizations;
DROP table tab1;
DROP table tab2;
-- test joins with UPDATE/DELETE on compression chunks
CREATE TABLE join_test1(time timestamptz NOT NULL,device text, value float);
CREATE TABLE join_test2(time timestamptz NOT NULL,device text, value float);
CREATE VIEW chunk_status AS SELECT ht.table_name AS hypertable, ch.table_name AS chunk,ch.status from _timescaledb_catalog.chunk ch INNER JOIN _timescaledb_catalog.hypertable ht ON ht.id=ch.hypertable_id AND ht.table_name IN ('join_test1','join_test2') ORDER BY ht.id, ch.id;
SELECT table_name FROM create_hypertable('join_test1', 'time');
 table_name 
------------
 join_test1
(1 row)

SELECT table_name FROM create_hypertable('join_test2', 'time');
 table_name 
------------
 join_test2
(1 row)

ALTER TABLE join_test1 SET (timescaledb.compress, timescaledb.compress_segmentby='device');
ALTER TABLE join_test2 SET (timescaledb.compress, timescaledb.compress_segmentby='device');
INSERT INTO join_test1 VALUES ('2000-01-01','d1',0.1), ('2000-02-01','d1',0.1), ('2000-03-01','d1',0.1);
INSERT INTO join_test2 VALUES ('2000-02-01','d1',0.1), ('2000-02-01','d2',0.1), ('2000-02-01','d3',0.1);
SELECT compress_chunk(show_chunks('join_test1'));
              compress_chunk              
------------------------------------------
 _timescaledb_internal._hyper_25_51_chunk
 _timescaledb_internal._hyper_25_52_chunk
 _timescaledb_internal._hyper_25_53_chunk
(3 rows)

SELECT compress_chunk(show_chunks('join_test2'));
              compress_chunk              
------------------------------------------
 _timescaledb_internal._hyper_26_54_chunk
(1 row)

SELECT * FROM chunk_status;
 hypertable |       chunk        | status 
------------+--------------------+--------
 join_test1 | _hyper_25_51_chunk |      1
 join_test1 | _hyper_25_52_chunk |      1
 join_test1 | _hyper_25_53_chunk |      1
 join_test2 | _hyper_26_54_chunk |      1
(4 rows)

BEGIN;
DELETE FROM join_test1 USING join_test2;
-- only join_test1 chunks should have status 9
SELECT * FROM chunk_status;
 hypertable |       chunk        | status 
------------+--------------------+--------
 join_test1 | _hyper_25_51_chunk |      9
 join_test1 | _hyper_25_52_chunk |      9
 join_test1 | _hyper_25_53_chunk |      9
 join_test2 | _hyper_26_54_chunk |      1
(4 rows)

ROLLBACK;
BEGIN;
DELETE FROM join_test2 USING join_test1;
-- only join_test2 chunks should have status 9
SELECT * FROM chunk_status;
 hypertable |       chunk        | status 
------------+--------------------+--------
 join_test1 | _hyper_25_51_chunk |      1
 join_test1 | _hyper_25_52_chunk |      1
 join_test1 | _hyper_25_53_chunk |      1
 join_test2 | _hyper_26_54_chunk |      9
(4 rows)

ROLLBACK;
BEGIN;
DELETE FROM join_test1 t1 USING join_test1 t2 WHERE t1.time = '2000-01-01';
-- only first chunk of join_test1 should have status change
SELECT * FROM chunk_status;
 hypertable |       chunk        | status 
------------+--------------------+--------
 join_test1 | _hyper_25_51_chunk |      9
 join_test1 | _hyper_25_52_chunk |      1
 join_test1 | _hyper_25_53_chunk |      1
 join_test2 | _hyper_26_54_chunk |      1
(4 rows)

ROLLBACK;
BEGIN;
DELETE FROM join_test1 t1 USING join_test1 t2 WHERE t2.time = '2000-01-01';
-- all chunks of join_test1 should have status 9
SELECT * FROM chunk_status;
 hypertable |       chunk        | status 
------------+--------------------+--------
 join_test1 | _hyper_25_51_chunk |      9
 join_test1 | _hyper_25_52_chunk |      9
 join_test1 | _hyper_25_53_chunk |      9
 join_test2 | _hyper_26_54_chunk |      1
(4 rows)

ROLLBACK;
BEGIN;
UPDATE join_test1 t1 SET value = t1.value + 1 FROM join_test2 t2;
-- only join_test1 chunks should have status 9
SELECT * FROM chunk_status;
 hypertable |       chunk        | status 
------------+--------------------+--------
 join_test1 | _hyper_25_51_chunk |      9
 join_test1 | _hyper_25_52_chunk |      9
 join_test1 | _hyper_25_53_chunk |      9
 join_test2 | _hyper_26_54_chunk |      1
(4 rows)

ROLLBACK;
BEGIN;
UPDATE join_test2 t1 SET value = t1.value + 1 FROM join_test1 t2;
-- only join_test2 chunks should have status 9
SELECT * FROM chunk_status;
 hypertable |       chunk        | status 
------------+--------------------+--------
 join_test1 | _hyper_25_51_chunk |      1
 join_test1 | _hyper_25_52_chunk |      1
 join_test1 | _hyper_25_53_chunk |      1
 join_test2 | _hyper_26_54_chunk |      9
(4 rows)

ROLLBACK;
BEGIN;
UPDATE join_test1 t1 SET value = t1.value + 1 FROM join_test1 t2 WHERE t1.time = '2000-01-01';
-- only first chunk of join_test1 should have status 9
SELECT * FROM chunk_status;
 hypertable |       chunk        | status 
------------+--------------------+--------
 join_test1 | _hyper_25_51_chunk |      9
 join_test1 | _hyper_25_52_chunk |      1
 join_test1 | _hyper_25_53_chunk |      1
 join_test2 | _hyper_26_54_chunk |      1
(4 rows)

ROLLBACK;
BEGIN;
UPDATE join_test1 t1 SET value = t1.value + 1 FROM join_test1 t2 WHERE t2.time = '2000-01-01';
-- all chunks of join_test1 should have status 9
SELECT * FROM chunk_status;
 hypertable |       chunk        | status 
------------+--------------------+--------
 join_test1 | _hyper_25_51_chunk |      9
 join_test1 | _hyper_25_52_chunk |      9
 join_test1 | _hyper_25_53_chunk |      9
 join_test2 | _hyper_26_54_chunk |      1
(4 rows)

ROLLBACK;
DROP TABLE join_test1;
DROP TABLE join_test2;
-- test if index scan qualifiers are properly used
CREATE TABLE index_scan_test(time timestamptz NOT NULL, device_id int, value float);
SELECT create_hypertable('index_scan_test','time',create_default_indexes:=false);
       create_hypertable       
-------------------------------
 (29,public,index_scan_test,t)
(1 row)

INSERT INTO index_scan_test(time,device_id,value) SELECT time, device_id, device_id + 0.5 FROM generate_series('2000-01-01 0:00:00+0'::timestamptz,'2000-01-01 23:55:00+0','1m') gtime(time), generate_series(1,5,1) gdevice(device_id);
-- compress chunks
ALTER TABLE index_scan_test SET (timescaledb.compress, timescaledb.compress_orderby='time DESC', timescaledb.compress_segmentby='device_id');
SELECT compress_chunk(show_chunks('index_scan_test'));
              compress_chunk              
------------------------------------------
 _timescaledb_internal._hyper_29_59_chunk
(1 row)

ANALYZE index_scan_test;
SELECT ch1.schema_name|| '.' || ch1.table_name AS "CHUNK_1"
FROM _timescaledb_catalog.chunk ch1, _timescaledb_catalog.hypertable ht
WHERE ht.table_name = 'index_scan_test'
AND ch1.hypertable_id = ht.id
AND ch1.table_name LIKE '_hyper%'
ORDER BY ch1.id LIMIT 1 \gset
SELECT ch2.schema_name|| '.' || ch2.table_name AS "COMP_CHUNK_1"
FROM _timescaledb_catalog.chunk ch1, _timescaledb_catalog.chunk ch2, _timescaledb_catalog.hypertable ht
WHERE ht.table_name = 'index_scan_test'
AND ch1.hypertable_id = ht.id
AND ch1.compressed_chunk_id  = ch2.id
ORDER BY ch2.id LIMIT 1 \gset
INSERT INTO index_scan_test(time,device_id,value) SELECT time, device_id, device_id + 0.5 FROM generate_series('2000-01-01 0:00:00+0'::timestamptz,'2000-01-05 23:55:00+0','1m') gtime(time), generate_series(1,5,1) gdevice(device_id);
-- test index on single column
BEGIN;
SELECT count(*) as "UNCOMP_LEFTOVER" FROM ONLY :CHUNK_1 WHERE device_id != 2 \gset
CREATE INDEX ON index_scan_test(device_id);
EXPLAIN (costs off, verbose) DELETE FROM index_scan_test WHERE device_id = 2;
                                                                 QUERY PLAN                                                                  
---------------------------------------------------------------------------------------------------------------------------------------------
 Custom Scan (HypertableModify)
   ->  Delete on public.index_scan_test
         Delete on _timescaledb_internal._hyper_29_59_chunk index_scan_test_1
         ->  Index Scan using _hyper_29_59_chunk_index_scan_test_device_id_idx on _timescaledb_internal._hyper_29_59_chunk index_scan_test_1
               Output: index_scan_test_1.tableoid, index_scan_test_1.ctid
               Index Cond: (index_scan_test_1.device_id = 2)
(6 rows)

DELETE FROM index_scan_test WHERE device_id = 2;
-- everything should be deleted
SELECT count(*) FROM index_scan_test where device_id = 2;
 count 
-------
     0
(1 row)

-- there shouldn't be anything in the uncompressed chunk where device_id = 2
SELECT count(*) = :UNCOMP_LEFTOVER FROM ONLY :CHUNK_1;
 ?column? 
----------
 t
(1 row)

-- there shouldn't be anything in the compressed chunk from device_id = 2
SELECT count(*) FROM :COMP_CHUNK_1 where device_id = 2;
 count 
-------
     0
(1 row)

ROLLBACK;
-- test multi column index
BEGIN;
SELECT count(*) as "UNCOMP_LEFTOVER" FROM ONLY :CHUNK_1 WHERE device_id != 2 OR time <= '2000-01-02'::timestamptz \gset
CREATE INDEX ON index_scan_test(device_id, time);
EXPLAIN (costs off, verbose) DELETE FROM index_scan_test WHERE device_id = 2 AND time > '2000-01-02'::timestamptz;
                                                                       QUERY PLAN                                                                        
---------------------------------------------------------------------------------------------------------------------------------------------------------
 Custom Scan (HypertableModify)
   ->  Delete on public.index_scan_test
         Delete on _timescaledb_internal._hyper_29_59_chunk index_scan_test_1
         ->  Index Scan using _hyper_29_59_chunk_index_scan_test_device_id_time_idx on _timescaledb_internal._hyper_29_59_chunk index_scan_test_1
               Output: index_scan_test_1.tableoid, index_scan_test_1.ctid
               Index Cond: ((index_scan_test_1.device_id = 2) AND (index_scan_test_1."time" > 'Sun Jan 02 00:00:00 2000 PST'::timestamp with time zone))
(6 rows)

DELETE FROM index_scan_test WHERE device_id = 2 AND time > '2000-01-02'::timestamptz;
-- everything should be deleted
SELECT count(*) FROM index_scan_test WHERE device_id = 2 AND time > '2000-01-02'::timestamptz;
 count 
-------
     0
(1 row)

-- there shouldn't be anything in the uncompressed chunk that matches predicates
SELECT count(*) = :UNCOMP_LEFTOVER FROM ONLY :CHUNK_1;
 ?column? 
----------
 t
(1 row)

-- there shouldn't be anything in the compressed chunk that matches predicates
SELECT count(*) FROM :COMP_CHUNK_1 WHERE device_id = 2 AND _ts_meta_max_1 >= '2000-01-02'::timestamptz;
 count 
-------
     0
(1 row)

ROLLBACK;
-- test index with filter condition
BEGIN;
SELECT count(*) as "UNCOMP_LEFTOVER" FROM ONLY :CHUNK_1 WHERE device_id != 2 OR time <= '2000-01-02'::timestamptz \gset
CREATE INDEX ON index_scan_test(device_id);
EXPLAIN (costs off, verbose) DELETE FROM index_scan_test WHERE device_id = 2 AND time > '2000-01-02'::timestamptz;
                                                                 QUERY PLAN                                                                  
---------------------------------------------------------------------------------------------------------------------------------------------
 Custom Scan (HypertableModify)
   ->  Delete on public.index_scan_test
         Delete on _timescaledb_internal._hyper_29_59_chunk index_scan_test_1
         ->  Index Scan using _hyper_29_59_chunk_index_scan_test_device_id_idx on _timescaledb_internal._hyper_29_59_chunk index_scan_test_1
               Output: index_scan_test_1.tableoid, index_scan_test_1.ctid
               Index Cond: (index_scan_test_1.device_id = 2)
               Filter: (index_scan_test_1."time" > 'Sun Jan 02 00:00:00 2000 PST'::timestamp with time zone)
(7 rows)

DELETE FROM index_scan_test WHERE device_id = 2 AND time > '2000-01-02'::timestamptz;
-- everything should be deleted
SELECT count(*) FROM index_scan_test WHERE device_id = 2 AND time > '2000-01-02'::timestamptz;
 count 
-------
     0
(1 row)

-- there shouldn't be anything in the uncompressed chunk that matches predicates
SELECT count(*) = :UNCOMP_LEFTOVER FROM ONLY :CHUNK_1;
 ?column? 
----------
 t
(1 row)

-- there shouldn't be anything in the compressed chunk that matches predicates
SELECT count(*) FROM :COMP_CHUNK_1 WHERE device_id = 2 AND _ts_meta_max_1 >= '2000-01-02'::timestamptz;
 count 
-------
     0
(1 row)

ROLLBACK;
-- test for disabling DML decompression
SHOW timescaledb.enable_dml_decompression;
 timescaledb.enable_dml_decompression 
--------------------------------------
 on
(1 row)

SET timescaledb.enable_dml_decompression = false;
\set ON_ERROR_STOP 0
-- should ERROR both UPDATE/DELETE statements because the DML decompression is disabled
UPDATE sample_table SET c3 = NULL WHERE c4 = 5;
ERROR:  UPDATE/DELETE is disabled on compressed chunks
DELETE FROM sample_table WHERE c4 = 5;
ERROR:  UPDATE/DELETE is disabled on compressed chunks
\set ON_ERROR_STOP 1
-- make sure reseting the GUC we will be able to UPDATE/DELETE compressed chunks
RESET timescaledb.enable_dml_decompression;
SHOW timescaledb.enable_dml_decompression;
 timescaledb.enable_dml_decompression 
--------------------------------------
 on
(1 row)

BEGIN;
-- report 0 rows
SELECT count(*) FROM sample_table WHERE c4 = 5 AND c3 IS NULL;
 count 
-------
     0
(1 row)

UPDATE sample_table SET c3 = NULL WHERE c4 = 5;
-- report 10k rows
SELECT count(*) FROM sample_table WHERE c4 = 5 AND c3 IS NULL;
 count 
-------
 10000
(1 row)

ROLLBACK;
BEGIN;
-- report 10k rows
SELECT count(*) FROM sample_table WHERE c4 = 5;
 count 
-------
 10000
(1 row)

DELETE FROM sample_table WHERE c4 = 5;
-- report 0 rows
SELECT count(*) FROM sample_table WHERE c4 = 5;
 count 
-------
     0
(1 row)

ROLLBACK;
-- create new uncompressed chunk
INSERT INTO sample_table
SELECT t, 1, 1, 1, 1
FROM generate_series('2023-05-04 00:00:00-00'::timestamptz,
            '2023-05-04 00:00:00-00'::timestamptz + INTERVAL '2 hours',
            INTERVAL '1 hour') t;
-- check chunk compression status
SELECT chunk_name, is_compressed
FROM timescaledb_information.chunks
WHERE hypertable_name = 'sample_table'
ORDER BY chunk_name;
     chunk_name     | is_compressed 
--------------------+---------------
 _hyper_19_37_chunk | t
 _hyper_19_61_chunk | f
(2 rows)

-- test for uncompressed and compressed chunks
SHOW timescaledb.enable_dml_decompression;
 timescaledb.enable_dml_decompression 
--------------------------------------
 on
(1 row)

SET timescaledb.enable_dml_decompression = false;
BEGIN;
-- report 3 rows
SELECT count(*) FROM sample_table WHERE time >= '2023-05-04 00:00:00-00'::timestamptz;
 count 
-------
     3
(1 row)

-- delete from uncompressed chunk should work
DELETE FROM sample_table WHERE time >= '2023-05-04 00:00:00-00'::timestamptz;
-- report 0 rows
SELECT count(*) FROM sample_table WHERE time >= '2023-05-04 00:00:00-00'::timestamptz;
 count 
-------
     0
(1 row)

ROLLBACK;
BEGIN;
-- report 0 rows
SELECT count(*) FROM sample_table WHERE time >= '2023-05-04 00:00:00-00'::timestamptz AND c3 IS NULL;
 count 
-------
     0
(1 row)

UPDATE sample_table SET c3 = NULL WHERE time >= '2023-05-04 00:00:00-00'::timestamptz;
-- report 3 rows
SELECT count(*) FROM sample_table WHERE time >= '2023-05-04 00:00:00-00'::timestamptz AND c3 IS NULL;
 count 
-------
     3
(1 row)

ROLLBACK;
\set ON_ERROR_STOP 0
-- should ERROR both UPDATE/DELETE statements because the DML decompression is disabled
-- and both statements we're touching compressed and uncompressed chunks
UPDATE sample_table SET c3 = NULL WHERE time >= '2023-03-17 00:00:00-00'::timestamptz AND c3 IS NULL;
ERROR:  UPDATE/DELETE is disabled on compressed chunks
DELETE FROM sample_table WHERE time >= '2023-03-17 00:00:00-00'::timestamptz;
ERROR:  UPDATE/DELETE is disabled on compressed chunks
\set ON_ERROR_STOP 1
--github issue: 5586
--testcase with multiple indexes
\c :TEST_DBNAME :ROLE_SUPERUSER
DROP DATABASE IF EXISTS test;
NOTICE:  database "test" does not exist, skipping
CREATE DATABASE test;
\c test :ROLE_SUPERUSER
SET client_min_messages = ERROR;
CREATE EXTENSION timescaledb CASCADE;
CREATE TABLE tab1(filler_1 int, filler_2 int, filler_3 int, time timestamptz NOT NULL, device_id int, v0 int, v1 int, v2 float, v3 float);
SELECT create_hypertable('tab1','time',create_default_indexes:=false);
 create_hypertable 
-------------------
 (1,public,tab1,t)
(1 row)

INSERT INTO tab1(filler_1, filler_2, filler_3,time,device_id,v0,v1,v2,v3) SELECT device_id, device_id+1,  device_id + 2, time, device_id, device_id+1,  device_id + 2, device_id + 0.5, NULL FROM generate_series('2000-01-01 0:00:00+0'::timestamptz,'2000-01-05 23:55:00+0','2m') gtime(time), generate_series(1,5,1) gdevice(device_id);
ALTER TABLE tab1 SET (timescaledb.compress, timescaledb.compress_orderby='time DESC', timescaledb.compress_segmentby='device_id, filler_1, filler_2, filler_3');
-- create multiple indexes on compressed hypertable
DROP INDEX _timescaledb_internal._compressed_hypertable_2_device_id_filler_1_filler_2_filler_idx;
CREATE INDEX ON _timescaledb_internal._compressed_hypertable_2 (_ts_meta_min_1);
CREATE INDEX ON _timescaledb_internal._compressed_hypertable_2 (_ts_meta_min_1, _ts_meta_sequence_num);
CREATE INDEX ON _timescaledb_internal._compressed_hypertable_2 (_ts_meta_min_1, _ts_meta_max_1, filler_1);
CREATE INDEX filler_1 ON _timescaledb_internal._compressed_hypertable_2 (filler_1);
CREATE INDEX filler_2 ON _timescaledb_internal._compressed_hypertable_2 (filler_2);
CREATE INDEX filler_3 ON _timescaledb_internal._compressed_hypertable_2 (filler_3);
-- below indexes should be selected
CREATE INDEX filler_1_filler_2 ON _timescaledb_internal._compressed_hypertable_2 (filler_1, filler_2);
CREATE INDEX filler_2_filler_3 ON _timescaledb_internal._compressed_hypertable_2 (filler_2, filler_3);
SELECT compress_chunk(show_chunks('tab1'));
             compress_chunk             
----------------------------------------
 _timescaledb_internal._hyper_1_1_chunk
(1 row)

SET client_min_messages TO DEBUG2;
BEGIN;
LOG:  statement: BEGIN;
SELECT COUNT(*) FROM tab1 WHERE filler_3 = 5 AND filler_2 = 4;
LOG:  statement: SELECT COUNT(*) FROM tab1 WHERE filler_3 = 5 AND filler_2 = 4;
 count 
-------
  3598
(1 row)

UPDATE tab1 SET v0 = v1 + v2 WHERE filler_3 = 5 AND filler_2 = 4;
LOG:  statement: UPDATE tab1 SET v0 = v1 + v2 WHERE filler_3 = 5 AND filler_2 = 4;
DEBUG:  index "compress_hyper_2_2_chunk_filler_2_filler_3" is used for scan. 
DEBUG:  Number of compressed rows fetched from index: 4. Number of compressed rows filtered by orderby columns: 0.
ROLLBACK;
LOG:  statement: ROLLBACK;
BEGIN;
LOG:  statement: BEGIN;
SELECT COUNT(*) FROM tab1 WHERE filler_1 < 5 AND filler_2 = 4;
LOG:  statement: SELECT COUNT(*) FROM tab1 WHERE filler_1 < 5 AND filler_2 = 4;
 count 
-------
  3598
(1 row)

UPDATE tab1 SET v0 = v1 + v2 WHERE filler_1 < 5 AND filler_2 = 4;
LOG:  statement: UPDATE tab1 SET v0 = v1 + v2 WHERE filler_1 < 5 AND filler_2 = 4;
DEBUG:  index "compress_hyper_2_2_chunk_filler_1_filler_2" is used for scan. 
DEBUG:  Number of compressed rows fetched from index: 4. Number of compressed rows filtered by orderby columns: 0.
ROLLBACK;
LOG:  statement: ROLLBACK;
-- idealy filler_1 index should be selected,
-- instead first matching index is selected
BEGIN;
LOG:  statement: BEGIN;
SELECT COUNT(*) FROM tab1 WHERE filler_1 < 5;
LOG:  statement: SELECT COUNT(*) FROM tab1 WHERE filler_1 < 5;
 count 
-------
 14392
(1 row)

UPDATE tab1 SET v0 = v1 + v2 WHERE filler_1 < 5;
LOG:  statement: UPDATE tab1 SET v0 = v1 + v2 WHERE filler_1 < 5;
DEBUG:  index "compress_hyper_2_2_chunk__compressed_hypertable_2__ts_meta_mi_2" is used for scan. 
DEBUG:  Number of compressed rows fetched from index: 16. Number of compressed rows filtered by orderby columns: 0.
ROLLBACK;
LOG:  statement: ROLLBACK;
RESET client_min_messages;
LOG:  statement: RESET client_min_messages;
DROP TABLE tab1;
