-- This file and its contents are licensed under the Timescale License.
-- Please see the included NOTICE for copyright information and
-- LICENSE-TIMESCALE for a copy of the license.
\c :TEST_DBNAME :ROLE_SUPERUSER
SET ROLE :ROLE_DEFAULT_PERM_USER;
SET client_min_messages TO LOG;
CREATE TABLE continuous_agg_test(timeval integer, col1 integer, col2 integer);
select create_hypertable('continuous_agg_test', 'timeval', chunk_time_interval=> 2);
NOTICE:  adding not-null constraint to column "timeval"
        create_hypertable         
----------------------------------
 (1,public,continuous_agg_test,t)
(1 row)

CREATE OR REPLACE FUNCTION integer_now_test1() returns int LANGUAGE SQL STABLE as $$ SELECT coalesce(max(timeval), 0) FROM continuous_agg_test $$;
SELECT set_integer_now_func('continuous_agg_test', 'integer_now_test1');
 set_integer_now_func 
----------------------
 
(1 row)

INSERT INTO continuous_agg_test VALUES
    (10, - 4, 1), (11, - 3, 5), (12, - 3, 7), (13, - 3, 9), (14,-4, 11),
    (15, -4, 22), (16, -4, 23);
-- TEST for multiple continuous aggs 
--- invalidations are picked up by both caggs
CREATE VIEW cagg_1( timed, cnt ) 
WITH ( timescaledb.continuous , timescaledb.refresh_lag = '-2')
AS
    SELECT time_bucket( 2, timeval), COUNT(col1) 
    FROM continuous_agg_test
    GROUP BY 1;
CREATE VIEW cagg_2( timed, grp, maxval) 
WITH ( timescaledb.continuous, timescaledb.refresh_lag = '-2' )
AS
    SELECT time_bucket(2, timeval), col1, max(col2) 
    FROM continuous_agg_test
    GROUP BY 1, 2;
NOTICE:  adding index _materialized_hypertable_3_grp_timed_idx ON _timescaledb_internal._materialized_hypertable_3 USING BTREE(grp, timed)
select view_name, view_owner, refresh_lag, refresh_interval, max_interval_per_job , materialization_hypertable 
from timescaledb_information.continuous_aggregates;
 view_name |    view_owner     | refresh_lag | refresh_interval | max_interval_per_job |            materialization_hypertable            
-----------+-------------------+-------------+------------------+----------------------+--------------------------------------------------
 cagg_1    | default_perm_user | -2          | @ 12 hours       | 40                   | _timescaledb_internal._materialized_hypertable_2
 cagg_2    | default_perm_user | -2          | @ 12 hours       | 40                   | _timescaledb_internal._materialized_hypertable_3
(2 rows)

--TEST1: cagg_1 is materialized, not cagg_2.
refresh materialized view cagg_1;
LOG:  materializing continuous aggregate public.cagg_1: nothing to invalidate, new range up to 18
select * from cagg_1 order by 1;
 timed | cnt 
-------+-----
    10 |   2
    12 |   2
    14 |   2
    16 |   1
(4 rows)

SELECT time_bucket(2, timeval), COUNT(col1) as value
FROM continuous_agg_test
GROUP BY 1 order by 1;
 time_bucket | value 
-------------+-------
          10 |     2
          12 |     2
          14 |     2
          16 |     1
(4 rows)

-- check that cagg_2 not materialized 
select * from cagg_2 order by 1,2;
 timed | grp | maxval 
-------+-----+--------
(0 rows)

refresh materialized view cagg_2;
LOG:  materializing continuous aggregate public.cagg_2: nothing to invalidate, new range up to 18
select * from cagg_2 order by 1,2;
 timed | grp | maxval 
-------+-----+--------
    10 |  -4 |      1
    10 |  -3 |      5
    12 |  -3 |      9
    14 |  -4 |     22
    16 |  -4 |     23
(5 rows)

SELECT * FROM _timescaledb_catalog.continuous_aggs_completed_threshold;
 materialization_id | watermark 
--------------------+-----------
                  2 |        18
                  3 |        18
(2 rows)

SELECT * FROM _timescaledb_catalog.continuous_aggs_invalidation_threshold;
 hypertable_id | watermark 
---------------+-----------
             1 |        18
(1 row)

--TEST2: cagg_2 gets invalidations after cagg_1's refresh
--will trigger invalidations 
INSERT INTO continuous_agg_test VALUES
    (10, -4, 10), (11, - 3, 50), (11, - 3, 70), (10, - 4, 10);
SELECT * FROM _timescaledb_catalog.continuous_aggs_completed_threshold;
 materialization_id | watermark 
--------------------+-----------
                  2 |        18
                  3 |        18
(2 rows)

SELECT * FROM _timescaledb_catalog.continuous_aggs_invalidation_threshold;
 hypertable_id | watermark 
---------------+-----------
             1 |        18
(1 row)

refresh materialized view cagg_1;
LOG:  new materialization range not found for public.continuous_agg_test (time column timeval): not enough new data past completion threshold of 18 as of 16
LOG:  materializing continuous aggregate public.cagg_1: processing invalidations, no new range
select * from cagg_1 order by 1;
 timed | cnt 
-------+-----
    10 |   6
    12 |   2
    14 |   2
    16 |   1
(4 rows)

SELECT time_bucket(2, timeval), COUNT(col1) as value
FROM continuous_agg_test
GROUP BY 1 order by 1;
 time_bucket | value 
-------------+-------
          10 |     6
          12 |     2
          14 |     2
          16 |     1
(4 rows)

-- are the invalidations picked up here?
select * from cagg_2 order by 1, 2;
 timed | grp | maxval 
-------+-----+--------
    10 |  -4 |      1
    10 |  -3 |      5
    12 |  -3 |      9
    14 |  -4 |     22
    16 |  -4 |     23
(5 rows)

SELECT time_bucket(2, timeval), col1, max(col2) 
FROM continuous_agg_test
GROUP BY 1, 2
order by 1,2 ;
 time_bucket | col1 | max 
-------------+------+-----
          10 |   -4 |  10
          10 |   -3 |  70
          12 |   -3 |   9
          14 |   -4 |  22
          16 |   -4 |  23
(5 rows)

refresh materialized view cagg_2;
LOG:  new materialization range not found for public.continuous_agg_test (time column timeval): not enough new data past completion threshold of 18 as of 16
LOG:  materializing continuous aggregate public.cagg_2: processing invalidations, no new range
select * from cagg_2 order by 1, 2;
 timed | grp | maxval 
-------+-----+--------
    10 |  -4 |     10
    10 |  -3 |     70
    12 |  -3 |      9
    14 |  -4 |     22
    16 |  -4 |     23
(5 rows)

--TEST3: invalidations left over by cagg_1 are dropped
--trigger another invalidation
INSERT INTO continuous_agg_test VALUES
    (10, -4, 1000);
select count(*) from _timescaledb_catalog.continuous_aggs_hypertable_invalidation_log;
 count 
-------
     1
(1 row)

select count(*) from _timescaledb_catalog.continuous_aggs_materialization_invalidation_log;
 count 
-------
     0
(1 row)

refresh materialized view cagg_1;
LOG:  new materialization range not found for public.continuous_agg_test (time column timeval): not enough new data past completion threshold of 18 as of 16
LOG:  materializing continuous aggregate public.cagg_1: processing invalidations, no new range
select count(*) from _timescaledb_catalog.continuous_aggs_hypertable_invalidation_log;
 count 
-------
     0
(1 row)

select count(*) from _timescaledb_catalog.continuous_aggs_materialization_invalidation_log;
 count 
-------
     1
(1 row)

--now drop cagg_1, should still have materialization_invalidation_log
drop view cagg_1 cascade;
NOTICE:  drop cascades to table _timescaledb_internal._hyper_2_5_chunk
select count(*) from _timescaledb_catalog.continuous_aggs_materialization_invalidation_log;
 count 
-------
     1
(1 row)

--cagg_2 still exists
select view_name from timescaledb_information.continuous_aggregates;
 view_name 
-----------
 cagg_2
(1 row)

drop table continuous_agg_test cascade;
NOTICE:  drop cascades to 3 other objects
NOTICE:  drop cascades to table _timescaledb_internal._hyper_3_6_chunk
select count(*) from _timescaledb_catalog.continuous_aggs_materialization_invalidation_log;
 count 
-------
     0
(1 row)

select view_name from timescaledb_information.continuous_aggregates;
 view_name 
-----------
(0 rows)

--TEST4: invalidations that are copied over by cagg1 are not deleted by cagg2 refresh if
-- they do not meet materialization invalidation threshold for cagg2.
CREATE TABLE continuous_agg_test(timeval integer, col1 integer, col2 integer);
select create_hypertable('continuous_agg_test', 'timeval', chunk_time_interval=> 2);
NOTICE:  adding not-null constraint to column "timeval"
        create_hypertable         
----------------------------------
 (4,public,continuous_agg_test,t)
(1 row)

CREATE OR REPLACE FUNCTION integer_now_test1() returns int LANGUAGE SQL STABLE as $$ SELECT coalesce(max(timeval), 0) FROM continuous_agg_test $$;
SELECT set_integer_now_func('continuous_agg_test', 'integer_now_test1');
 set_integer_now_func 
----------------------
 
(1 row)

INSERT INTO continuous_agg_test VALUES
    (10, - 4, 1), (11, - 3, 5), (12, - 3, 7), (13, - 3, 9), (14,-4, 11),
    (15, -4, 22), (16, -4, 23);
CREATE VIEW cagg_1( timed, cnt ) 
WITH ( timescaledb.continuous , timescaledb.refresh_lag = '-2')
AS
    SELECT time_bucket( 2, timeval), COUNT(col1) 
    FROM continuous_agg_test
    GROUP BY 1;
CREATE VIEW cagg_2( timed, maxval) 
WITH ( timescaledb.continuous, timescaledb.refresh_lag = '2' )
AS
    SELECT time_bucket(2, timeval), max(col2) 
    FROM continuous_agg_test
    GROUP BY 1;
refresh materialized view cagg_1;
LOG:  materializing continuous aggregate public.cagg_1: nothing to invalidate, new range up to 18
select * from cagg_1 order by 1;
 timed | cnt 
-------+-----
    10 |   2
    12 |   2
    14 |   2
    16 |   1
(4 rows)

refresh materialized view cagg_2;
LOG:  materializing continuous aggregate public.cagg_2: nothing to invalidate, new range up to 14
select * from cagg_2 order by 1;
 timed | maxval 
-------+--------
    10 |      5
    12 |      9
(2 rows)

--this insert will be processed only by cagg_1 and copied over to cagg_2
insert into continuous_agg_test values( 14, -2, 100); 
refresh materialized view cagg_1;
LOG:  new materialization range not found for public.continuous_agg_test (time column timeval): not enough new data past completion threshold of 18 as of 16
LOG:  materializing continuous aggregate public.cagg_1: processing invalidations, no new range
select * from cagg_1 order by 1;
 timed | cnt 
-------+-----
    10 |   2
    12 |   2
    14 |   3
    16 |   1
(4 rows)

refresh materialized view cagg_2;
LOG:  new materialization range not found for public.continuous_agg_test (time column timeval): not enough new data past completion threshold of 14 as of 16
LOG:  materializing continuous aggregate public.cagg_2: nothing to invalidate, no new range
LOG:  materializing continuous aggregate public.cagg_2: no new range to materialize or invalidations found, exiting early
select * from cagg_2 order by 1;
 timed | maxval 
-------+--------
    10 |      5
    12 |      9
(2 rows)

SET ROLE :ROLE_SUPERUSER;
select * from _timescaledb_catalog.continuous_aggs_invalidation_threshold order by 1;
 hypertable_id | watermark 
---------------+-----------
             4 |        18
(1 row)

select * from _timescaledb_catalog.continuous_aggs_materialization_invalidation_log order by 1;
 materialization_id | modification_time | lowest_modified_value | greatest_modified_value 
--------------------+-------------------+-----------------------+-------------------------
(0 rows)

SET ROLE :ROLE_DEFAULT_PERM_USER;
--this insert will be processed only by cagg_1 and cagg_2 will process the previous
--one
insert into continuous_agg_test values( 18, -2, 200); 
refresh materialized view cagg_1;
LOG:  materializing continuous aggregate public.cagg_1: nothing to invalidate, new range up to 20
select * from cagg_1 order by 1;
 timed | cnt 
-------+-----
    10 |   2
    12 |   2
    14 |   3
    16 |   1
    18 |   1
(5 rows)

refresh materialized view cagg_2;
LOG:  materializing continuous aggregate public.cagg_2: nothing to invalidate, new range up to 16
select * from cagg_2 order by 1;
 timed | maxval 
-------+--------
    10 |      5
    12 |      9
    14 |    100
(3 rows)

--TEST5 2 inserts with the same value can be copied over to materialization invalidation log
insert into continuous_agg_test values( 18, -2, 100); 
insert into continuous_agg_test values( 18, -2, 100); 
select * from _timescaledb_catalog.continuous_aggs_hypertable_invalidation_log order by 1;
 hypertable_id | modification_time | lowest_modified_value | greatest_modified_value 
---------------+-------------------+-----------------------+-------------------------
             4 |                18 |                    18 |                      18
             4 |                18 |                    18 |                      18
(2 rows)

refresh materialized view cagg_1;
LOG:  new materialization range not found for public.continuous_agg_test (time column timeval): not enough new data past completion threshold of 20 as of 18
LOG:  materializing continuous aggregate public.cagg_1: processing invalidations, no new range
select * from cagg_1 where timed = 18 ;
 timed | cnt 
-------+-----
    18 |   3
(1 row)

--copied over for cagg_2 to process later?
select * from _timescaledb_catalog.continuous_aggs_materialization_invalidation_log order by 1;
 materialization_id | modification_time | lowest_modified_value | greatest_modified_value 
--------------------+-------------------+-----------------------+-------------------------
                  6 |                18 |                    18 |                      18
                  6 |                18 |                    18 |                      18
(2 rows)

DROP VIEW cagg_1 cascade;
NOTICE:  drop cascades to table _timescaledb_internal._hyper_5_11_chunk
DROP VIEW cagg_2 cascade;
NOTICE:  drop cascades to table _timescaledb_internal._hyper_6_12_chunk
--test the ignore_invalidation_older_than setting
CREATE TABLE continuous_agg_test_ignore_invalidation_older_than(timeval integer, col1 integer, col2 integer);
select create_hypertable('continuous_agg_test_ignore_invalidation_older_than', 'timeval', chunk_time_interval=> 2);
NOTICE:  adding not-null constraint to column "timeval"
                        create_hypertable                        
-----------------------------------------------------------------
 (7,public,continuous_agg_test_ignore_invalidation_older_than,t)
(1 row)

CREATE OR REPLACE FUNCTION integer_now_test2() returns int LANGUAGE SQL STABLE as $$ SELECT coalesce(max(timeval), 0) FROM continuous_agg_test_ignore_invalidation_older_than $$;
SELECT set_integer_now_func('continuous_agg_test_ignore_invalidation_older_than', 'integer_now_test2');
 set_integer_now_func 
----------------------
 
(1 row)

INSERT INTO continuous_agg_test_ignore_invalidation_older_than VALUES
(10, - 4, 1), (11, - 3, 5), (12, -3, 7);
CREATE VIEW cagg_iia1( timed, cnt )
        WITH ( timescaledb.continuous , timescaledb.refresh_lag = '-2', timescaledb.ignore_invalidation_older_than = 5 )
AS
SELECT time_bucket( 2, timeval), COUNT(col1)
FROM continuous_agg_test_ignore_invalidation_older_than
GROUP BY 1;
CREATE VIEW cagg_iia2( timed, maxval)
        WITH ( timescaledb.continuous, timescaledb.refresh_lag = '-2', timescaledb.ignore_invalidation_older_than = 10)
AS
SELECT time_bucket(2, timeval), max(col2)
FROM continuous_agg_test_ignore_invalidation_older_than
GROUP BY 1;
CREATE VIEW cagg_iia3( timed, maxval)
        WITH ( timescaledb.continuous, timescaledb.refresh_lag = '-2', timescaledb.ignore_invalidation_older_than = 0)
AS
SELECT time_bucket(2, timeval), max(col2)
FROM continuous_agg_test_ignore_invalidation_older_than
GROUP BY 1;
refresh materialized view cagg_iia1;
LOG:  materializing continuous aggregate public.cagg_iia1: nothing to invalidate, new range up to 14
select * from cagg_iia1 order by 1;
 timed | cnt 
-------+-----
    10 |   2
    12 |   1
(2 rows)

refresh materialized view cagg_iia2;
LOG:  materializing continuous aggregate public.cagg_iia2: nothing to invalidate, new range up to 14
select * from cagg_iia2 order by 1;
 timed | maxval 
-------+--------
    10 |      5
    12 |      7
(2 rows)

refresh materialized view cagg_iia3;
LOG:  materializing continuous aggregate public.cagg_iia3: nothing to invalidate, new range up to 14
select * from cagg_iia3 order by 1;
 timed | maxval 
-------+--------
    10 |      5
    12 |      7
(2 rows)

INSERT INTO continuous_agg_test_ignore_invalidation_older_than VALUES
(1, -4, 1), (5, -3, 5), (10, -3, 9), (12,3,19);
--modification happened at time 12
SELECT * FROM _timescaledb_catalog.continuous_aggs_hypertable_invalidation_log;
 hypertable_id | modification_time | lowest_modified_value | greatest_modified_value 
---------------+-------------------+-----------------------+-------------------------
             7 |                12 |                     5 |                      12
(1 row)

--move the time up (40), but invalidation logic should apply to old time (12)
INSERT INTO continuous_agg_test_ignore_invalidation_older_than VALUES (32,4,2),(36,5,5),(40,3,9);
SELECT * FROM _timescaledb_catalog.continuous_aggs_materialization_invalidation_log order by 1;
 materialization_id | modification_time | lowest_modified_value | greatest_modified_value 
--------------------+-------------------+-----------------------+-------------------------
(0 rows)

refresh materialized view cagg_iia1;
LOG:  materializing continuous aggregate public.cagg_iia1: processing invalidations, new range up to 42
SELECT * FROM _timescaledb_catalog.continuous_aggs_materialization_invalidation_log order by 1;
 materialization_id | modification_time | lowest_modified_value | greatest_modified_value 
--------------------+-------------------+-----------------------+-------------------------
                  9 |                12 |                     5 |                      12
(1 row)

--should see change to the 12, 10 bucket but not the 4 or 1 bucket
select * from cagg_iia1 order by 1;
 timed | cnt 
-------+-----
    10 |   3
    12 |   2
    32 |   1
    36 |   1
    40 |   1
(5 rows)

--should see change to the 12, 10 and 4 bucket but not the 1 bucket
refresh materialized view cagg_iia2;
LOG:  materializing continuous aggregate public.cagg_iia2: processing invalidations, new range up to 42
select * from cagg_iia2 order by 1;
 timed | maxval 
-------+--------
     4 |      5
    10 |      9
    12 |     19
    32 |      2
    36 |      5
    40 |      9
(6 rows)

--sees no changes
refresh materialized view cagg_iia3;
LOG:  materializing continuous aggregate public.cagg_iia3: nothing to invalidate, new range up to 42
select * from cagg_iia3 order by 1;
 timed | maxval 
-------+--------
    10 |      5
    12 |      7
    32 |      2
    36 |      5
    40 |      9
(5 rows)

--test UPDATES
UPDATE continuous_agg_test_ignore_invalidation_older_than  set col1=NULL, col2=200 where timeval=32;
UPDATE continuous_agg_test_ignore_invalidation_older_than  set col1=NULL, col2=120 where timeval=36;
SELECT * FROM _timescaledb_catalog.continuous_aggs_hypertable_invalidation_log;
 hypertable_id | modification_time | lowest_modified_value | greatest_modified_value 
---------------+-------------------+-----------------------+-------------------------
             7 |                40 |                    32 |                      32
             7 |                40 |                    36 |                      36
(2 rows)

refresh materialized view cagg_iia1;
LOG:  new materialization range not found for public.continuous_agg_test_ignore_invalidation_older_than (time column timeval): not enough new data past completion threshold of 42 as of 40
LOG:  materializing continuous aggregate public.cagg_iia1: processing invalidations, no new range
SELECT * FROM _timescaledb_catalog.continuous_aggs_materialization_invalidation_log order by 1;
 materialization_id | modification_time | lowest_modified_value | greatest_modified_value 
--------------------+-------------------+-----------------------+-------------------------
                  9 |                40 |                    32 |                      32
                  9 |                40 |                    36 |                      36
(2 rows)

--should see change only for the 36 bucket not 32
select * from cagg_iia1 order by 1;
 timed | cnt 
-------+-----
    10 |   3
    12 |   2
    32 |   1
    36 |   0
    40 |   1
(5 rows)

--should see change to the 36 and 32
refresh materialized view cagg_iia2;
LOG:  new materialization range not found for public.continuous_agg_test_ignore_invalidation_older_than (time column timeval): not enough new data past completion threshold of 42 as of 40
LOG:  materializing continuous aggregate public.cagg_iia2: processing invalidations, no new range
select * from cagg_iia2 order by 1;
 timed | maxval 
-------+--------
     4 |      5
    10 |      9
    12 |     19
    32 |    200
    36 |    120
    40 |      9
(6 rows)

--sees no changes
refresh materialized view cagg_iia3;
LOG:  new materialization range not found for public.continuous_agg_test_ignore_invalidation_older_than (time column timeval): not enough new data past completion threshold of 42 as of 40
LOG:  materializing continuous aggregate public.cagg_iia3: nothing to invalidate, no new range
LOG:  materializing continuous aggregate public.cagg_iia3: no new range to materialize or invalidations found, exiting early
select * from cagg_iia3 order by 1;
 timed | maxval 
-------+--------
    10 |      5
    12 |      7
    32 |      2
    36 |      5
    40 |      9
(5 rows)

--test DELETE
DELETE FROM continuous_agg_test_ignore_invalidation_older_than WHERE timeval = 32;
DELETE FROM continuous_agg_test_ignore_invalidation_older_than WHERE timeval = 36;
SELECT * FROM _timescaledb_catalog.continuous_aggs_hypertable_invalidation_log;
 hypertable_id | modification_time | lowest_modified_value | greatest_modified_value 
---------------+-------------------+-----------------------+-------------------------
             7 |                40 |                    32 |                      32
             7 |                40 |                    36 |                      36
(2 rows)

refresh materialized view cagg_iia1;
LOG:  new materialization range not found for public.continuous_agg_test_ignore_invalidation_older_than (time column timeval): not enough new data past completion threshold of 42 as of 40
LOG:  materializing continuous aggregate public.cagg_iia1: processing invalidations, no new range
SELECT * FROM _timescaledb_catalog.continuous_aggs_materialization_invalidation_log order by 1;
 materialization_id | modification_time | lowest_modified_value | greatest_modified_value 
--------------------+-------------------+-----------------------+-------------------------
                  9 |                40 |                    32 |                      32
                  9 |                40 |                    36 |                      36
(2 rows)

--should see change only for the 36 bucket not 32
select * from cagg_iia1 order by 1;
 timed | cnt 
-------+-----
    10 |   3
    12 |   2
    32 |   1
    40 |   1
(4 rows)

--should see change to the 36 and 32
refresh materialized view cagg_iia2;
LOG:  new materialization range not found for public.continuous_agg_test_ignore_invalidation_older_than (time column timeval): not enough new data past completion threshold of 42 as of 40
LOG:  materializing continuous aggregate public.cagg_iia2: processing invalidations, no new range
select * from cagg_iia2 order by 1;
 timed | maxval 
-------+--------
     4 |      5
    10 |      9
    12 |     19
    40 |      9
(4 rows)

--sees no changes
refresh materialized view cagg_iia3;
LOG:  new materialization range not found for public.continuous_agg_test_ignore_invalidation_older_than (time column timeval): not enough new data past completion threshold of 42 as of 40
LOG:  materializing continuous aggregate public.cagg_iia3: nothing to invalidate, no new range
LOG:  materializing continuous aggregate public.cagg_iia3: no new range to materialize or invalidations found, exiting early
select * from cagg_iia3 order by 1;
 timed | maxval 
-------+--------
    10 |      5
    12 |      7
    32 |      2
    36 |      5
    40 |      9
(5 rows)

--change the parameter
ALTER VIEW cagg_iia3 set (timescaledb.ignore_invalidation_older_than = 100);
INSERT INTO continuous_agg_test_ignore_invalidation_older_than VALUES
 (10, -3, 20);
--sees the change now
SELECT * FROM _timescaledb_catalog.continuous_aggs_hypertable_invalidation_log;
 hypertable_id | modification_time | lowest_modified_value | greatest_modified_value 
---------------+-------------------+-----------------------+-------------------------
             7 |                40 |                    10 |                      10
(1 row)

refresh materialized view cagg_iia3;
LOG:  new materialization range not found for public.continuous_agg_test_ignore_invalidation_older_than (time column timeval): not enough new data past completion threshold of 42 as of 40
LOG:  materializing continuous aggregate public.cagg_iia3: processing invalidations, no new range
SELECT * FROM _timescaledb_catalog.continuous_aggs_materialization_invalidation_log order by 1;
 materialization_id | modification_time | lowest_modified_value | greatest_modified_value 
--------------------+-------------------+-----------------------+-------------------------
(0 rows)

select * from cagg_iia3 order by 1;
 timed | maxval 
-------+--------
    10 |     20
    12 |      7
    32 |      2
    36 |      5
    40 |      9
(5 rows)

