-- This file and its contents are licensed under the Timescale License.
-- Please see the included NOTICE for copyright information and
-- LICENSE-TIMESCALE for a copy of the license.
\c :TEST_DBNAME :ROLE_SUPERUSER
CREATE FUNCTION wait_for_retention_job_to_run_successfully(expected_runs INTEGER, spins INTEGER=:TEST_SPINWAIT_ITERS) RETURNS BOOLEAN LANGUAGE PLPGSQL AS
$BODY$
DECLARE
    r RECORD;
BEGIN
    FOR i in 1..spins
    LOOP
    SELECT total_successes, total_failures FROM _timescaledb_internal.bgw_job_stat WHERE job_id=2 INTO r;
    IF (r.total_successes = expected_runs) THEN
        RETURN true;
    ELSEIF (r.total_successes > expected_runs) THEN
        RAISE 'num_runs > expected';
    ELSE
        PERFORM pg_sleep(0.1);
    END IF;
    END LOOP;
    RAISE INFO 'wait_for_job_to_run: timeout after % tries', spins;
    RETURN false;
END
$BODY$;
\set client_min_messages TO NOTICE;
create or replace procedure job_fail(jobid int, config jsonb) language plpgsql as $$
begin
perform pg_sleep(2);
raise exception 'raising an exception';
end
$$;
-- very simple case: job that raises an exception
select add_job('job_fail', '4 minutes') as jobf_id \gset
-- test jobs that try to update concurrently
CREATE TABLE custom_log (
    a int,
    b int,
    msg text
);
insert into custom_log values (0, 0, 'msg0');
ALTER SYSTEM SET DEFAULT_TRANSACTION_ISOLATION TO 'serializable';
SELECT pg_reload_conf();
 pg_reload_conf 
----------------
 t
(1 row)

-- test a concurrent update
CREATE OR REPLACE PROCEDURE custom_proc1(jobid int, config jsonb) LANGUAGE PLPGSQL AS
$$
BEGIN
  UPDATE custom_log set msg = 'msg1' where msg = 'msg0';
  perform pg_sleep(10);
  COMMIT;
END
$$;
CREATE OR REPLACE PROCEDURE custom_proc2(jobid int, config jsonb) LANGUAGE PLPGSQL AS
$$
BEGIN
  UPDATE custom_log set msg = 'msg2' where msg = 'msg0';
  perform pg_sleep(10);
  COMMIT;
END
$$;
select add_job('custom_proc1', '2 min', initial_start => now());
 add_job 
---------
    1001
(1 row)

-- to make sure custom_log is first updated by custom_proc_1
select add_job('custom_proc2', '2 min', initial_start => now() + interval '5 seconds');
 add_job 
---------
    1002
(1 row)

SELECT _timescaledb_internal.start_background_workers();
 start_background_workers 
--------------------------
 t
(1 row)

-- enough time to for job_fail to fail
select pg_sleep(10);
 pg_sleep 
----------
 
(1 row)

select job_id, error_data->'proc_name' as proc_name, error_data->>'message' as err_message, error_data->>'sqlerrcode' as sqlerrcode
from _timescaledb_internal.job_errors where job_id = :jobf_id;
 job_id | proc_name  |     err_message      | sqlerrcode 
--------+------------+----------------------+------------
   1000 | "job_fail" | raising an exception | P0001
(1 row)

select delete_job(:jobf_id);
 delete_job 
------------
 
(1 row)

select pg_sleep(20);
 pg_sleep 
----------
 
(1 row)

-- exclude the retention policy
select job_id, error_data->>'message' as err_message, error_data->>'sqlerrcode' as sqlerrcode
from _timescaledb_internal.job_errors WHERE job_id != 2;
 job_id |                     err_message                     | sqlerrcode 
--------+-----------------------------------------------------+------------
   1000 | raising an exception                                | P0001
   1002 | could not serialize access due to concurrent update | 40001
(2 rows)

ALTER SYSTEM RESET DEFAULT_TRANSACTION_ISOLATION;
SELECT pg_reload_conf();
 pg_reload_conf 
----------------
 t
(1 row)

-- test the retention job
SELECT next_start FROM alter_job(2, next_start => '2060-01-01 00:00:00+00'::timestamptz);
          next_start          
------------------------------
 Wed Dec 31 16:00:00 2059 PST
(1 row)

TRUNCATE TABLE _timescaledb_internal.job_errors;
INSERT INTO _timescaledb_internal.job_errors(job_id, pid, start_time, finish_time, error_data)
VALUES (123, 12345, '2000-01-01 00:00:00+00'::timestamptz, '2000-01-01 00:00:10+00'::timestamptz, '{}'),
(456, 45678, '2000-01-01 00:00:20+00'::timestamptz, '2000-01-01 00:00:40+00'::timestamptz, '{}'),
-- not older than a month
(123, 23456, '2050-01-01 00:00:00+00'::timestamptz, '2050-01-01 00:00:10+00'::timestamptz, '{}');
-- 3 rows in the table before policy runs
SELECT * FROM _timescaledb_internal.job_errors;
 job_id |  pid  |          start_time          |         finish_time          | error_data 
--------+-------+------------------------------+------------------------------+------------
    123 | 12345 | Fri Dec 31 16:00:00 1999 PST | Fri Dec 31 16:00:10 1999 PST | {}
    456 | 45678 | Fri Dec 31 16:00:20 1999 PST | Fri Dec 31 16:00:40 1999 PST | {}
    123 | 23456 | Fri Dec 31 16:00:00 2049 PST | Fri Dec 31 16:00:10 2049 PST | {}
(3 rows)

-- drop all job_stats for the retention job
DELETE FROM _timescaledb_internal.bgw_job_stat WHERE job_id = 2;
SELECT  next_start FROM alter_job(2, next_start => now() + interval '2 seconds') \gset
SELECT wait_for_retention_job_to_run_successfully(1);
 wait_for_retention_job_to_run_successfully 
--------------------------------------------
 t
(1 row)

-- only the last row remains
SELECT * FROM _timescaledb_internal.job_errors;
 job_id |  pid  |          start_time          |         finish_time          | error_data 
--------+-------+------------------------------+------------------------------+------------
    123 | 23456 | Fri Dec 31 16:00:00 2049 PST | Fri Dec 31 16:00:10 2049 PST | {}
(1 row)

