\o /dev/null
\ir include/create_single_db.sql
SET client_min_messages = WARNING;
DROP DATABASE IF EXISTS single;
SET client_min_messages = NOTICE;
CREATE DATABASE single;
\c single
CREATE EXTENSION IF NOT EXISTS timescaledb;
SET timescaledb.disable_optimizations = :DISABLE_OPTIMIZATIONS;
\o
CREATE TABLE hyper (
  time BIGINT NOT NULL,
  device_id TEXT NOT NULL,
  sensor_1 NUMERIC NULL DEFAULT 1 CHECK (sensor_1 > 10)
);
SELECT * FROM create_hypertable('hyper', 'time', chunk_time_interval => 10);
 create_hypertable 
-------------------
 
(1 row)

--check and not-null constraints are inherited through regular inheritance.
\set ON_ERROR_STOP 0
INSERT INTO hyper(time, device_id,sensor_1) VALUES
(1257987700000000000, 'dev2', 9);
ERROR:  new row for relation "_hyper_1_1_chunk" violates check constraint "hyper_sensor_1_check"
INSERT INTO hyper(time, device_id,sensor_1) VALUES
(1257987700000000000, NULL, 11);
ERROR:  null value in column "device_id" violates not-null constraint
\set ON_ERROR_STOP 1
INSERT INTO hyper(time, device_id,sensor_1) VALUES
(1257987700000000000, 'dev2', 11);
INSERT INTO hyper(time, device_id,sensor_1) VALUES
(1257987700000000000, 'dev2', 11);
----------------------- UNIQUE CONSTRAINTS ------------------
CREATE TABLE hyper_unique (
  time BIGINT NOT NULL UNIQUE,
  device_id TEXT NOT NULL,
  sensor_1 NUMERIC NULL DEFAULT 1 CHECK (sensor_1 > 10)
);
SELECT * FROM create_hypertable('hyper_unique', 'time', chunk_time_interval => 10);
 create_hypertable 
-------------------
 
(1 row)

INSERT INTO hyper_unique(time, device_id,sensor_1) VALUES
(1257987700000000000, 'dev2', 11);
INSERT INTO hyper_unique(time, device_id,sensor_1) VALUES
(1257987800000000000, 'dev2', 11);
\set ON_ERROR_STOP 0
INSERT INTO hyper_unique(time, device_id,sensor_1) VALUES
(1257987700000000000, 'dev2', 11);
ERROR:  duplicate key value violates unique constraint "4_1_hyper_unique_time_key"
\set ON_ERROR_STOP 1
\d+ hyper
                          Table "public.hyper"
  Column   |  Type   | Modifiers | Storage  | Stats target | Description 
-----------+---------+-----------+----------+--------------+-------------
 time      | bigint  | not null  | plain    |              | 
 device_id | text    | not null  | extended |              | 
 sensor_1  | numeric | default 1 | main     |              | 
Indexes:
    "hyper_time_idx" btree ("time" DESC)
Check constraints:
    "hyper_sensor_1_check" CHECK (sensor_1 > 10::numeric)
Child tables: _timescaledb_internal._hyper_1_3_chunk

\d+ hyper_unique
                       Table "public.hyper_unique"
  Column   |  Type   | Modifiers | Storage  | Stats target | Description 
-----------+---------+-----------+----------+--------------+-------------
 time      | bigint  | not null  | plain    |              | 
 device_id | text    | not null  | extended |              | 
 sensor_1  | numeric | default 1 | main     |              | 
Indexes:
    "hyper_unique_time_key" UNIQUE CONSTRAINT, btree ("time")
Check constraints:
    "hyper_unique_sensor_1_check" CHECK (sensor_1 > 10::numeric)
Child tables: _timescaledb_internal._hyper_2_4_chunk,
              _timescaledb_internal._hyper_2_5_chunk

--should have unique constraint not just unique index
\d+ _timescaledb_internal._hyper_2_4_chunk
             Table "_timescaledb_internal._hyper_2_4_chunk"
  Column   |  Type   | Modifiers | Storage  | Stats target | Description 
-----------+---------+-----------+----------+--------------+-------------
 time      | bigint  | not null  | plain    |              | 
 device_id | text    | not null  | extended |              | 
 sensor_1  | numeric | default 1 | main     |              | 
Indexes:
    "4_1_hyper_unique_time_key" UNIQUE CONSTRAINT, btree ("time")
Check constraints:
    "constraint_4" CHECK ("time" >= '1257987700000000000'::bigint AND "time" < '1257987700000000010'::bigint)
    "hyper_unique_sensor_1_check" CHECK (sensor_1 > 10::numeric)
Inherits: hyper_unique

ALTER TABLE hyper_unique DROP CONSTRAINT hyper_unique_time_key;
\d+ _timescaledb_internal._hyper_2_4_chunk
             Table "_timescaledb_internal._hyper_2_4_chunk"
  Column   |  Type   | Modifiers | Storage  | Stats target | Description 
-----------+---------+-----------+----------+--------------+-------------
 time      | bigint  | not null  | plain    |              | 
 device_id | text    | not null  | extended |              | 
 sensor_1  | numeric | default 1 | main     |              | 
Check constraints:
    "constraint_4" CHECK ("time" >= '1257987700000000000'::bigint AND "time" < '1257987700000000010'::bigint)
    "hyper_unique_sensor_1_check" CHECK (sensor_1 > 10::numeric)
Inherits: hyper_unique

--uniqueness not enforced
INSERT INTO hyper_unique(time, device_id,sensor_1) VALUES
(1257987700000000000, 'dev3', 11);
--shouldn't be able to create constraint
\set ON_ERROR_STOP 0
ALTER TABLE hyper_unique ADD CONSTRAINT hyper_unique_time_key UNIQUE (time);
ERROR:  could not create unique index "4_3_hyper_unique_time_key"
\set ON_ERROR_STOP 1
DELETE FROM hyper_unique WHERE device_id = 'dev3';
--now can create
ALTER TABLE hyper_unique ADD CONSTRAINT hyper_unique_time_key UNIQUE (time);
\d+ _timescaledb_internal._hyper_2_4_chunk
             Table "_timescaledb_internal._hyper_2_4_chunk"
  Column   |  Type   | Modifiers | Storage  | Stats target | Description 
-----------+---------+-----------+----------+--------------+-------------
 time      | bigint  | not null  | plain    |              | 
 device_id | text    | not null  | extended |              | 
 sensor_1  | numeric | default 1 | main     |              | 
Indexes:
    "4_4_hyper_unique_time_key" UNIQUE CONSTRAINT, btree ("time")
Check constraints:
    "constraint_4" CHECK ("time" >= '1257987700000000000'::bigint AND "time" < '1257987700000000010'::bigint)
    "hyper_unique_sensor_1_check" CHECK (sensor_1 > 10::numeric)
Inherits: hyper_unique

--test adding constraint with same name to different table -- should fail
\set ON_ERROR_STOP 0
ALTER TABLE hyper ADD CONSTRAINT hyper_unique_time_key UNIQUE (time);
ERROR:  relation "hyper_unique_time_key" already exists
\set ON_ERROR_STOP 1
--uniquness violation fails
\set ON_ERROR_STOP 0
INSERT INTO hyper_unique(time, device_id,sensor_1) VALUES
(1257987700000000000, 'dev2', 11);
ERROR:  duplicate key value violates unique constraint "4_4_hyper_unique_time_key"
\set ON_ERROR_STOP 1
--cannot create unique constraint on non-partition column
\set ON_ERROR_STOP 0
ALTER TABLE hyper_unique ADD CONSTRAINT hyper_unique_invalid UNIQUE (device_id);
ERROR:  Cannot create a unique index without the column: time (used in partitioning)
\set ON_ERROR_STOP 1
----------------------- PRIMARY KEY  ------------------
CREATE TABLE hyper_pk (
  time BIGINT NOT NULL PRIMARY KEY,
  device_id TEXT NOT NULL,
  sensor_1 NUMERIC NULL DEFAULT 1 CHECK (sensor_1 > 10)
);
SELECT * FROM create_hypertable('hyper_pk', 'time', chunk_time_interval => 10);
 create_hypertable 
-------------------
 
(1 row)

INSERT INTO hyper_pk(time, device_id,sensor_1) VALUES
(1257987700000000000, 'dev2', 11);
\set ON_ERROR_STOP 0
INSERT INTO hyper_pk(time, device_id,sensor_1) VALUES
(1257987700000000000, 'dev2', 11);
ERROR:  duplicate key value violates unique constraint "6_6_hyper_pk_pkey"
\set ON_ERROR_STOP 1
--should have unique constraint not just unique index
\d+ _timescaledb_internal._hyper_3_6_chunk
             Table "_timescaledb_internal._hyper_3_6_chunk"
  Column   |  Type   | Modifiers | Storage  | Stats target | Description 
-----------+---------+-----------+----------+--------------+-------------
 time      | bigint  | not null  | plain    |              | 
 device_id | text    | not null  | extended |              | 
 sensor_1  | numeric | default 1 | main     |              | 
Indexes:
    "6_6_hyper_pk_pkey" PRIMARY KEY, btree ("time")
Check constraints:
    "constraint_6" CHECK ("time" >= '1257987700000000000'::bigint AND "time" < '1257987700000000010'::bigint)
    "hyper_pk_sensor_1_check" CHECK (sensor_1 > 10::numeric)
Inherits: hyper_pk

ALTER TABLE hyper_pk DROP CONSTRAINT hyper_pk_pkey;
\d+ _timescaledb_internal._hyper_3_6_chunk
             Table "_timescaledb_internal._hyper_3_6_chunk"
  Column   |  Type   | Modifiers | Storage  | Stats target | Description 
-----------+---------+-----------+----------+--------------+-------------
 time      | bigint  | not null  | plain    |              | 
 device_id | text    | not null  | extended |              | 
 sensor_1  | numeric | default 1 | main     |              | 
Check constraints:
    "constraint_6" CHECK ("time" >= '1257987700000000000'::bigint AND "time" < '1257987700000000010'::bigint)
    "hyper_pk_sensor_1_check" CHECK (sensor_1 > 10::numeric)
Inherits: hyper_pk

--uniqueness not enforced
INSERT INTO hyper_pk(time, device_id,sensor_1) VALUES
(1257987700000000000, 'dev3', 11);
--shouldn't be able to create pk
\set ON_ERROR_STOP 0
ALTER TABLE hyper_pk ADD CONSTRAINT hyper_pk_pkey PRIMARY KEY (time);
ERROR:  could not create unique index "6_7_hyper_pk_pkey"
\set ON_ERROR_STOP 1
DELETE FROM hyper_pk WHERE device_id = 'dev3';
--cannot create pk constraint on non-partition column
\set ON_ERROR_STOP 0
ALTER TABLE hyper_pk ADD CONSTRAINT hyper_pk_invalid PRIMARY KEY (device_id);
ERROR:  Cannot create a unique index without the column: time (used in partitioning)
\set ON_ERROR_STOP 1
--now can create
ALTER TABLE hyper_pk ADD CONSTRAINT hyper_pk_pkey PRIMARY KEY (time);
\d+ _timescaledb_internal._hyper_3_6_chunk
             Table "_timescaledb_internal._hyper_3_6_chunk"
  Column   |  Type   | Modifiers | Storage  | Stats target | Description 
-----------+---------+-----------+----------+--------------+-------------
 time      | bigint  | not null  | plain    |              | 
 device_id | text    | not null  | extended |              | 
 sensor_1  | numeric | default 1 | main     |              | 
Indexes:
    "6_8_hyper_pk_pkey" PRIMARY KEY, btree ("time")
Check constraints:
    "constraint_6" CHECK ("time" >= '1257987700000000000'::bigint AND "time" < '1257987700000000010'::bigint)
    "hyper_pk_sensor_1_check" CHECK (sensor_1 > 10::numeric)
Inherits: hyper_pk

--test adding constraint with same name to different table -- should fail
\set ON_ERROR_STOP 0
ALTER TABLE hyper ADD CONSTRAINT hyper_pk_pkey UNIQUE (time);
ERROR:  relation "hyper_pk_pkey" already exists
\set ON_ERROR_STOP 1
--uniquness violation fails
\set ON_ERROR_STOP 0
INSERT INTO hyper_pk(time, device_id,sensor_1) VALUES
(1257987700000000000, 'dev2', 11);
ERROR:  duplicate key value violates unique constraint "6_8_hyper_pk_pkey"
\set ON_ERROR_STOP 1
----------------------- FOREIGN KEY  ------------------
CREATE TABLE devices(
    device_id TEXT NOT NULL,
    PRIMARY KEY (device_id)
);
CREATE TABLE hyper_fk (
  time BIGINT NOT NULL PRIMARY KEY,
  device_id TEXT NOT NULL REFERENCES devices(device_id),
  sensor_1 NUMERIC NULL DEFAULT 1 CHECK (sensor_1 > 10)
);
SELECT * FROM create_hypertable('hyper_fk', 'time', chunk_time_interval => 10);
 create_hypertable 
-------------------
 
(1 row)

--fail fk constraint
\set ON_ERROR_STOP 0
INSERT INTO hyper_fk(time, device_id,sensor_1) VALUES
(1257987700000000000, 'dev2', 11);
ERROR:  insert or update on table "_hyper_4_7_chunk" violates foreign key constraint "7_10_hyper_fk_device_id_fkey"
\set ON_ERROR_STOP 1
INSERT INTO devices VALUES ('dev2');
INSERT INTO hyper_fk(time, device_id,sensor_1) VALUES
(1257987700000000000, 'dev2', 11);
--delete should fail
\set ON_ERROR_STOP 0
DELETE FROM devices;
ERROR:  update or delete on table "devices" violates foreign key constraint "8_12_hyper_fk_device_id_fkey" on table "_hyper_4_8_chunk"
\set ON_ERROR_STOP 1
ALTER TABLE hyper_fk DROP CONSTRAINT hyper_fk_device_id_fkey;
--should now be able to add non-fk rows
INSERT INTO hyper_fk(time, device_id,sensor_1) VALUES
(1257987700000000001, 'dev3', 11);
--can't add fk because of dev3 row
\set ON_ERROR_STOP 0
ALTER TABLE hyper_fk ADD CONSTRAINT hyper_fk_device_id_fkey 
FOREIGN KEY (device_id) REFERENCES devices(device_id);
ERROR:  insert or update on table "_hyper_4_8_chunk" violates foreign key constraint "8_13_hyper_fk_device_id_fkey"
\set ON_ERROR_STOP 1
DELETE FROM hyper_fk WHERE device_id = 'dev3';
ALTER TABLE hyper_fk ADD CONSTRAINT hyper_fk_device_id_fkey 
FOREIGN KEY (device_id) REFERENCES devices(device_id);
\set ON_ERROR_STOP 0
INSERT INTO hyper_fk(time, device_id,sensor_1) VALUES
(1257987700000000002, 'dev3', 11);
ERROR:  insert or update on table "_hyper_4_8_chunk" violates foreign key constraint "8_14_hyper_fk_device_id_fkey"
\set ON_ERROR_STOP 1
----------------------- FOREIGN KEY INTO A HYPERTABLE  ------------------
--FOREIGN KEY references into a hypertable are currently broken.
--The referencing table will never find the corresponding row in the hypertable
--since it will only search the parent. Thus any insert will result in an ERROR
--TODO: block such foreign keys or fix. (Hard to block on create table so punting for now)
CREATE TABLE hyper_for_ref (
  time BIGINT NOT NULL PRIMARY KEY,
  device_id TEXT NOT NULL,
  sensor_1 NUMERIC NULL DEFAULT 1 CHECK (sensor_1 > 10)
);
SELECT * FROM create_hypertable('hyper_for_ref', 'time', chunk_time_interval => 10);
 create_hypertable 
-------------------
 
(1 row)

\set ON_ERROR_STOP 0
CREATE TABLE referrer (
    time BIGINT NOT NULL REFERENCES hyper_for_ref(time)
);
ERROR:  Foreign keys to hypertables are not supported.
\set ON_ERROR_STOP 1
CREATE TABLE referrer2 (
   time BIGINT NOT NULL
);
\set ON_ERROR_STOP 0
ALTER TABLE referrer2 ADD CONSTRAINT hyper_fk_device_id_fkey 
FOREIGN KEY (time) REFERENCES  hyper_for_ref(time);
ERROR:  Foreign keys to hypertables are not supported.
\set ON_ERROR_STOP 1
----------------------- EXCLUSION CONSTRAINT  ------------------
CREATE TABLE hyper_ex (
    time BIGINT,
    device_id TEXT NOT NULL REFERENCES devices(device_id),
    sensor_1 NUMERIC NULL DEFAULT 1 CHECK (sensor_1 > 10),
    canceled boolean DEFAULT false,
    EXCLUDE USING btree (
        time WITH =, device_id WITH =
    ) WHERE (not canceled)
);
SELECT * FROM create_hypertable('hyper_ex', 'time', chunk_time_interval=>_timescaledb_internal.interval_to_usec('1 month'));
 create_hypertable 
-------------------
 
(1 row)

INSERT INTO hyper_ex(time, device_id,sensor_1) VALUES
(1257987700000000000, 'dev2', 11);
\set ON_ERROR_STOP 0
INSERT INTO hyper_ex(time, device_id,sensor_1) VALUES
(1257987700000000000, 'dev2', 12);
ERROR:  conflicting key value violates exclusion constraint "9_15_hyper_ex_time_device_id_excl"
\set ON_ERROR_STOP 1
ALTER TABLE hyper_ex DROP CONSTRAINT hyper_ex_time_device_id_excl;
--can now add
INSERT INTO hyper_ex(time, device_id,sensor_1) VALUES
(1257987700000000000, 'dev2', 12);
--cannot add because of conflicts
\set ON_ERROR_STOP 0
ALTER TABLE hyper_ex ADD CONSTRAINT hyper_ex_time_device_id_excl
    EXCLUDE USING btree (
        time WITH =, device_id WITH =
    ) WHERE (not canceled)
;
ERROR:  could not create exclusion constraint "9_17_hyper_ex_time_device_id_excl"
\set ON_ERROR_STOP 1
DELETE FROM hyper_ex WHERE sensor_1 = 12;
ALTER TABLE hyper_ex ADD CONSTRAINT hyper_ex_time_device_id_excl
    EXCLUDE USING btree (
        time WITH =, device_id WITH =
    ) WHERE (not canceled)
;
\set ON_ERROR_STOP 0
INSERT INTO hyper_ex(time, device_id,sensor_1) VALUES
(1257987700000000000, 'dev2', 12);
ERROR:  conflicting key value violates exclusion constraint "9_18_hyper_ex_time_device_id_excl"
\set ON_ERROR_STOP 1
--cannot add exclusion constraint without partition key.
CREATE TABLE hyper_ex_invalid (
    time BIGINT,
    device_id TEXT NOT NULL REFERENCES devices(device_id),
    sensor_1 NUMERIC NULL DEFAULT 1 CHECK (sensor_1 > 10),
    canceled boolean DEFAULT false,
    EXCLUDE USING btree (
        device_id WITH =
    ) WHERE (not canceled)
);
\set ON_ERROR_STOP 0
SELECT * FROM create_hypertable('hyper_ex_invalid', 'time', chunk_time_interval=>_timescaledb_internal.interval_to_usec('1 month'));
ERROR:  Cannot create a unique index without the column: time (used in partitioning)
\set ON_ERROR_STOP 1
